id,wh
617,এরপর প্রাকৃত ভাষা যখন বিবর্তনের দ্বিতীয় স্তরে পৌঁছায় তখন মূলত এরোম চার রকমের মৌখিক প্রকৃতি থেকে পাঁচ রকমের সাহিত্যিক প্রকৃতির জন্ম হয়
618,পৈশাচী মহারাষ্ট্রীয় সৌর শ্রেণী অর্দমাগতি এবং মাগতি ছিল শুধু সাহিত্যের ব্যবহৃত প্রাকৃতিক
619,যেমন পৈশাচী প্রাকৃত থেকে পৈশাচী অপভ্রংশ মহারাষ্ট্র প্রাকৃত থেকে মহারাষ্ট্রি অপভ্রংশ সৌর শ্রেণী থেকে সৌর শ্রেণী অপভ্রংশ অর্দমাগদি থেকে অর্দমাগদি অপপ্রংশ এবং মাগদি প্রাকৃত থেকে মাগদি অপভ্রংশ তৈরি হয়
620,এরপর ভারতীয় আর্য ভাষা তৃতীয় যুগে পদার্পণ করে এই সময়ে এক একটি অপ্র অংশ থেকে একাধিক ভাষা জন্মলাভ করে
621,যেমন পৈশাচী অপভ্রংশ থেকে পাঞ্জাবি মহারাষ্ট্রীয় অপভ্রংশ থেকে মারাঠি সৌর শ্রেণী থেকে হিন্দি অর্দমাগতি থেকে অবধি
622,মাগদি থেকে পশ্চিমা বা পূর্বে দুনামে দুটি ভাগে বিভক্ত হয়ে পড়ে এর মধ্যে পূর্বে ভাষাটি বঙ্গ অসমীয়া আর ওডিআই
623,পরিবর্তিত লাভ করে পরবর্তীকালে বঙ্গ অসমীয়া ভাষাটি আবার বাংলা ভাষার উদ্ভব ঘটায়
624,ত্রিশ প্যাকেট কারবেরি ডেয়ারি মিল্ক চকলেট এখন কত টাকায় বিক্রি হচ্ছে
625,কুড়ি হাজার ত্রিশ হাজার চল্লিশ হাজার পঞ্চাশ হাজার ষাট হাজার
626,পশ্চিমবঙ্গ বিহার ঝাড়খন্ড মধ্যপ্রদেশ উত্তরপ্রদেশ
627,পাঁচ সেপ্টেম্বর চৌদ্দ ফেব্রুয়ারি ছাব্বিশ জানুয়ারি পনের আগস্ট পনের জুন
628,আমার এখনো অবধি লেখা সবচেয়ে প্রিয় কবিতা যেটি আমি লিখেছিলাম তার বিষয়বস্তু হল
629,রাস্তা ঘাটে চলার সময় মহিলাদের যে সমস্ত সমস্যার সম্মুখীন হতে হয় বা রাত্রির অন্ধকারে যখন মহিলারা নিজেদেরকে নিরাপদ অনুভব করতে পারেন না
630,তখন তারা করেন কি আমি সর্বদা ইংরেজি ভাষাতে লিখতে পছন্দ করি এবং আমার এই লেখাটি লিখতে অনুপ্রাণিত করেছেন আমার বাবা কারণ তিনি সর্বদা ছোট থেকেই আমাকে উৎসাহিত করেছেন
631,অনেক ধরনের গল্পের বই লেখালেখি ম্যাগাজিন ইত্যাদি পড়িয়ে এবং তিনিও লেখালেখি জগতে আছেন তাই আমি লিখতে ভালোবাসি নিজের বাবার অনুপ্রেরণায়
632,হ্যালো
633,হ্যাঁ আমি একজন বলছি যে আপনার কি সবজির দোকান আছে
634,হ্যাঁ মানে আমি কিছু সবজি চিনব বলে আপনাকে বিবেচনা করছি মানে অভিম অর্ডার দেব একটা সবজি হ্যাঁ তো আপনার দোকানে কি কি সবজি
635,ফাইস পাইচেন্ট
636, কত করে খেয়েছি আলু
637,আচ্ছা
638,আচ্ছা আমি যদি একটু বেশি করে নিই তাহলে আপনি কি জানতে নিয়ে কথাটা পারবেন
639,আমি তোমাকে পাঁচ কেজির মধ্যে নেব
640,না তেইশ টাকা না আপনি আট শো টাকা বিক্রি করতে হবে
641,এটা দেখুন আপনি যদি একটু দাম কম করেন তাহলে আমি বাকি সবজিও নিতে পারি সেজন্য বলছি
642,কত কিনা
643,ওদের তো কম হবে না
644,এক কেজি নয় চার কেজি নেব
645,পঁয়তাল্লিশ চার কেজি ব্যবহার করছি মাত্র পঁয়তাল্লিশ
646,না না চল্লিশ টাকা করুন চল্লিশ টাকা করুন
647,নানা পাঁচ কেজি নয় আমি চার কেজি নেব চল্লিশ টাকা
648,আমি তো শুধু একটা সবজি দেওয়া নিচ্ছি না আমি তো আলুও নিচ্ছি
649,আচ্ছা পেঁয়াজে নেব আদা রসুন সবকিছুই নেব তো এই ধরনের আমি দামগুলো একটু কম করতে বলছি পেঁয়াজ কত করে
650,কিন্তু কম হবে না
651,ওই পাঁচ থেকে ছয় বেজির মতো নেবে
652,আচ্ছা আপনাদের দোকানে কি এমন কোনো মানের লোকজন আসে যে আমার বাড়িতে একটু ডেইলিভাবে দিয়ে যেতে পারবে সবজিগুলো আমি ডান হাতে টাকাটা দিয়ে দিতাম আঙ্কেল
653,চামিল
654, আচ্ছা আপনারা কি গুগল পেয়ে আছেন
655,থাইছে
656,আর আপনার দোকানটা কোথায় গেল
657,ওহ হ্যাঁ হ্যাঁ হ্যাঁ হ্যাঁ
658,আমি একজনের কাছ থেকে নাম্বারটা পেলাম মানে আমার এগুলো খুব আর্জেন্ট দরকার বুঝলেন তো মানে আনতে যাওয়ার মতো সময় নেই এই কারণেই আমার একজনকে লাভ করেছি তো আপনার ক্ষেত্রে আমার শক্তি খুব হেল্প করল যদি একটু দামগুলো কম করেন তাহলে খুব ভালো হয় না
659,হ্যাঁ হ্যাঁ হ্যাঁ বাড়িতে তো অনুষ্ঠান আছে কি পুজোর ব্যাপার আছে তো
660,ওই কারণে
661,ভালো হয়
662, আচ্ছা আচ্ছা আচ্ছা
663,আরেকটি
664, আলু আপনি পার্ক সেভিস হ্যাঁ হার্ট পিনার্স আছে
665, ও পতন নেব শান্তিজির মতো
666, পেঁয়াজ নেব আপনার ছকেজির মতো দিয়ে দিন
667,আচ্ছা ঝিঙে আছে ঝিঙে বেরি
668,আচ্ছা ঝিঙে দানে এক কেজির মতো দিয়ে দেবে
669, তুমি একটা জীবন তো দিয়ে দেবে আর আদা চার সেগুলো পাঁচ ফর্ম তো দেবেন
670,ঠিক আছে
671,হ্যাঁ হ্যাঁ ঠিক আছে ঠিক আছে ধন্যবাদ ঠিক আছে হ্যাঁ হ্যাঁ ঠিক
672,বিষয় বলতে সেক্ষেত্রে অনেক কিছুই তো সন্দেহ প্রবণ হয়ে থাকে তার মধ্যে বর্তমান সময়ে একটা জিনিস উঠে এসেছে যে তৃতীয় লিঙ্গের ব্যাপারটা
673,তৃতীয় লিঙ্গ বলতে যে সমস্ত যেমন ছেলের সাথে ছেলের সম্পর্ক বা মেয়ের সাথে মেয়ের যে একটা সম্পর্কের বীজ তৈরি হয়েছে বর্তমান সময়ে আবার বলা যেতে পারে যে
674,জন্মগত ছেলে সূত্র থেকেও সে মেয়ের দিকে ঝোঁক বেশি সে তার লিঙ্গ পরিবর্তনের মাধ্যমে ছেলে থেকে মেয়ের পরিবর্তন হচ্ছে সেক্ষেত্রে হয়তো একটা আড়ম্বন তৈরি করেছে ভারতে
675,সেক্ষেত্রে হয়তো সেই বিষয় নিয়ে লেখাটা একটু সন্দেহজনক বলা যেতে পারে কারণ এই বিষয়টা নিয়ে তো অনেকটাই
676,সন্দেহের ব্যাপার রয়েছে সেক্ষেত্রে অনেকে এই বিষয় নিয়ে কথা বলতেও চায় না আবার বিষয়টিকে নিয়ে একটু আলোচনাও করতে চায় না সেক্ষেত্রে একটা সমস্যা রয়েই আছে
677,পশ্চিমবঙ্গ বিহার উড়িষ্যা ঝাড়খণ্ড কর্ণাটক
678,আমাদের পশ্চিম বর্ধমানে অনেক কোটি উৎসব আছে তার মধ্যে প্রধান উৎসব দুর্গাপুজো হচ্ছে
679,দুর্গাপুজো ছাড়াও আমরা পয়লা বৈশাখ হলি সংক্রান্তির দীপাবলি আরও অনেক উৎসব মানায়
680,দুর্গাপুজোর সময় আমরা দুর্গামায়ে পুজো করি সব ঘরে খুবই আনন্দ থাকে লোকে নতুন কাপড় বেরোয় লোকে নিজে গুরুজন ওদিকে ঘুরতে বেরোয় ঠাকুর দেখতে পেরোয় এবং প্যান্ডেল দেখে লোকে রাত রাত জেগে নতুন নতুন ঠাকুর দেখে এমনিভাবে আমরা দুর্গাপুজোয় মানাই
681,দুর্গাপুজোর চার দিন আমরা খুব আনন্দত থাকি পুরোনো বন্ধুদের সঙ্গে দেখা হয় এমনি ভাবে কাটে চার দিন
682,পয়লা পয়সা এমন একটা উৎসব যেটা আমাদের বাংলায় এক বছর শেষ হলে মানানো হয়
683,নতুন বছর শুরু হতে হতে একটা উৎসাহ থাকে মনের মধ্যে সবাই বাঙালিরাও দিন মিষ্টি খায় লোকে মিষ্টি দেয় আর খুব ভালোভাবে এই উৎসবটা মানানো হয়
684,ওই উৎসবটা আমাদেরকে বোঝায় কি নতুন বছর শুরু হচ্ছে আর পুরোনোটা শেষ হল তো যা হল শেষ হয়েছে এবার নতুন বছরে যা হবে ওটা করা
685,এমনিভাবে আমরা পয়লা বৈশাখ মানাই দিওয়ালি আবার এমন উৎসব যেদিকে ফটকা ফাটিয়ে আমরা উৎসবটাকে মানাই
686,আলাদা আলাদা ধরণের ফটকা ফাটাই আবার আমরা এবং ঘুরে বেড়াই ওইদিন আমরা খুব লোকের ঘরে তুনি বাল্ব দেখতে পাব তুনি বাল্ব জলে আলাদা আলাদা রঙ দেখতে পাব আমরা ওইদিন ঘরে ওটা খুব লাইট ভালা ফেস্টিভ্যাল হচ্ছে আর দিবালির দিন আমরা বড়দে গুরুজন দেখে প্রণাম করি
687,হলির দিন আমরা রঙ দিয়ে খেলি লোককে রঙ মাখাই গুরুজনে পায়ে রঙ লাগাই আর আমরা বন্ধুদের সঙ্গে রঙ বানাই
688,পাঁচেই অগ্রাহন সাতেই জ্যেষ্ঠ নয়েই মাঘ তেরোই ফাল্গুন চারেই বৈশাখ
689,আমাদের চিরকালের প্রথা আমরা দেখে এসেছি একটি নবজাতক
690,তাদের একটি শিশুর জন্ম হল তার পরে ছয় দিন গেল তার পরে ছয় দিন পরেই ষষ্ঠী পুজো
691,তারপরে তার একুশ দিনের আঁতুড় ঘরে থাকা তার মায়ের সাথে মা এবং শিশু দুজনেই
692,এবং সেই সময়টা শিশুকে কোথাও বার করা হয় না তার পরে ছয় মাসের মাথায়
693,তার অন্য প্রাসন হয় অর্থাৎ মুখে ভাত এটি একটি বিশাল অনুষ্ঠান এবং তখন তার পরেও শিশুকে খুব যত্নে রাখতে হয় বাইরে বার করা হয় না তার একটা কারণ
694,বিভিন্ন রকমের সংক্রমণের হাত থেকে যাতে শিশুটি নিজেকে বাঁচিয়ে রাখতে পারে বা তাকে বাঁচিয়ে রাখা যায়
695,মহারাষ্ট্র কেরালা পশ্চিমবঙ্গ জম্মুকাশ্মীর
696,তামিলনাড়ু
697,হ্যালো
698,আপনি কি শুভ মা বলছেন
699,আমিও টিউশন থেকে বলছিলাম
700, বলছি আমরা একটা পুরুলিয়াতে পিকনিকের জন্য প্ল্যান করছি শুভ কি আমাদের সাথে যেতে পারে
701,টা সামনের মাসের পাঁচ তারিখ
702,না না শুধু ছাত্রদেরকে নিয়েই করছি আর কি
703,না অভিভাবকেরা যেতে পারবে না কারণ এটা তো ছাত্রদেরকে নিয়ে করছি তারা তাদের মতো মজা করবে আরে অভিভাবকারে গেলে তো তাদের অসুবিধা আরে হতে পারে তারাও ঠিকমতো ইঞ্জয় করতে পারবে না সেই জন্য আর কি
704,না আমার সঙ্গে আরও টিউশনের আরও দু তিনটে স্যার যাচ্ছে আর কি সকলে মিলে একসাথে দেখে রাখব কিন্তু বাচ্চাদেরকে জিজ্ঞাসা করছিলাম যে তারা অভিভাবকের সাথে যেতে চায় নাকি বেশিরভাগই বলছে যে যেতে চায় না কারণ তারা সব জায়গায় তো অভিভাবকের সাথে চায় এই জায়গাটা নিজেরা গিয়ে মজা করতে চায় আর কিছুই জন্য
705,বাচ্চাদের ইচ্ছা অনুযায়ী করছি কারণ যদি বলি যে আমরা অভিভাবকদেরকে নিয়ে যাব তখন বেশিরভাগ বাচ্চাই বলবে যে তারা যেতে যায় না এবং তারা যদি বলে যে তারা যেতে যায় না তারা তাদের অভিভাবকেরাও আর জোর করে তাদেরকে পাঠাবে না তাহলে আমাদের পিকনিকটা কাউন্সিল হয়ে যাবে
706,সেটাও ঠিক কিন্তু এবার বাচ্চারা যদি তখন ঠিকভাবে গিয়ে সেখানে মজা আর না করতে পারে তখন ফিরে এসে বলব স্যাম নিয়ে গেলেন এই রকম হল বাড়ির লোকের সাথে গিয়ে আমরা কিছুই করতে পারলাম না ঘুরতে পেরলাম না
707,আর তো তাহলে আপনার বাবার সাথে আর আলোচনা করে খুব শীঘ্রই জানাবেন কারণ আমাদেরকে তো সবকিছু কেনাকাটা করতে হবে বাসারে বুক করতে হবে তো এই জন্য
708,তাহলে সেই মাটা আমরা গাড়ি এলে বুকিং করবো
709,না আজ রাত্রে যাব কাল থাকা হবে পরশুদিন সকালের মধ্যে আসব
710,আচ্ছা তাহলে আলোচনা করে জানাবেন
711,ঠিক আছে হুম
712,দুই লক্ষ পঞ্চাশ হাজার তিন লক্ষ চল্লিশ হাজার দুই হাজার ত্রিশ দুই হাজার পাঁচ এক লক্ষ পঞ্চাশ হাজার
713,গত ছয় দিন আগে আমি যে লিপস্টিক কিনেছিলাম তার রংটা খুবই ভালো
714,সাহায্য
715,এটি প্রাথমিক ও মাধ্যমিক বিদ্যালয়ের শিশুদের জন্য একটি সরকারি ছুটির দিন
716,একশ দুশ তিনশ চারশ পাঁচশ
717,চার
718,আমি গত পাঁচ দিন আগে মন ইলেকট্রনিক্স থেকে একটা ক্যামেরা কিনেছিলাম সেই ক্যামেরা কিনে আমি খুবই সন্তুষ্ট আছি সেই ক্যামেরাতে যে সমস্ত লেখা আছে সমস্ত কিছু মিলে গেছে সেগুলো সমস্ত কিছু কাজ করছে ঠিকমতো
719,তাই আমার মনে হয় যে যারা আরো এরকম ক্যামেরা কিনতে ইচ্ছুক তারা সেই মোহন ইলেকট্রনিক্স থেকেই কিনবেন
720,রাতে সুরক্ষিতভাবে বাড়ি ফেরার জন্য প্রথমত যা করা উচিত তা হল যে অটো ড্রাইভারের অটো আমি ভাড়া করেছিলাম তাকে কিছুক্ষণ অপেক্ষা করতে বলা উচিত কারণ রাতে বেশির ভাগ সময় অটো পাওয়া যায় না
721,আর নিজের কাছে ফোন থাকা এবং টর্চ থাকা অত্যন্ত আবশ্যক এবং যখন অটো ড্রাইভার আমাকে বাড়ি পৌঁছে দেবেন সুরক্ষিতভাবে তাকে ওনাকে ধন্যবাদ বলা উচিত
722,আমি ব্যক্তিগতভাবে কোনো ধরনের কুসংস্কারকেই মান্যতা দিই না ধর্মীয় কুসংস্কারও আমার কাছে এক ধরনের গোঁড়ামি
723,আমার দেখা এরকম পুসংস্কার রয়েছে যেটা এখনও অনুসরণ করা হয় যেমন আমরা দেখি যে কোনো পূজার দান হিসেবে পশুবলি করা হয় পশুবলি দান একটা
724,অন্য রকমের ধর্মীয় কুসংস্কার যেটা এখনো মানুষের মনে রয়ে গেছে মানুষকে এই সমস্যার মোকাবিলা করা উচিত এই ভাবে যে মানুষের মনে এই ধারণাটা দেওয়া উচিত যে পশু বলি
725,কোন ভগবানের নির্দেশ হতে পারে না অর্থাৎ পশু বলি দিয়ে ভগবানকে সন্তুষ্ট করা যায় না কারণ ভগবানের সন্তানও হচ্ছেন
726,সন্তান হচ্ছে পশু মানুষ যদি ভগবানের সন্তান হয় তাহলে একটা নিরীহ পশুও
727,ভগবানের সন্তান মানুষের মনে এই ধারণাটা বপন করা খুবই জরুরি বলে আমি মনে করি এবং এভাবেই মানুষের মন কুসংস্কারমুক্ত হওয়া উচিত
728,হ্যালো
729,এটা পূর্ব মেদিনীপুর জেলার গাড়িটি বলছেন
730,হ্যাঁ চলুন
731, বলছিলাম যে আমি নদীয়া থেকে বলছি আমাদের ওখানে কিছুদিন লোক নিয়ে ব্যার্কে যেতে চাই তো আমরা যে ওখানে দেখার কি কি জিনিস রয়েছে যেটি একটু আমাদেরকে বলেছিলাম
732,আচ্ছা তো আপনাদের ওখানে একটা মন্দির শুনেছিলাম
733,মোটা বর্তমান হননি
734,দিঘার যে সমুদ্র সৈকত্রা ঐটা কেমন ঐ জায়গাটা আসলে আমরা তো কোনোদিন আপনাদের ওখানে কি যাইনি
735, আচ্ছা ঠিক আছে আপনি যখন সবকিছু বলতেন সবকিছু তো ভালোই শুনলাম আর আমাদেরও খুব আগ্রহ ছিল যে আমাদের ওখানকার কি কি দেখার জিনিস আছে এসব বিষয়ে কী যে কোন ব্যাপার নয়
736,হ্যাঁ আমি
737, আচ্ছা চাচাই আছি
738,কাছে ফিরেছে কোনো ব্যাপার নেই আমরা কালে যাব আর আমরা কাছে যোগাযোগ করে নেব ওখানকে গেলে তাহলে আপনি যেন আমাদেরকে চারদিকটা ঘুরে দেখাবেন
739,কি আছে তাহলে রাখছি
740,পনেরো পঞ্চান্ন একশো পাঁচ তিনশো ছয় চারশো এক
741,হ্যালো
742,হ্যাঁ দাঁড়ানো মোস্কা
743,এসে এটা কি নিউ সু হাউসের দোকান
