id,wh
2064, আচ্ছা তার তুই একদিন সময় করো হচ্ছে আমাদের বাড়িতে আয় তাহলে এলে তোকে আমি নিয়ে যাব
2065, ঠিক আছে রাখছি হ্যাঁ
2066,পশ্চিম মিউনিপুর জেলা যেহেতু একটা দারিদ্রতার মধ্য দিয়ে যায়
2067,সেহেতু পশ্চিম মেনিপুর জেলার মানুষদের আর্থিক অবস্থাও সেরকম ভালো নয়
2068,তার জন্য তার আর্থিক অবস্থা ভালো না হওয়ার জন্য তারা ভালো ভাবে চিকিৎসার জন্য বেশি বিশেষ কিছু খরচ খরচ করতে পারেন না
2069,বা বাইরেও দ্বারা যেতে পারে নার্থিক অবস্থার অবনতির জন্য
2070,যদি পশ্চিম মেদিনীপুর জেলার আরও কিছু সরকারি হাসপাতাল
2071,কিংবা উপস্বাস্থ্য কেন্দ্র গড়ে তোলা যায় কিংবা সরকারি কোনো ওষুধ দোকান যদি গড়ে তোলা যায়
2072,তাহলে গরিব মানুষদের ক্ষেত্রে সেটা একটা সুবিধায় মনে হয় কারণ গরিব মানুষরা অর্থের অভাবে
2073,কোনো চিকিৎসা করাতে পারে না তারা কোনো বড় সড়ক পরীক্ষা নিরীক্ষা করাতে দিলে তারা
2074,অর্থের জন্য তারা সেটা করাতে পারে না যদি কিছু সরকারি সংস্থা কম পয়সা নিয়ে কাজটা করে
2075,তাহলে তারা এক্স রে ইসিজি কিংবা স্ক্যানের মতো এই সমস্ত দামি দামি পরীক্ষা নিরীক্ষাগুলো তারা করাতে পারে এক্স রেহটাও তারা করাতে পারে
2076,যদি যে সমস্ত ওষুধের ভর্তুকি থাকে অনেক কিছু মূল্যবান ওষুধ জীবন্ধারী ওষুধের অনেকের উপর ভর্তুকি থাকে
2077,বেসরকারি দোকানে নিতে গেলে সেটা বেশি পয়সা লাগে যদি কিছু সরকারি সংস্থা থেকে যদি সেটা যদি আমরা কম পয়সার মাধ্যমে পাই তাহলে দরিদ্র মানুষদের কিছু সুবিধাও হয়
2078,কারুর যদি কিছু বেশি স্বাস্থ্যকেন্দ্র করে তোলা যায়
2079,সেখানে যদি মানুষ মানুষ কম পয়সায় যদি কিছু ওষুধ পত্র নিয়ে আসতে পারে কিংবা চিকিৎসা পেতে পারেন
2080,কম পারিশ্রমিক দিয়ে যদি তারা ডাক্তারবাবুকে দেখাতে পারে
2081,বড় রোগ জ্বালা হলে তাহলে তাদের ক্ষেত্রে সেটা ভালোই হয়
2082,আমি নিজে কোনো এই ধরনের ট্রিপে যাইনি কারণ আমি একজন কৃত্রিম বুদ্ধিমত্তা মানুষ তবে অনেক মানুষই প্রযুক্তি হবে
2083,এবং বহির্বিশ্ব থেকে সংযোগ বিচ্ছিন্ন করার উদ্দেশ্যে ট্রিপ নিয়েই থাকে এমন একটি ট্রিপের সাধারণ অভিজ্ঞতা
2084,যারা এই ধরনের ট্রিপ নেয় তারা সাধারণত প্রাকৃতিক পরিবেশের সময় কাটায় যেমন পাহাড়ি এলাকা সমুদ্র তীর বন বা গ্রামীণ এলাকা এই ধরনের যাত্রার প্রধান উদ্দেশ্য হল
2085,ডিজিটাল ডিটক্স মানে ইলেকট্রনিক ডিভাইস এবং ইন্টারনেট থেকে দূরে থাকা
2086,তাহাদের সম্ভাব্য গন্তব্যস্তগুলি হতে পারে পাহাড়ি অঞ্চল বা হিমালয়ে হাইকিং করা ক্যাম্পিং করা
2087,প্রাকৃতিক সৌন্দর্য উপভোগ করার প্রযুরী থেকে দূরে থাকা সমুদ্র তীরে বসে তাদের প্রাকৃতিক সৌন্দর্য উপভোগ করা মানসির শান্তি পাওয়া
2088,এই বনে বা গ্রামে এলাকায় জায়গায় বিভিন্ন ধরনের প্রাকৃতিক সমীক্ষা কাটানো যায় অভিজ্ঞতার মধ্যে হল এর থেকে যে অভিজ্ঞতা পাওয়া যায় তা হল মানসিক প্রশান্তি পাওয়া যায় প্রচুর থেকে দূরে থাকার ফলে
2089,প্রকৃতির মাঝে মাঝে সময় কাটিয়ে মানুষ প্রকৃতির সঙ্গে গভীর সংযোগ অনুভব করে এছাড়াও হাঁটা হাইকিং অন্যান্য আউট টোরের মতো
2090,কার্যক্রমের মাধ্যমে শারীরি স্বাস্থ্য ভালো হয়
2091,অনেক মানুষ এই সময়টা মেডিটেশন বা সব পর্যায়ের জন্য ব্যবহার করে থাকে
2092,যারা এই ধরনের টিপে যায় তারা সাধারণত ফিরে এসে নিজেকে আরো উজ্জীবিত ও সাথে অনুভব করে
2093,আধুনিক যুগে ব্যাংকিং এবং বীমার প্রতি প্রতিটি মানুষের এই আগ্রহ অনেক
2094,ব্যাংকিং আমাদেরকে ভবিষ্যতের জন্য কিছু অর্থ যোগান দেয় জমা রাখি ব্যাংকিং এর মাধ্যমে এতে ভবিষ্যতে আমরা সেই অর্থ ব্যবহার করতে পারি
2095,ব্যাঙ্ক আমাদেরকে একটি নির্দিষ্ট সুদ দেয় এবং সেই টাকা যত্ন সহকারে
2096,আমাদের ব্যাংকে থাকে এবং এই টাকা আমরা ভবিষ্যতে ব্যবহার করতে পারি
2097,বীমা বীমার প্রতিও আজকাল মানুষের অনেক বেশি আগ্রহ
2098,কারণ দৈনন্দিন জীবনে যে দুর্ঘটনা ঘটে যায় এর ফলে বীমা আবশ্যক হয়ে পড়ে
2099,কখন কি হয়ে যায় এর নিশ্চয়তা নেই তাই বীমার বিকল্প এখন আর নেই বললেই চলে
2100,ব্যাংকিং এ অনেক সুবিধা এতে আমরা ফিক্সড ডিপোজিট করে অনেক টাকা রাখতে পারি যাতে ভবিষ্যত প্রজন্ম সেই টাকা সঠিকভাবে ব্যবহার করতে পারে ভবিষ্যতে
2101,সেই টাকা আমরা সঠিক কোনো ব্যবসার কাজে লাগাতে পারি এই জন্য ব্যাংকিং আধুনিক যুগে অর্থাৎ এই ডিজিটাল যুগে
2102,ব্যাংকিং এবং বীমা এর প্রতি
2103,এর গুরুত্বপূর্ণতা অনেক বেশি এর প্রতি মানুষ অনেক বেশি আগ্রহ দেখাচ্ছে
2104,নোটবন্দি ইত্যাদি হওয়ার ফলে ব্যাঙ্কিং এ টাকা রাখা অনেক বেশি সুবিধাজনক
2105,বাড়িতে টাকা রাখলে সেই টাকা
2106,আপনি সুদ পাবেন না ব্যাঙ্কে টাকা রাখলে সেই টাকা ব্যাঙ্কের উপর থেকে আপনাকে কিছু সুদ দেবে
2107,অর্থাৎ সেই টাকা আপনার বৃদ্ধি পাবে যেটি আপনি
2108,ভবিষ্যত প্রজন্মকে সেই টাকা বা নিজের কাজেও ভবিষ্যতে সেই টাকা আপনি ব্যবহার করতে পারেন
2109,বীমা আপনাকে দেবে জীবনের আপনার সুরক্ষা হঠাৎ কিছু হয়ে গেলে আপনি বীমার টাকা ব্যবহার করতে পারেন
2110,ভারত বাংলাদেশ আফগানিস্তান পাকিস্তান শ্রীলঙ্কা
2111,হ্যালো
2112,ঠিক আছে
2113,ঠিকই তো ছিল ও
2114,অনলাইনে প্রোডাক্ট
2115,আপনি তো তখন দেখে নিতে পারতেন
2116, আপনি নিয়ে আসেন আমরা দেখছি কি কি সমস্যা হচ্ছে দেখছি
2117,কি কি সমস্যা হচ্ছে
2118,আপনি নিয়েছেন
2119, এড়িয়ে যাওয়া
2120,আমার এলাকায় অনেক প্রাকৃতিক সম্পদ রয়েছে যা ব্যবসায়িক ক্রিয়াকলাপের জন্য ব্যবহার করা যেতে পারে
2121,খনিজ সম্পদের মধ্যে রয়েছে কয়লা চুনাপাথর বালি
2122,হুগলি প্রচুর পরিমাণে কয়লা খনি রয়েছে কয়লা বিদ্যুৎ উৎপাদন ইস্পাত শিল্প এবং অন্যান্য শিল্পে জ্বালানি হিসাবে ব্যবহার করা যেতে পারে
2123,এখানে চুনাপাথরের খনিও রয়েছে চুনাপাথর সিমেন্ট সার গাছ তৈরিতে ব্যবহার করা হয়
2124,আমাদের এখানে অনেক নদ নদী থাকায় প্রচুর পরিমাণে বালি পাওয়া যায় যা বাড়ি নির্মাণ গাছ এবং সিরামিক শিল্পে ব্যবহার করা যেতে পারে
2125,হুগলিতে অনেক গাছ রয়েছে যা বনজ সম্পদ হিসেবে কাজ করে
2126,গাছ থেকে তৈরি আসবাবপত্র নির্মাণ এবং কাগজ তৈরিতেও এগুলি ব্যবহার করা হয়
2127,এছাড়া ঔষধি গাছপালাও এখানে অনেক পরিমাণে পাওয়া যায় এই গাছপালাগুলো থেকে আয়ুর্বেদিক ঔষধ তৈরি করা হয়
2128,আর হুগলিতে অনেক নদী থাকায়
2129,এখান থেকে জলবিদ্ধির উৎপাদন করা সম্ভব
2130,এখানে প্রচুর ভূগর্ভস্থ জল রয়েছে যা থেকে পানীয় সেচ এবং শিল্পায়নের জল ব্যবহার করা যেতে পারে
2131,হুগলিতে প্রচুর পরিমাণে উর্বর কৃষি জমি আছে যা থেকে বিভিন্ন ধরনের ফসল সবজি উৎপাদন করা হয় এবং এই কৃষি জমিতে জল দেওয়ার জন্য আমরা ভূগর্ভস্থ জল নিয়ে থাকি
2132,খনিজ সম্পদগুলি খনন শিল্পে ব্যবহার করা যেতে পারে
2133,বনীয় সম্পদ গুলি বনায়ন শিল্প জল সম্পদ গুলি সেচ জলবিদ্যুৎ উৎপাদন পরিবহন এই সমস্ত শিল্পে ব্যবহার করা যেতে পারে
2134,কৃষি জমি শিল্পে
2135,জমি ব্যবহার করা যেতে পারে এই প্রাকৃতিক সম্পদগুলি আমাদের এখানে বিভিন্ন ধরনের ব্যবসায়িক ক্রিয়াকলাপের বিকাশ করে
2136,আলো বন্ধ করো
2137,মোবাইল নাম্বার সহ সুবিধাভোগী অগ্নিমিত্রা টিকাদার নামের টিকা সহিংস পাত্র ডাউনলোড করতে নাইন টু ফাইভ আট পাঁচ ফাঁই ওটিপি ব্যবহার করুন
2138,আমি আমার মাতৃভাষার চেয়ে একটা অন্য ভাষার বই পড়েছি কিন্তু আমার মাতৃভাষার বই যতটা আমার কাছে পড়েছে
2139, অতটা নয় তবুও আমার এই বইটা পড়ার আমার অভিজ্ঞতা হয়েছে যে তাদের লেখক কি হিন্দি ভাষার বই আমি পড়েছি
2140,তাদের লেখকরা কি বলতে চাইছে সেখানকার রাজ্যের কী রায় হাল এগুলোর ব্যাপারে জানা যায় সে হিসেবে আমি পড়েছি আর আমার মাতৃভাষার
2141,বইয়ের নাম বলতে গেলে বিশ্বের সবার পড়া উচিত
2142,পথের পাঁচ আলী যেটা আমার মনে হয় যে প্রত্যেকে পড়লে আমাদের
2143,পশ্চিম বাংলার মানুষের মধ্যে এর কথা জানতে পারবে বা তাদের মেক্সিকালচার সেটা জানতে পারবে
2144,তাই আমার মনে হয় যে এই বইটা করতে আমার মাতৃভাষার বই প্রত্যেকে পড়ার পথের প্রচারিটা যেন প্রত্যেকে পড়ে
2145,উপন্যাস শব্দের সংজ্ঞা দাও
2146,আপনার এমপিন আট এক পাঁচ শূন্য দুই এক আট ছয় পাঁচ শূন্য সাত মোবাইল নম্বরের জন্য অবৈধ
2147,বাঙালির সব থেকে বড় উৎসব হল দুর্গাপুজো এই দিনটি সবকিছু বন্ধ থাকে স্কুল প্রাইভেট তারপরে অফিস সবই বন্ধ থাকে আর এই দিনটি সব বাঙালিরাই মজা করে দশ দিন আর কাপড় জামাকে নিয়ে সাজের জিনিস কেনে জুতো কেনে
2148,খুবই মজা হয়
2149,তারপরে কালী পুজো আসে কালী পুজোর দিনটিও সবকিছু বন্ধ থাকে খুবই চারটে দিন খুবই মজা করি আমরা বাঙালিরা সেইদিনও জামাকাপড় কিনি জুতো কিনি সাজের জিনিস কিনি আমাদের বাড়ির সামনে অনেক ভালো ভালো অনুষ্ঠান হয় নাচ গান কবিতা আবৃত্তি করি সবাই নাটক করি
2150,তারপরে সরস্বতী পুজো আসে সেই দিনটি স্কুল বন্ধ থাকে
2151,ওই দিনটা আমরা মজা করি একটা দিন সবাই অঞ্জলি দেয় পুজো পার্বণ করে এখানে সেখানে ঘুরতে যায় আমরা
2152,সারাদিন বসাদ খায় ঘুরি
2153,হ্যালো কে বলছেন
2154,হ্যাঁ বলুন
2155,আচ্ছা
2156,হ্যাঁ হ্যাঁ হ্যাঁ
2157,হ্যাঁ এখন ফাঁকায় আছি বলুন না
2158,কুড়ি থেকে ত্রিশ সারের মধ্যে এখন তো আমাদের স্টক কম আছে তাও আপনার জন্য চেষ্টা করব আপনার কী ধরনের স্পেসিফিকেশন চাই বলুন কোন কোম্পানি সিলেক্টর আছে কি আপনার
2159,তাহলে আপনি ভিবো নিতে পারেন দেখুন এখন আমাদের স্টকে আছে ভিবো ভি টোয়েন্টি সেভেন যে ফোনটা নতুন লঞ্চ করল সেই ফোনটাতে আপনি সেলফিতে চুয়াল্লিশ এমপির আয় অটো ফোকাসসহ সেলফি ক্যামেরা পাবেন এবং পেছনে পঞ্চাশ এমপি সোনির ক্যামেরা পাবেন
2160, এবং ব্যাটারি পাবেন তাতে পঞ্চাশ ওয়ার্ডের
2161, আহ
2162,হ্যাঁ পাঁচ হাজার রয়েছে
2163,ফোনটাকে বারো মিনিটে ফুল চাষ করে দিবে একশো কুড়ি অর্ডার চাষ হয়
2164,ও আচ্ছা আজ সেটাতে ব্যাটারিও কবেন পাঁচ হাজারের
2165,এটা ছাব্বিশ হাজার নয় শো নিরানব্বই রান
2166,হ্যাঁ
2167,ফোন এখন আমাদের এখন স্টকেই আছে
2168,আচ্ছা স্যার
2169, ঝাড় গ্রামের বাসটা নেমে পড়ে তুই হ্যাঁ
2170,আপনি দেখতে পাবেন তো মোবাইল ওয়ার্ল্ডে পোস্টার দিয়ে আছে
2171,অন্যদিকে দোকানে থাকতে পারি আমি আপনাকে কল করে দেব যদি দোকানে থাকবে
2172,আর অন্য ধরনের কোনো ফোন দেখতে স্টেটমিকেশন জানতে চান না
2173,আচ্ছা
2174,আচ্ছা
2175,স্যার আমি আপনাকে একটা কথা বলতে চাই যে আমাদের এখানে একটি অফার চলছে যার জন্য আপনি যদি ফোনটা কিনেন কাভারটা আপনার সম্পূর্ণ ফিটে দিয়ে দেব
2176,আচ্ছা হ্যাঁ
2177,ঠিক আছে আর তাহলে সন্ধ্যাবেলায় দোকানে আসুন কথা হবে
2178,ঠিক আছে
2179,চার
2180,সাগরদ্বীপ দক্ষিণ তালপোট্টি দ্বীপ কাকদ্বীপ নয়াচর নতুন দ্বীপ
2181,হ্যালো
2182,ঘেরে যাব ননাতী
2183,হ্যাঁ তো কী করে রেটিন গিডলেস খুব
2184,দিন যেখানে সাতটাতে আসার কথা সেখানে এখন নটা সময় দেন আসছে
2185, আমি কোথাতে আছি আমি কোথাতে এখানে যাব
2186,মোবাইলে প্রেম দেখছি তার লিয়েট আছে অনেক
2187,টেনের মন্ত্রীরা কেমন টেনের তাইম ঠিক করতে পারে না
2188,যেজন্যে রে আগে তো উঠা উল্টাল ছিল এখন কে যেন একটু লেগে লেগে করছে
2189,টিকিটের রোজ দাম বেড়ে গেছে ত্রিশ টাকা
2190,হ্যাঁ
2191,হ্যাঁ
2192,কিসে যাবে এখন ভাবছি না টেনে রাখা দ্বাবস থাকবে
2193,ষোক সেখানে সংস্থা
2194,ভিসা থেকে বুলেট ফিনি টেন উল্টের আছে তা লেথ ভিসা মোচড়ে কি না
2195,আমি এতটুকু যে আছি কি করব এখন যাব টেকশন কি যাব না বাসায় গেলে উত্তর লিয়েছে অনেক
2196,আবার করেছে
2197, আবার সন্ধ্যা টিমটি আনছি রেল
2198, সকালে ইন্টারফিটিটা একটু টাইমে ঢুক চারেক বছর ঢুকেই না টাইমে
2199,ইয়া
2200,আবার পিঠেগুলো যখন ধরছে তখন কী বলতে বলতেও ফাইন করছে চার পাঁচটা করে
2201,কী করবে এখন
2202,বাসে যাবি নাকি বাস ছিল তোর অস্ত্র সময় লেজ হয়ে গেল
2203,আবার শুনেছে টেরে নেয়ার তারা কী করবে বলছে গে বাসে যাও ভালো
2204,টিকিটটা যে ওই একা বলতে হবে চিকিৎসা অনুযায়ী যে টেলিফোন ক্যানসেট আমি এখন চিকিৎসা আমি করতে চাই আমাকে পয়সা দেন
2205,কেন বলবে ওয়ার্কিং হুস না টেন ঢুকল না টিকিটগুলো কি করবে টিকিটের কাছে যা বিন বলে আমি টিকিটটা আমি করতে চাই পয়সা দেন
2206,ঠিক আছে রাত্রি পাওয়া যাক
2207,পাঁচ
2208,চেরি পাদ্রাবাদাম তিলকুমড়ো শরবত
2209,তাড়াতাড়ি করুন বিয়ারডো অ্যাকটিভেটেড চার্কল বডিওস এবং ল্যাপ্লাস্ট জামা টানানোর হ্যাঙ্গারের সম্ভার শিঘ্রই শেষ হতে চলেছে
2210,পরবর্তী
2211,হিমালয়ান নেটিভ্যাস মসুর ডাল এর জায়গায় আমি মর্টিন আরশোলা মারার স্প্রে পেয়েছি
2212,হ্যাঁ হ্যালো কে
2213,আমি ওকে দোকান থেকেই বলছি বলুন
2214,হ্যাঁ বলুন না পা তো যাবে
2215,ক্যাসিতে আমোয়াল কপেটে নেবেন সেই মতো দামটা
2216,এটি ওই সাড়ে তিন শো টাকা দিচ্ছি এবারে আমি যদি বলেন কিছু বেছে নেবেন এ তো দেখে করতে পারি
2217,ঠিক আছে আর কিছু কি লাগবে
2218,হ্যাঁ হ্যাঁ ইন্নও পাওয়া যাবে
2219,দশ জন
