id,wh
1,হ্যালো
2,আপনি কি গ্রাম প্রধানের কথা বলছেন
3,আমি আসলে ওই রিপ্রেস নাশতো চলছি
4, এসেছি গ্রুপে একজন হবে
5,ওই এফএনজি গ্রুপের একজন সদস্য
6,আসলে আমি আপনাকে ফোন করছিলাম আমাদের গ্রামের কিছু কিছু সমস্যা আছে আমাদের মহিলাদের গ্রুপেও সমস্যা ছিল এবং গ্রামেরও কিছু কিছু সমস্যা সেই নিয়ে কথা বলার জন্য আসলে যদি কী ভাবতেন আপনারা বা যদি একটু দেখছেন আমাদের দিকে তারা ভালো হতে পারে
7,ধরুন আমাদের বাড়ির ভিতর থেকে যে রাস্তাগুলো হয়েছে অভিজ্ঞতাপুরো চেইন মাটি আর বড় রকমের আপনি দেখেছেন যে এখানে একদম কাদায় প্যাঁচ প্যাঁচ করে একটা মানুষ খেতেও বেরোতে পারে না
8,অবস্থা খুবই খারাপ হয়েছে ক্ষেত্রে এখন তো ঢালাই নিশ্চয়ই করে দেবে না সরকার থেকে এখন এক লিফ যদি মোরামটা করাই তাহলে খুব ভালো হতো তো ওইদিকটা একটু দেখবেন আচ্ছা আপনি কি কথা বলেছেন
9, হচ্ছে জলে নিয়ে জলটার কিছু ক্ষেত্রে দেখা যায় জলটা সব দিকে যাচ্ছে না
10,টাইম ট্যাপে যে জলটা সব দিকে সমান যাচ্ছে না বা কোন ক্ষেত্রে মানে সেটিকে ট্যাপে সিস্টেম করা নেই আর তারপরে টাইমটা এত বেশি কম যে মানুষজন একটা জল ধরতে পারছে না যেমন দশটা বাড়িতে একটা ট্যাপ দিচ্ছে তাও এক ঘন্টা জল সারচে তো খাওয়ার জলগুলো মানুষ ধরতে পারছে না
11,আর হচ্ছে না
12,ঠিক
13,একটু ভালো হত যদি আপনি টাইমটা একটু বাড়িয়ে দেন তাহলে হয়তো ভালো হতো
14,আর একটা জিনিস দেখবেন যে ওটা তো টাইম বাড়াতে যখন টাকাটা বাড়ি দেবে আর গ্রামের তো আপনি জানেন যে সবার পরিস্থিতি বা টাকা পয়সা আর্থিক অবস্থা অথবা ভালো নয় চরিত্রে মজুর ডিফিল্ডেন্স টাকাটা না বাড়ে কিন্তু এদিন পার্টি ফান্ড থেকে বা কিছু হবে কোনোভাবেই এদিন হয়
15,বলা যায় আমাদের এটা
16,আমাদের এখানে একটা জায়গা যেমন এই আমার মামার বাড়িতে ওদিকে এখনো যাওয়াই হয় না কিন্তু তখন আমি দেখেছি বা এখনো শুনেছি যে ওদের ওখানে জল টানায় কিন্তু জলের জন্য আলাদা করে আমাদের যেমন টাকা নেওয়া ওদের কোনো টাকা নেওয়া নেবে না তো সেগুলো সেটো দেখবে না তাহলে ভালো হচ্ছে
17,মা আমাদের এসিজি গ্রুপটা তো হয়েছে অনেক দিন তো যদি কিছু টাকা পয়সা পাইয়ে দিতে পারতেন বা কিছু যদি ব্যবস্থা করেন তাহলে কিছু দেখবেন না সাহেবসেকে আমি কথা বলেছি কিন্তু তুমি কোনো রেসপন্স করছ না বলছো তোমাদের গ্রাম প্রধানকে বলো সে বললে তারপর বলব তো একটু দেখবেন না
18,প্রধান সাহেবের ওপর বলেছিলাম তিনি তো দেখছিয়ে বললেন তবে আমি কি যাব অ্যালকিন ওখানে আপনার
19,তাহলে আমি বাটি অফিসে যাচ্ছি বিয়ে তাহলে অরিনি দরকার একবারে প্রধান সাহেবের কাছে চলে যাব
20,ঠিক আছে তাহলে রাখছি
21,আমাদের পুরনো বাড়িতে একটি পাতকোও ছিল সেই পাতকোওতে তখন আমরা জল তুলতাম
22,সেটার জন্য একটা লোহার ছোট বালতি রাখা ছিল সেই বালতির হ্যান্ডেলে
23,বিশাল বড় একটা দড়ি বাঁধা ছিল
24,বালতিটা কুয়োর জলে ফেলে দিতাম লোহার যেহেতু ভারী ডুবে যেত আর দড়ি ধরে টানতাম সেইভাবে খুব কষ্ট করেই আমরা সেই জল ব্যবহার করতাম বাড়ির বিভিন্ন কাজের জন্য
25,আস্তে আস্তে আমাদের বাড়ির উন্নয়ন হল তখন আমরা কুয়োটা বুঝিয়ে দিয়েছিলাম কিন্তু সম্পূর্ণ বোঝানো হয়নি পুরোটা সিমেন্ট দিয়ে ঢাকা দিয়ে দেওয়া হয়েছিল এবং তা থেকে একটা বৈদ্যুতিক টুলো পাম্প লাগানো হয়েছিল
26,লাগিয়ে তা থেকে আমরা বাড়ির চার তলার একটি জলাধার করা হয়েছিল সেখানে প্রত্যেক দিন
27,জল সংরক্ষণ করে রাখতাম
28,ভারতের চাকরির বাজার খুব একটা ভালো না কারণ এখন চাকরির পরীক্ষা সেরকম হয় না বললেই চলে সরকারি চাকরি তো হয় না এসএসসি
29,পরীক্ষা তো উঠেই গিয়েছে বললেই চলে পায়মারিটা যদিও হচ্ছে কিন্তু তাতেও নিয়োগের কোনো নাম চর্চা নেই
30,যদিও হচ্ছে মানুষের লাগছে কিন্তু ইন্টারভিউয়ে ডাক পড়ছে না ডাক পড়লেও হয়তো বিভিন্ন রকম সমস্যার কারণে সে কেটেও যাচ্ছে ভালো ভালো ছেলেরা এর ফলে বসে আছে
31,বিভিন্ন এর জন্য ওদিকে বিভিন্ন রকম সমস্যার সম্মুখীন হতে হচ্ছে কারণ আগে যারা মাধ্যমিক উচ্চ মাধ্যমিক পাস করেছিলেন এখন যারা
32,মাধ্যমিক উচ্চ মাধ্যমিক পাস করে যাদের নাম্বার সেই নাম্বারের সঙ্গে আগের নাম্বারের অনেক পার্থক্য
33,এখন ছেলেমেয়েদের অনেক অনেক নাম্বার তারা নাইন্টি পার্সেন্ট এইনটি পার্সেন্ট কেউ নাইন্টি ফাইভ পার্সেন্টকেও আর হান্ডেট পার্সেন্টের নাম্বার পাচ্ছে কিন্তু তখন অতঃশর্ত
34,নাম্বার পাওয়াটা অত সহজ ছিল না যার ফলে আগেকার দিনের মানুষের সঙ্গে এখনের মানুষের অনেকটাই পার্থক্য ঘটছে যাদের বয়স চল্লিশ পঁয়তাল্লিশ পঞ্চাশ বছর তাদের সঙ্গে বিশেষ করে এখনের যে তরুণ ছেলেমেয়েরা উঠছে তাদের তো একটা বিরাট ফারাক রয়ে যাচ্ছে
35,যার ফলে চাকরির পক্ষে অত্যাদিকে বিভিন্ন চ্যালেঞ্জের সম্মুখীন হতে হচ্ছে বর্তমানে
36,বিভিন্ন সুযোগ রয়েছে এখন যেমন তরুণদের জন্য বিভিন্ন সুযোগ রয়েছে অগ্নিবিলের মতো
37,পরীক্ষা বেরিয়েছে বা যেখানে সহজে নিয়োগ করা হচ্ছে
38,এছাড়াও মিলিটারি বা পুলিশ জিডির পরীক্ষা রয়েছে ফর্ম চার্চে নার্সিং এর জন্য ছেলেমেয়েদিকে সুযোগ দেওয়া হচ্ছে যার ফলে অনেকগুলি সুযোগ রয়েছে সুযোগ থাকলেও কিন্তু
39,বিভিন্ন রকম সমস্যারও সম্মুখীন হতে হচ্ছে ছেলেমেয়েদের কারণ সুযোগ থাকলে তারা সবাই সবরকম সুযোগ সুবিধা পাচ্ছে না
40,বিবাহের মতো বড় অনুষ্ঠানের সময় প্রচুর পরিমাণে জলের প্রয়োজন হয় এর জন্য আমাদের প্রথম খাবার জল
41,অর্ডার করা হয় খাওয়ার জল থাকে এবং আরও ব্যবহারের জন্য যেই জল প্রয়োজন হয় এর জন্য পৌরসভার জলের ট্যাংকের ব্যবস্থা করা হয় আরো ঘরে যেই ট্যাংক গুলো থাকে সেগুলো জল
42,ধরে রাখা হয় ব্যবহারের জন্য কারণ বড় অনুষ্ঠানের জন্য জল প্রয়োজন বেশি হয়োজন হয়
43,আগে থেকে জল ব্যবস্থা করে রাখা হয় পৌরসভার ট্যাংকে জলের অনেক কাজ হয় আর খাবারের জন্য জল অর্ডার করা হয়
44,বাড়িতে জলের ব্যবস্থা করা হয় সেই জল গুলো আগে থেকে রাখা হয় আর খাবার জলটা অর্ডার করা হয় বোতল জল থাকে আর বাকি ফেলার জন্য
45,আসবাবপত্র ধুয়ার গুলোর জন্য জল থাকে আলাদা সেগুলো বাড়তি থাকে বাড়তি প্রয়োজন হয়েছে জল
46,পাঁচ
47,আমাদের এখানে প্রাথমিক স্কুল আছে হাই স্কুল আছে এবং কাছাকাছি বঙ্কিম সদ্যার কলেজ আছে তো আইটিআই আছে
48,মানে বাচ্চারা অ্যাকচুয়ালি প্রাইমারি স্কুলে মানে পড়ে কোন কোন বাচ্চারা ইংলিশ মিডিয়াম
49,যাকে বলে আর কি সেসব স্কুলে পড়ে তারপরে তারা হাই স্কুলে যায় তার পরে
50,তারপর কলেজ আমাদের আশেপাশে আছে যেমন আইটিআই কলেজ আছে টিএসে
51, এবার যারা বলছে আমরা ভালো পড়াশোনা করব তার শিরোন্নত তারা ইংলিশ মিডিয়ামে পড়ছে পরে তার পরে হাইস্কুল থেকে যাচ্ছে কলকাতায় পড়াশোনা করতে যাচ্ছে
52,অনেক আশুতোষ কলেজ আছে তারপরে বিবেকানন্দ কলেজ আছে আরও বিভিন্ন রকম কলেজ তারা চায় যে আমরা ভালো পড়াশোনা করতে পারি
53,পড়াশুনা করে একটা কিছু একটা কিছু একটা কিছু পাওয়ার আশা
54,আরো টিউশনি এক একটা বাচ্চার পেছনে তিনটে চারটি করে টিউশনি মাস্টার
55,ইনসেক্টোর টিউশন মাস্টার আছে তো
56,টিউশনি মাস্টার আছে তো আমি একশো বার বলব যে আমাদের কিন্তু বাংলাটা শিখতে হবে
57,বাংলা শিখতে হবে কারণ আমি দেখছিলাম প্রায় বাড়িতে ইংলিশ নিয়ে খুব চর্চা করছে কেন তো আমরা তো বাঙালি বাংলাটাই আগে শিখতে হবে বাংলা আগে ভালো করে বলার ধরন রাখতে হবে
58,বাংলাটা ভালো করে বলতে হবে
59,আমাদের বাঙালিদের তো বারো মাসে তেরো পাবন লেগেই আছে যাহোক না যাহোক একটা কিছু লেগেই আছে
60,তা এই দুর্গাপুজো কালীপুজো চৈত্র মাসে গাজন
61,তারপরে লক্ষ্মী পুজো সরস্বতী পুজো নানা রকম পুজো লেগে গেছে এখন তো প্রায় বৈশাখী শ্রী মাস এখন তো চারিদিকেই শীতলা পুজো হচ্ছে প্রত্যেক গ্রামে
62,তো আমাদের গ্রামেও ধর্মরাজ ঠাকুরের পুজো হয় ঐ ধর্মরাজপুর ঠাকুরের পুজোতে অনেক বাড়িতে সবার বাড়িতেই কুটুম আসে আমাদের বাড়িতে বসে সবার বাড়িতেই লোকজন আছে হৈ হাল্লা লেগেই থাকে
63,দুপুরে রান্না হয়ে থাকে মাংস হয় ফ্যারাইস হয় তারপরে ফ্যারাইস মাংস ডাল পুষ্টি ভাজা
64,পাপড় দই মিষ্টি নানা রকম ইত্যাদি তৈরি হয় আবার রাত্তিতে আছে রাত্তিতে আবার হয় এবার যে মাংস না খাবে মাছ আছে এইভাবে চলতে থাকে ঠিক
65,তামিলনাড়ুতে লোকেরা আল্পনা দিয়ে মেজাজ সাজায়
66,হ্যাঁ আমি পাঁচটি তারিখের কথা বলতে পারব সেগুলি হল এগারো জানুয়ারি দুই হাজার বাইশ বার ফেব্রুয়ারি দুই হাজার একুশ দশ জুন দুই হাজার কুড়ি আঠার জুলাই দুই হাজার আঠার পনের আগস্ট দুই হাজার পনের
67,কে বলছে
68,ওহা বলুন
69,আচ্ছা
70,আচ্ছা
71,হ্যাঁ
72,বাবা কার্যক্রমের জন্য বেশি ব্যবস্থার কথা
73,ছাড়া
74,দেখুন আগে প্রথমত আপনি এটা বলুন যে এখন যে সমস্ত নরমাল খাটগুলো হয় সেরকম খাট নেবেন নাকি যেরকম সে বক্স সিস্টেম খাটায় মানে একটা সুইচ টিপে রিমোটের মাধ্যমে
75,নিচে অনেকটা স্পেস থাকবে সেই স্পেসটা খুলে যাবে সেখানে আপনি আপনার আসবাবপত্ধ বা দরকারী যে সমস্ত জিনিসপত্র অনেক খালি স্পেস থাকবে সেগুলো সেখানে রাখতে পারেন আর আপনি সেটা আগে বলুন যে কিরকম মডেলের কার্ড নিবেন
76,দেখুন বক্স সিস্টেম খাটতায় কি বলুন তিনি ওই যে ডিমোড সিস্টেম যে ক্যালিভারগুলো থাকে না ওগুলো লাগাতে হয় আরেকটু মডিফিকেশন করতে হয় তোর জন্য ধরে রাখুন আপনার আট দশ হাজার টাকা বেশি পড়বে
77,ঠিক
78,না না
79,হ্যাঁ
80,দেখুন ওটা আপনি যদি বলেন আমরাও দেরিতে পারব বা আপনি যদি বলেন যেন আমি হচ্ছে আপনার কার্ড কিনে দেব সেটাও করতে পারি এবং সেটা আপনাদের ওপর ডিপেন্ড করছি
81,সেগুন সেগুন সেগুনটা সব থেকে ভালো হবে
82,আজ
83,আপনি ধরুন না প্রায় পঁয়ষট্টি হারটার মতো কার্ডটায় লেগে যাবে
84,না কার্ড বাদ দিয়েও বালিবাগি যে সমস্ত জিনিস আছে সেগুলো কিন্তু টাকা লাগবে না সেগুলো নহে আপনারা টাকা দিয়ে দেবেন আমি আপনাদেরকে হিসাব দিয়ে দেব সেগুলো না আমরা ম্যানেজ করে নেব
85,হ্যাঁ আছি বিরাশির বাচ্চা তো হয়ে যাবে
86,আপনি যদি এটা দেখুন তৈরি করা যদি কিনতেন রেডিমেট ঠিক আছে তাহলে দামটা একটু কম পড়ত কিন্তু এখানে আপনি যখন হাতে তৈরি করাচ্ছেন না
87,সেখানে একটু বেশি পড়বে কারণ দেখুন সেই তারা যে রেডিমেন্ট যেটা তৈরি করা হয়েছে সেটাতে যেমন কাঠ সেগুন নাও থাকতে পারে কিন্তু এটা সেগুন বলে চালিয়ে দেওয়া হচ্ছে কিন্তু এখানে প্রকৃত সেগুন কাঠটাই আপনাকে দেব আমি
88,আপনি কাল চারটে নাগাদ যে ফাঁকা থাকেন আসুন আমি থাকব দোকানে
89,হ্যাঁ হ্যাঁ ঠিক আছে
90,ঠিক
91,ঠিক আছে
92,সব আমরা করে দেব
93,না না না সব ঐটার মধ্যেই
94,হ্যাঁ ঠিক আছে
95,আপনি দুপাশ হাজার টাকা আনবেন না তাই হবে
96,প্রায় এক মাস হ্যাঁ এক মাস তো লাগবে
97,হ্যাঁ হ্যাঁ হ্যাঁ
98,হ্যাঁ হ্যাঁ একদম
99,হ্যাঁ হ্যাঁ হ্যাঁ
100,ঠিক আছে
101,হ্যাঁ আমি পাঁচটি জেলার নাম বলতে পারব যেগুলি আমার মনে আছে সেগুলি হল পূর্ব মেদিনীপুর পশ্চিম মেদিনীপুর নদীয়া উত্তর চব্বিশ পরগনা আর দক্ষিণ চব্বিশ পরগনা
102,হ্যালো
103,বলছি দাদা গতকালকে আমার একটা বুকিং ছিল
104,এখান থেকে আমি এয়ারপোর্ট যাবো আমার যে লোকেশন আছে দেখুন একটা এয়ারপোর্ট একটা লোকেশন রয়েছে ড্রপ লোকেশন আমি বুকিং আইডিও বলে দিচ্ছি আপনাকে ডাবল টু ডাবল ফোর থ্রি সিক্স
105,আপনি একটু বুকিংটে চেক করেন দেখুন কাল সকাল ছটায় একটা বুকিং আছে আমি এয়ারপোর্ট যাব তো আপনি ঠিকঠাক টাইম মতো চলে আসবেন তো
106,এবং আপনাকে বার বার করে বলছি আপনি ঠিক সকাল ছটার ঠিক আগে আপনি চলে আসবেন
107,আপনি যদি সঠিক টাইমে না আসতে পারেন না তাহলে কিন্তু আমার ফ্লাইটটা ক্যানসেল হয়ে যাবে আমার একটা আর্জেন্ট মিটিং এর জন্য আমায় যেতে হচ্ছে
108,তো এই মিটিংটা যদি আমার ক্যান্সেল হয়ে যায়
109,অনেক বড় একটা লস হয়ে যাবে এবং কি বলব আপনাকে লাইফের অনেক বড় একটা ক্ষতি হয়ে যেতে পারে ঠিক তো খুব গুরুত্বপূর্ণ একটা কাজের জন্য যাচ্ছি তো আপনাকে তার জন্য বারবার বলছি আপনাকে দরকার করলে রিকোয়েস্ট করেছি আপনি ঠিকঠাক টাইমে কিন্তু চলে আসবেন এবং আপনি লোকেশনে আসার মধ্যেই
110,লোকেশনে আসলেই হয়তো আমাকে আপনি দেখতে পেয়ে যাবেন যে আমি বাইরের রাস্তায় দাঁড়িয়ে আছি আর যদি তাও বুঝতে যদি অসুবিধা হয় আপনি অবশ্যই কল করবেন কোনো সংকোচ বোধ করবেন না এত সকালে উঠেছেন কিনা আপনি কোনো অসুবিধা নেই আপনি ফোন করবেন ওকে দাদা রাখলাম
111,পশ্চিমবঙ্গ ঝাড়খন্ড মহারাষ্ট্র উড়িষ্যা বিহার
112,আমি ছোটবেলা থেকে এমন অনেক কিছু গুরুত্বপূর্ণ পাঠ শিখেছি যেগুলো আমার জীবনে খুবই প্রভাব ফেলে থাকে
113,যেমন আমি আর আমার একজন ছোট বন্ধু ছোটবেলা থেকেই খুব ভাল রকমের বন্ধু ছিলাম আমরা দুজনে বিভিন্ন সময়ে খেতাম
