id,wh
1380,আমি পঁচিশ তারিখ বর্ধমান থেকে দিঘা যাওয়ার জন্য যেই ক্যাপটি বুক করেছিলাম সেটির কোন কারণ বর্ষে তা আমি সেটিতে যেতে পারছি না সেজন্য আমি নিজের অ্যাডভান্স দুহার টাকা নিতে চাইছি এবং ক্যাপটি ক্যানসেল করতে চাইছি আমার জিপে এখন আপনাকে আমি পাঠিয়ে দিচ্ছি সেটাতে পাঠিয়ে দেবেন
1381,আমি গাড়ির সরঞ্জাম অর্ডার করতে চাই আপনি কি আমাকে দেখাতে পারেন যে এই বিভাগে কি কি পাওয়া যায়
1382,কার্যত থেকে প্রথম ট্রেন কটার সময় ছাড়ে
1383,সুকন্যা সমৃদ্ধি যোজনা সঞ্চয় প্রকল্প এর জন্য প্রয়োজনীয় তহবিলের আকার এবং ন্যূনতম বিনিয়োগ সম্পর্কে আমাকে বলুন
1384,এই কিউ আর কোডটি স্ক্যান করতে এবং আমার পিএনবি অ্যাকাউন্টটি প্রমাণীকরণ করতে পারেন
1385,হ্যালো
1386,হ্যাঁ
1387,কিছু জানতে পারবেন তো
1388, বলছি স্যার আমি রাহুল বলছিলাম আর কি বারো সাত্তারি বাসিন্দা বলছি স্যার এখন কি হসপিটালে কোভিডের ভ্যাকসিন দেওয়া হচ্ছে ওই দ্বিতীয় রোধটা
1389,মাস্টার আমি ফার্স্ট ডোজ নিয়েছিলাম আর কি এটা আমার সেকেন্ড ডোজ হবে
1390,মোটামুটি ধরতে পারেন এক মাস হয়ে যাব
1391,হ্যাঁ
1392,আচ্ছা ঠিক আছে না এবার হয়তো দেখুন এক মাসের তো বেশি হয়ে যেতে পারে কারণ আমার ফোনে মেসেজ দিয়েছে যে আপনার দ্বিতীয় ডোজ নেওয়ার জন্য আর কি
1393,হ্যাঁ হয়তো এক মাস হয়েছে এরকম মনে হয়
1394, আচ্ছা আমি যে আর কি কি নিয়ে এসেছি তার জন্য যেতে বলছি
1395,হ্যাঁ হ্যাঁ
1396,আচ্ছা
1397, আচ্ছা ঠিক আছে
1398,ঠিক আছে
1399,ঠিক আছে
1400,ইয়াহুন নিউজ থেকে আমার সাম্প্রতিক গল্প দরকার
1401,সমস্ত কিছু কথার মাঝে
1402,আমার মনে এল ভারতীয় পরিবহন ব্যবস্থার কথা ভারতের পরিবহন
1403,ব্যবস্থা আগের থেকে এখন অনেক পরিবর্তন করেছে যেমন
1404,কোন গ্রাম বা অলি গলিতে আগে যেমন বাস বা টোটো বা বিভিন্ন গাড়ি ঢুকতে পারত না সেগুলি এখন প্রায়শই ঢুকছে
1405,বাড়িতে তো বাইক আছে সেটা যেকোনো জায়গায় যেকোনো মুহূর্তে ঢুকতে পারে
1406,আমি চ্যালেঞ্জরূপে বলতে পারি আগে যেমন বাস যেত না এখন সে বাস যাচ্ছে আগে যেমন টোটোয়ারে যেতে পারত না যেখানে এখন মরাম রাস্তা ছিল সেখানে পিছ হয়েছে বা যেখানে ঢালাই রাস্তা ছিল সেটা উড়িয়ে দিয়ে সেখানে পিছ তৈরি হয়েছে
1407,শুধু পিচ নয় সেটা আরও বর্তমানে অন্যান্য কিছুতে তৈরি হবে
1408,এইসব সুযোগ সুবিধা গুলি হল এক এয়ারপ্লেন বা প্লেন দিয়ে গ্রামের বা শহরের মানুষ এক দেশ থেকে অন্য দেশে যাচ্ছে যেখানে কোনো বিশেষ কিছুর প্রয়োজন হচ্ছে না
1409,প্লেনেই চলে যাচ্ছে
1410, পয়সার সমস্যা তো আছেই গরিব মানুষদের পয়সার সমস্যা থাকে এবং যারা একটু বড়ো অর্থাৎ ধনী তাদের পয়সার সমস্যা খুব বেশি থাকে না
1411,সুযোগ সুবিধার কথা বললে আমার মাথায় আছে প্লেন দিয়ে এক দেশ থেকে যেমন অন্য দেশে যাওয়া যায় তেমনি
1412,অন্যান্য প্রাইভেট কার্ড দিয়ে এক জায়গা থেকে অন্য জায়গায় দেওয়া যাচ্ছে এই সবই হল ভারতীয় পরিবহন ব্যবস্থার মূল কারণ
1413,জলের তলায় যাওয়ার জন্য
1414,অন্য রকম ব্যবস্থা করা হয়েছে এছাড়াও এর সুবিধার কথা বললে বলা যায়
1415,এক জায়গা থেকে অন্য জায়গায় যাওয়ার জন্য গাড়ি ছাড়াও অন্যান্য যেসব হেলিকপ্টার বা ছোটখাটো যন্ত্র সেগুলি পাওয়া যাচ্ছে
1416,যেমন এইসব দিয়েই মানুষ খুশি থাকে এই থেকে বোঝা যায় যে ভারতের পরিমাণ ব্যবস্থা আগের চেয়ে অনেক সুন্দর সচ্ছল ও
1417,ভালো হয়েছে
1418,দাদাটা কি ভূতমোহন ভেজিটেবল ডিলার
1419,দাদা আপনার কাছে এখন কি কি ফসল পাওয়া যাবে
1420,আচ্ছা আমার কিছু কিয়াজ চাই
1421,প্রাইস কী রকম আছে
1422,আমি নেব অনেক নাম যেমনি আমার বিশ কিলোমিনের মতো লাগবে
1423, আমি একেবারে কুড়ি কিলো নেব তো সেক্ষেত্রে কিছু কম হবে প্রাইসটা
1424,তো কত করে ফর্ম আসবে কে কী প্রতি
1425,ও তো আচ্ছা
1426,ঠিক আছে তো আমাকে বিস্কুলের মতো লাগবে
1427,তো এদিকে আমি বিস্ক্রিল নেব কবে আসবে মানে ডেলিভারিটা কবে হবে
1428,তিন দিনের মতো আচ্ছা আচ্ছা
1429,ডেলিভারি ট্রান্সপোর্ট যেই চার্জ আর কি এটা কি মানে এর সঙ্গে আছে নাকি এটা এক্সটাভাবে আমাকে দিতে লাগবে
1430,ও ঠিক আছে ঠিক আছে
1431,ঠিক আছে ঠিক
1432,আমি আপনার দোকানটা অনলাইন থেকে দেখেছি এবং আপনাদের দোকানের রেটিংসটা খুব ভাল আছে তো সেজন্য আমি ঠিক করেছি আমি আপনার দোকান থেকে কিছু খাবার অর্ডার দিতে চাচ্ছি সে খাবারগুলি হল বিরিয়ানি তারপর
1433,মোগলাই রোল চিকিন চাওমিন ইত্যাদি এই খাবারগুলি আপনি আমাকে অর্ডার দিয়ে দেবেন এবং
1434,খাবারগুলি যেন খুবই সুস্বাদু হয় সেদিকটাও আপনি নজর রাখবেন এবং তার সাথে আমি আরো কিছু খাবার এড করতে চাচ্ছি যার জন্য আমি আপনাকে
1435,বলছি যে আপনাদের দোকানে এই খাবারগুলি পাওয়া যাবে কিনা সেই জন্য আমি কনফার্ম হতে আপনাকে ফোন করেছি এবং জানতে চাচ্ছি যেরকম ধরুন আমি আরেকটা খাবার এড করতে চাচ্ছি যা আমার রাইতে লাগবে চিকেন কসা আর সস বা চাটনি
1436,এই গুলো লাগবে তো আপনি যদি আমাকে খাবার গুলো করে দিতে পারেন এবং
1437,মোটামুটি একটু কম টাইমের মধ্যে করে দিতে পারেন তো খুবই উপকৃত হয় যেহেতু আপনার দোকানটা তো এত প্রতিষ্ঠিত বা অনেক দিনের আগে আপনার খাবারের স্বাদও খুব সুন্দর খুব ভাল সেই জন্য বললাম আপনাকে
1438,এবং আপনি একটু দেখবেন যাতে তাড়াতাড়ি হয় এবং এই ঝাল টাল এগুলো একটু ঠিকঠাক মূল্যের পরিমাণ মতো দেবেন কারণ বেশি ঝাল খেতে পারি না তো সেজন্যে আপনি যদি
1439,ওই খাবারগুলো আমাকে একটু ঠিকঠাক টাইমে ডেলিভারি দেন তো আমার খুবই ভালো হয় আর যেই পদগুলি বললাম সেগুলি যদি হয় তো আরও ভালো যদি না হয় তাহলে বলবেন
1440,আমাকে বলুন দা আমি তাহলে আবার চেঞ্জ করে দেব বা কি কিছু তাহলে আবার অন্য খাবার অর্ডার দিতে চাইব তো আপনি যদি বলেন তাহলে আমার তো খুবই ভালো হয় আর দেখবেন যাতে একটু তাড়াতাড়ি খাবারটা আসে সেদিকটা দেখুন নজর দেবেন আর ডেলিভারি বয় কি
1441,যাদের খাবারটা ঠিকঠাক মতো নিয়ে আসে আমি আমার অ্যাড্রেসটা দিয়ে দিচ্ছি তো ডেলিভারি বই যদি দিয়ে যায় তো আরও ভালো হয়
1442,আমাদের এলাকার রাজনৈতিক দলগুলোর মধ্যে অনেকগুলো দল আছে যেমন বিজেপি সিপিএম তৃণমূল এগুলো কিন্তু আছে
1443,আমাদের এখানে বিবর্তিত যেগুলো হয় যে এর সাথে তার ঝগড়া লেগে যায় শুধুই তাদের ঝগড়া লেগে যায় কারণ এ যদি কিছু একটা ভালো কাজ করে তো সে বেচেনার জন্য সে যদি আবার কোনো একটা ভুল কাজ করে
1444,তার পেছনের রেবারটা নেয় এই নিজের জন্য এ ওর গায়ে কাদা ছেঁটাতেই থাকে এইগুলোতে আমাদের দলের সব থেকে বড় মূল সমস্যা ঐ জন্য আমার দল খুব একটা ভালো লাগে কিন্তু একেকটা দল থাকাও ভালো যেটা সমাজের উন্নতি হবে সেটাতে দল থেকে হয় না দল থাকাও ভালো
1445,এখনকার দলগুলো যেগুলো করে সেগুলো হচ্ছে সব মারাদান্দা শুধু সব কিছু নিয়ে নিবে কারোকে ভালো করার থেকে সবারই খারাপ বেশি করে তো এই জন্য মানুষ আজকে আমরা যেই জায়গাটা তারা যে সেই ছোটোই রয়ে গেলাম বাকিরা সবাই বড়ো হয়ে গেছে যারা দলে থাকে
1446,দল অবশ্যই ভালো একটা দল থাকলেই তো সমাজ এগিয়ে যাবে কিন্তু দল যদি শক্ত হয়ে সবাইকে বলে যে আমরা মেরে ফেলব সেখানে তো মানুষ মারা যাবে না মানুষ কি করে এগিয়ে যাবে তাহলে
1447,এই জন্য বলব যে দল গুলো আছে সেই দল গুলোর কাজ যে খুব একটা খারাপ করে তা নয় আবার খুব একটা ভালো করে তাও নয় কারণ আমার কাছে সবই সমান কারণ আমি দেখেছি যে এখানকার দলেরা
1448,শুধু ঝামেলা বাগায় একটা কাজের ক্ষতি করবে আবার একটা কাজের ভালো করবে কেউ কারো ভালো যে সহ্য করতে পারে না সেগুলো কিন্তু এই খবরটা বোধ দেখলেও বোঝা যায় তাই যে এদেরকে এত দলটল নিয়ে যে কথা হয় এই দলটগুলোতে খবরের দেখায় খবরে কি দেখে এ তাকে মারছে ও তাকে মারছে শুধু ঐ চর্চাই হচ্ছে চারিদিকে
1449,কিন্তু অ্যাকচুলিতে সেটা করার কথা নয় দল মানে হচ্ছে সমষ্টি একটা সমষ্টি মিলে কোথায় সমাজটাকে এগিয়ে নিয়ে যাবে এগিয়ে নিয়ে যাবার কথা ভাববে না অবশ্যই করেছে কিছু অবশ্যই করেছে এগিয়ে নিয়ে যাওয়া কিন্তু তার থেকে বড় এখন যে কাণ্ডগুলো ঘটাচ্ছে সেগুলো তার অবস্মরণীয় হয়ে যাচ্ছে
1450,রেইড পিঁপড়ে ও আরশোলা মারার স্প্রে বিয়ারডো ঘন পেঁয়াজের তেল এবং শ্রী শ্রীতত্ত্ব ভ্যানিলা হেলথ পানীয় সামগ্রীগুলো অনুপ্লব্ধ অনুগ্রহ করে এগুলো পরে অর্ডার করার চেষ্টা করুন
1451,হ্যালো ম্যাডাম আপনার বাড়ির সামনে পার্সেলোনা চলে এসেছি
1452,আপনি তো কিছু অর্ডার দিয়েছেন ফল এর জন্য আপনার বাড়ি
1453,আপনি তাড়াতাড়ি এসে রাসেলটা নিয়ে যান
1454,হুম
1455,না বললে কী করে হবে না আমরা তো জিনিসটা নিয়ে এসেছি আপনার তো নিতেই হবে না নিলে হবে না
1456,ম্যাডাম বললে হবে না আপনাদের নিতে হবে আমাদের সমস্যা আমাদের কাছ থেকে বের করে দেবেন ঠিক আছে এটা যাদের অর্ডারের জিনিস তাদের সব বাড়ি বাড়ি দিয়ে আসতে হবে এমন নিয়ম নিতে হবে দেখো আমি ঠিক ম্যানেজ করে নিই
1457,ম্যাডাম একটু সমস্যা ছিল ঐ জন্য আমরা আসতে পারিনি ওই ডেটে কিন্তু এখন নিতেই হবে তুমি দেখো টাকাটা জোগাড় করো
1458,কারুর একটু বলার চেষ্টা করো আশেপাশে কেউ যেদিন নিতে চায় সেটা বলো আমাদের না নিলেই আমাদের হবে না নিতেই হবে
1459, আচ্ছা অনেক ভিড় আছে
1460,শেষ চব্বিশ ঘণ্টা এর আমার লেনদেনের ইতিহাসটা খুলুন এবং অগ্নিমিত্রা টিকাদার পরিচিতিটি মিউট করুন
1461,রক্তসঞ্চয় স্থান পরিষেবা ইএসআইসি কেন্দ্রের আইএমএফি ডাক্তারখানা ধরনের সাথে প্রদান করেছে কিনা তা দেখুন
1462,আরে নিচে এই সবজি গাড়িটা এল সবজি নিতে নেমেছিলাম গো
1463,ও আজকের হ্যাঁ
1464,আজকের ওই কৌশিকে আমি বসে আছে না ঠাকুরকে একটু বগুড়া না করে দেব তাই একটু সবজি নিতে নেমেছিলাম
1465,ও
1466,হ্যাঁ হ্যাঁ হ্যাঁ
1467,আজকে কি তুমি ফ্রি আছ নাকি
1468,তাহলে দুজনে মিলে বেড়াতাম একটু কালীঘাটের দিকে যেতাম আজকের অমাবস্যাটা তো কক্সবাসীকে অমাবস্যাটা খুব বড় করে পুজো হয়
1469,হ্যাঁ সন্ধ্যাবেলা আরতিও হয়
1470,হ্যাঁ ওর বাবা অফিসে মেডিজেট তার পরে দুজনে তাহলে বেরোনো হবে
1471,দশটার দিকে বেরিয়ে যাবে তাহলে আমি আর তুমি এগারটার দিকে বেরিয়ে যাব
1472,হ্যাঁ দুজনে তাহলে ওখানে খাওয়ারটা হয়ে যাবে খেতে হবে ঠাকুরের ভোগ
1473,সন্দেহটি থাকলে তোমার কোনো প্রবলেম নেই তো
1474,হ্যাঁ আরো দুটো আমিও কোনোদিন দেখিনি শুনেছি
1475,হ্যাঁ সন্ধ্যাবেলা আমার ওই সপ্তাহের আগে ফিরলে চলবে
1476,তাহলে তোমরা যদি ফ্রি থাকো তাহলে যাব গেরিতে
1477,হ্যাঁ তাহলে রেডি হয়ে আমি ফোন করব ঠিক আছে
1478,ঠিক আছে ঠিক আছে
1479,ঠান
1480,হ্যাঁ বলুন
1481,আচ্ছা
1482,কোথাও লেগেছে
1483,কোথায় লেগেছে
1484,আচ্ছা ম্যাডাম ও যে আরও খেলায় নাম দিয়েছিল সেগুলোকে কোনো কিছু জয়েন করতে পেরেছে না কোনো কিছু অনুষ্ঠান খেলাধুলা করতে পারে না আগেই পড়ে গেছে তিনটে খেলায় নাম দিয়েছিল না
1485,হ্যাঁ
1486, আচ্ছা আমি যদি বলেন বাড়ি নিয়ে চলে আসব না ও কী করব না ওকে খেলত স্কুলে থাকবে যদি বেশি কান্নাকাটি করে তাহলে আমি নিশ্চয়ই
1487,বলু
1488, একদিন ম্যাডাম ঠিকই বলেছেন আমাদের স্কুলে খেলা দেখার আমার খুবই শখ একটা সুযোগও পেয়েছে তাহলে আমি তাড়াতাড়ি যাচ্ছি আমার ছেলেকে বলুন ওর মা আসছে আমি পুরো খেলা দেখে ওর পুরস্কার নিয়ে তারপর বাড়তে আসব এমনি কোনো কান্নাকাটার করেনি তো
1489,পাচ্ছি
1490,অসংখ্য ধন্যবাদ মান্না তখন আমার ছেলেকে দেখে যান আমি যত তাদেরই সম্ভব এখানে পৌঁছাচ্ছি
1491,আচ্ছা তাহলে কিন্তু কোন কারণেই অসাবধান হয়ে গেছে হয়তো তাই হয়তো পড়েছে ঠিক আছে যখন কোথায় লাগেনি বলি চিন্তার কোন কারণ নেই তাহলে আমি তাড়াতাড়ি যাচ্ছি আর খেলাটা দেখেও আসব ঠিক আছে ম্যাডাম
1492,তাতেই বেরিব হ্যাঁ হ্যাঁ হ্যাঁ ঠিক আছে হ্যাঁ ম্যাডাম
1493,টেস্টিস বাদাম পেস্তা বিস্কুটের যে ব্র্যান্ড আমি পেয়েছি সেটা ঠিক নয়
1494,পাঁচ
1495,ওই চলছে মোটামুটি আমলা কেমন চলছে
1496,ভিন ভিন
1497,যখন আমি মার্কেটে যাব তখন আমি একবার ফোন করে বলে দিলাম একটু বেশি করে তালে নিয়ে আসব আন্ডে আমরা তালে দিতে পারব
1498,ওহ
1499,ট্যাবলেট
1500,আচ্ছা
1501, আমাদের তো দোকানদার তো এরকম নিচ্ছে তা আমার কাছ থেকে বা আমাদের তো শুধু এক পয়সা লাভ না থাকে তা কি করব বলুন ঠিকানাযুগ ব্যবস্থা করে নেওয়া যাবে
1502,নানা অসুবিধা হবে না ঠিক আছে দেখব না কিছু কি করলে হয়
1503,আমরা যেমন চলছে বাজার মূল্যে সেরকম তার মধ্যে ভালো আছে দুরকম কমবেশি করে
1504, আমরা জিয়া ঢুকেছি
1505,আমি মান না দেখে তো আপনি আন্দাজে বলতে পারবেন
1506,আমি কখন ব্যাংক অফ ইন্ডিয়া এ নয় ছয় পাঁচ সাত এক পাঁচ নয় তিন নয় সাত দুই থেকে সাত শূন্য শূন্য শূন্য শূন্য টাকার আটকে থাকা লেনদেনের পরিমাণ ফেরত পাব
1507,আপনি পাঁচ সিক্স মিনিট পরে আপনার কোইন অ্যাকাউন্টে যাওয়ার জন্য ওডি পুনরায় পাঠাতে পারেন
1508,নিচে
1509,হ্যালো
1510,হ্যাঁ সাইথিয়া হেলথ সেন্টার
1511, বলছি আপনাদের হেলথ সেন্টার বন্ধ কেন
1512,তুমি একটু আগে
