id,ref
972,ஆமாங்க அவசர வேலையா நா வந்து இப்ப சென்னை போய் ஆகணுங்கண்ணா நாளைக்கி காலையில பத்தர மணிக்கி அங்க மீட்டிங்ணா
973,ஆமாங்க வேல சம்மந்தமா தாங்கங்க
974,அண்ணா கொஞ்சம் சீக்கிரம் வர முடியுங்களாண்ணா
975,நம்ம வந்து இந்த ஈரோடு பஸ் ஸ்டாண்டுக்கு பக்கத்தால இந்த ரவி தியேட்டர் இருக்கு இல்லங்க அதுக்கு பக்கத்தால தான் நின்னுட்டுருக்குறேனுங்க ஆமாங்க வெள்ள கலர் ஷர்ட்டுங்கண்ணா ப்ளூ கலர் ஆப் ட்ராயருங்க ஒரு பேக்குங்க ஒரு டிரெக்கிங் பேக் ஒன்னுங்க ஒரு ஆர்டினரி பேக் ஒன்னுங்க ஆமாங்க நீங்க வாங்கங்க அண்ணா கொஞ்சம் சீக்கிரம் வாங்கண்ணா
976,எனக்கு க்ளே க்ராஃப்பட் செராமிக் காஃபி மக்குக்கு பதிலாக ஒரு பேக் ஹரி தர்ஷன் சாய் மேக்ரா அகர் பத்தி வேண்டும்
977,ஆ வணக்கம் சார் வணக்கம் சார்
978,ஆ வா
979,ஆ வாங்க சார் புது மாடல் இப்ப வந்து
980,சார்ஜு சைக்கிள் தான் சார் இப்ப ஃபேஷனா இருக்கு
981,எலெக்ட்ரிக்கல் பைக்கு அதாவது சார்ஜ் போட்டு நம்ம யூஸ் பண்ணிக்கிலாம் சார் பெட்ரோல் அதுலாம் எதும் தேவையில்ல
982,ஆ ஃபீச்சர்ஸ் பாத்தீங்கன்னா இதுல வந்து ஒரு மண் நேரம் நீங்க சார்ஜ் போட்டீங்க அப்டின்னா முந்நூறு கிலோ மீட்ரு கொறையாம நீங்க ஓட்டி போலாம் சார்
983,அது மட்டும் இல்லாம இந்த பைக்ல வந்து ப்ளூடூத் கனெக்ட் பண்ணிக்கலாம் நம்ம ஃபோன் யூஸ் பண்ணி இப்ப இப்ப பைக்லே நீங்க போய்ட்ருக்க அப்டின்னா ஃபோன் வந்துச்சின்னா ஒடனே இதுல ப்ளூடூத் கனெக்ட் பண்ணீங்க அப்டின்னா ஸ்பீக்கர் இருக்கும் அந்த ஸ்பீக்கர் மூலமா நீங்க போ ஃபோன் கூட அப்டே போறப்ப பைக்ல போறப்பயே பேசிக்கலாம் ஒய்ஃபை கனெக்ஷன் இருக்கும்
984,அதே மாரி உங்க மொபைல்ல சார்ஜ் இல்ல சப்போஸ் இதாயிடுச்சி அப்டின்னா ஒடனே நீங்க இதுலயே ப நம்ம எலெக்ட்ரிக்கல் பைக்லே சார்ஜ் போட்டுக்கலாம்
985,ப்ரைஸ் பாத்தீங்கன்னா சார் அறுவதாயிரத்துல டூ அறுவத்தையாயிரம் ஆகும் சார்
986,ஆ இஎம்ஐ இருக்கு சார் இப்ப இன்ஸ்டன்ட் பேமெண்ட்டா நீங்க வந்து இருவத்தையாயிரம் கட்டிட்டு இஎம்ஐல போட்டுக்கலாம் சார் நீங்க
987,நீங்க மந்த்லி மந்த்லி ஃபீஸ் பே பே பண்ற மாரி இருக்கும் சார்
988,ஆ மாசம் வந்து மூவாயிரம் ஆ அப்டிக்கா மூவாயிரம் டூ ஐயாயிரம் அப்டி கட்ற மாரி இருக்கும் சார்
989,ஆ கேரண்ட்டி பாத்தீங்கன்னா ஒன் இயர்தான் சார் கேரண்ட்டி
990,இல்ல இல்ல ஒவ் ம டோட்டலாவே உங்களுக்கு எந்த ஃபால்ட் ஆச்சின்னா ஒன் இயர் எதுவா இருந்தாலும் கம்பெனி நாளைக்கி எதுனாலும் பொறுப்பு ஏத்துக்கும்
991,சேரி ஓகேங்க சார் வாங்க சார் நம்ம பண்ணிக்கிலாம் சார் நெக்ஸ்ட் வீக் வாங்க சார் பண்ணிக்கிலாம்
992,ஆ ஓகே சார் போய்ட்டு வாங்க சார்
993,ஆந்திரப்பிரதேஷ் கேரளா கர்நாட்டக்கா மத்தியப்பிரதேஷ் குஜராத்
994,டிவி மற்றும் இணையம் ஓய்வு பெற்றவர்களுக்கும் முதியவர்களுக்கும் ரொம்ப பயனுள்ளதாகவே இருக்கு ஏனா அவங்க நெறைய விஷியங்கள
995,டிவிய பாத்து தெரிஞ்சிக்கிறாங்க சில விஷியங்கள் தெரியாததக்கூட இணையத்தளத்த பாத்து தெரிஞ்சிக்கிறாங்க அவுங்களுக்கு பொழுதுப்போக்கா இணையத்தளம் இருக்கு அத தவிர்த்து அவங்க நல்ல நல்ல விஷியங்கள தெரிஞ்சிக்கிறாங்க இன்னும் அவங்க
996,அவங்களுக்கு தெரியாத பல நியூஸ வந்து தெரிஞ்சிக்கிறாங்க திரைகளை பாக்குறாங்க நெறைய படம்
997,புதுப்புது பாட்டுகள கேக்குறாங்க பழைய பாட்ட கேட்டு ரசிக்கிறாங்க அவங்க நேரத்த கடத்த இன்னும் நெறையா கத்துக்குறாங்க அவங்களுக்கு தெரியாத விஷியங்கள
998,இணையத்துல போட்டு இன்னும் தெரிஞ்சிக்கிறாங்க இணையத்துல அவங்க தேடிப்பாக்குறாங்க
999,இன்னும் என்னன்ன கத்துக்கணுன்ட்டு சில முதியவர்கள் ஏதாவது புதிதா சமைக்கணுன்றதுக்காக அவங்க
1000,செய்யிறதெல்லாம் இணையத்துல பதிவிட்றாங்க அதப்பாத்து நெறைய சிறியவர்கள் கத்துக்குறாங்க இது இணையம் ரொம்ப பயனுள்ளதாக இருக்கு பெற்றவர்களுக்கு மட்டும் அல்ல முதியவர்களுக்கும்
1001,தொலைவில் உள்ள
1002,பலைய புத்தகம் தான் நானு நெறைய புஸ்தகம் படிச்சிக்கிட்டே இருப்பேன் அதுல நான் படிச்சது எதுனா திலகவதி என்ற ஐபிஎஸ் எழுதுன எழுத்தாளர் அவுங்க அவுங்க வந்து
1003,மிகப் பெரிய எழுத்தாளர் அவுங்க எழுதுன கள்மரம்ன்னு ஒரு நாவல் படிச்சிருக்குறேன் அது என்னன்னு கேட்டீங்கன்னா கட்டட தொழிலாளிகள்லாம் அவுங்க படுற கஸ்டங்கள்
1004,அவுங்க எந்த மாரிலாம் வந்து வால்ந்துட்ருக்குறாங்க டெய்லி அவுங்க வேலைக்கு போறாங்கன்னா அதுல எவ்ளோ பிரச்சனைகள சந்திச்சிட்ருக்குறாங்கன்னு இந்த மாரி
1005,நெறைய அதுல போட்ருந்துது அந்த நாவல நான் படிச்சேன் அதுக்கப்பறம் நான் படிச்சது என்னன்னு கேட்டீங்கன்னா இலக்கியத்துல நெறைய நாவல்கள்லாம் படிச்சிருக்குறேன் ராஜேஷ் குமார் நாவல்கள்லாம் படிச்சிருக்குறேன்
1006,அப்பறம் இந்த ஜெயகாந்தன் எழுதிய சில நேரத்தில் சில மனிதர்கள்ன்னு ஒரு நாவல் படிச்சேன் அந்த நாவல் என்னான்னு கேட்டீங்கன்னா அதுல வந்து ஒரு பொண்ணு வந்து ராத்திரி வேலைக்கு போயிட்டு வரும் போது யாரோ ஒரு எக்ஸ் ஆர் ஒய்யி
1007,அவுங்க மூலியமா அவன் கெடுத்துட்றான் அதுக்கப்பறம் அவ வந்து அவ ஒரு பிராமின் குடும்பத்த சேந்த பொண்ணுன்றதுனால அவ வந்து அவுங்க அம்மா அப்பாட்ட போய் சொன்னோன்ன அவுங்க அம்மா எல்லார்ட்டையும் தெரிவிச்சி அவள வீட்ட உட்டு
1008,அனுப்பிட்றாங்க ஒத்த பொம்பளையா இருந்து அந்த பொண்ணு போராடி அதுக்கப்பறம் மிகப் பெரிய போஸ்டிங்ல போயி அந்த கெடுத்தவன கண்டுபுடிச்சி
1009,திரும்ப ஒரு நல்ல ஒரு வால்க்கைய அமைச்சிக்கணுன்னு சொல்றாங்க எல்லாருமே ஆனா அவ என்னா பண்றா தனியா இருந்த மாரி நான் கடைசி வரைக்கும் இருப்பேன்
1010,எனக்கு யாரு துணையும் வேண்டாம் அப்டின்னு சொல்லிட்டு அவ அதேமாரியே தனியாவே இருந்து முன்னேறியிருக்குறா இந்த மாரி நெறைய
1011,இலக்கியத்துல நான் படிச்சதெல்லாம் இருக்குது எனக்கு மிகப் புடிச்ச இலக்கியம் என்னன்னு கேட்டீங்கன்னா சிலப்பதிகாரம் சிலப்பதிகாரத்துல பாத்தீங்கன்னா இப்பியும் சொல்லுவாங்க கோவலனோட மனைவி
1012,எவ்ளோ ஒரு வீரமான பெண்மணியா இருந்தாங்கன்னு அவுங்க ரெண்டுப் பேருமே அவ்ளோ வசதியானங்க இருந்தாங்க அந்த வசதிய எப்படி நம்ப தெரிஞ்சிக்கிறோம்னு சொன்னோம்னா கோவலனோட
1013,மனைவி கண்ணகி கால் சிலம்புல என்னா இருக்கும்னு கேட்டீங்கன்னா மாணிக்க பரல்கள் அதே பாண்டிய மன்னனோட மனைவி
1014,கால் சிலம்பு என்னன்னு கேட்டீங்கன்னா முத்து பரல்கள் இது ரெண்டுமே எது வந்து உயர்ந்ததுன்னு கேட்டோம்னா மாணிக்கம் தான் உயர்ந்தது அந்தக் காலத்துலயே இலக்கியத்துலயே சொல்லிருக்குறாங்க மன்னர விட
1015,கோவலன் கண்ணகியோட குடும்பம் மிகப் பெரிய வசதியா இருந்துருக்குறாங்க அந்த வசதிக்கு எடுத்துக்காட்டு என்னான்னு கேட்டோம்னா அது கண்ணகியோட கால் சிலம்பு தான் அந்தக் காலத்துல நெறையா நவரத்தினங்கள் நெறையா பொன்னு மணி பவளம் முத்து
1016,கோமேதகம் வைரம் இந்த மாரி பல விஷியத்த நெறையா மணிகள்லாம் சொல்லிருக்குறாங்க அதே சமயம் இலக்கியத்துல இருக்குற மணிகன்னு பாத்தா இலக்கியத்துல மணிகள்னு நம்ம நெறையா பாத்தோம்ன்னா சங்கு மணி சுடு மண் மணி
1017,மண்ணு மணல் மரத்துல செஞ்சது இப்ப சங்குனு எடுத்துக்கிட்டிங்கன்னா வெண் சங்குனு சொல்லுவோம் அந்த சங்குல நெறையா மணி செஞ்சிருக்குறாங்க சீப்பு செஞ்சிருக்குறாங்கன்னு இலக்கியத்துல தெரிஞ்சிக்கலாம் சுடு மணின்னா என்னா அர்த்தம்ன்னு கேட்டோம்ன்னா மணிய வந்து
1018,மண்ண வந்து சின்ன சின்னதா ஒரு உருண்டையா எடுத்து அத வந்து வெயில்ல காய வச்சி அதுக்கப்பறமா அத
1019,நெருப்புல வாட்டி கலுத்துல ஒரு ஊசிய வச்சி கோத்து நூல் போட்டு கோத்து அதுக்கப்பறம் கலுத்துல போட்ருக்குறாங்க பழங்காலத்துல ஏகப்பட்ட அணிகலன்கள்
1020,அதாவது நகைகள்ன்னு சொல்லலாம் அந்த மாரி ஏகப்பட்ட அணிகலன்கள அந்தக் காலத்துல நெறையா பன்ப பயன்படுத்திருக்குறாங்க நம்ம நெனச்சிட்ருக்குறோம்
1021,இப்ப தான் நெறையா நகைங்கள போட்டுட்ருக்குறாங்கன்னு பழங்காலத்துலயே நெறையா நகைங்கள எல்லாருமே பயன்படுத்திருக்குறாங்கன்னு மக்கள் தெரிஞ்சிருக்குது
1022,ஏன் ஸ்கூல் லைஃப் வந்து ரொம்ப ஜாலியா இருந்துச்சி நான் வந்து ஸ்கூலுக்கு வந்து எப்பவுமே வந்து லேட்டா தான் போவேன் லேட்டா போயிட்டு வந்து எங்க பிரின்ஸ்பல்கிட்ட வந்து நான் எப்பவுமே திட்டு வாங்கிட்டுதான் இருப்பேன் ஏன் ப்ரின்ஸ்பல் வந்து என்ன வந்து நல்லா
1023,காரி துப்புவாங்க ஏன் இப்டி லேட்டா வர ரெண்டாயிரத்தி ஐநூறு பிள்ளைங்க படிக்கறதுல நீ மட்டுந்தான் லேட்டா வர அப்டின்னு வந்து சொல்லுவாங்க பாதிநாள் நான் வந்து ஸ்கூலுக்கே போ மாட்டேன்
1024,எனக்கு வந்து ரொம்ப புடிக்கும் ஸ்கூல் லைஃப் வந்து ரொம்ப புடிச்சிருந்துச்சி நான் ஏன் ஃபிரண்ட்ஸ மிஸ் பண்றேன் முக்கியமா ஏன் டென்த் லைஃப் வந்து ரொம்ப ஜாலியா இருந்துச்சி ஏன் டென்த் லைஃப் வந்து மறக்கவே முடியாது கோ எட் ஸ்கூலு அவ்ளோ சந்தோஷமா இருப்போனு நெனச்சு கூட நான் பாக்கவே இல்ல
1025,என்னோட டென்த் லைஃப்ல வந்து பசங்களோட ஃபிரண்ட் கேர்ள்ஸோட வந்து நான் ரொம்ப சந்தோஷமா இருந்தேன்
1026,ஈவினிங் கிளாஸு அப்டின்னு சொல்லிட்டு அப்புறம் பாரதி மிஸ் என்ன எப்ப பாத்தாலும் திட்டிக்கிட்டே இருக்கும் காலையில ஸ்கூலுக்கு வரும்போது மார்னிங் கிளாஸ் வரும்போது பாரதி மிஸ்தான் இருப்பாங்க
1027,பாரதி மிஸ் வந்து என்ன வந்து நான் எப்பவுமே லேட்டா தான் வருவேன் என்ன புடிச்சிட்டு தரதரன்னு இழுத்துட்டு போய் ஏ கிளாஸ்ல வந்து உக்கார வச்சிடுவாங்க
1028,அப்றம் நான் வந்து நான் வந்தனாலே எல்லாரும் என்ன திரும்பி பாப்பாங்க எப்பவுமே லேட்டா வந்ட்டு வெளியவேதான் உக்காந்துருப்பேன் ஃபிரண்ட்ஸ்லாம் எல்லாருமே என்ன எப்பவுமே பாத்து சிரிச்சிட்டே இருப்பாங்க தல ஒரு சில நாள் ஸ்கூலுக்கு வந்து லூஸ் மாரி தல கூட வாராம அப்டியே ஓடுவேன்
1029,ஸ்கூல்ல போய் ஃபிரண்ட்ஸ்கிட்ட தான் தல வாருவேன் அப்றம் ஃபுட்டு ஷேர் பண்ணிக்கறது எப்பவுமே எனக்கு மதியானம் வந்து
1030,லஞ்ச் வந்து எங்க அண்ணன் எடுத்துட்டு வந்து குடுத்துருவாங்க சூடா சுட சுட வந்து எனக்கு வீட்லேந்து சாப்பாடு வந்துரும்
1031,ஜாலியா ஃபிரண்ட்ஸோட வந்து சாப்ட்டுட்டு ரொம்ப ஜாலியா இருந்துச்சு டென்த் லைஃப்பு பசங்களோட பாட்டு பாடுறது
1032,அப்றம் மிஸ்ஸுங்களோட ஜாலியா இருக்கறது எல்லா மிஸ்ஸும் என்ன வந்து திட்டிக்கிட்டே இருப்பாங்க அப்பறம் லெவன்த்ல வந்து நான் ஸ்கூலுக்கே போல கொரோனா வந்துருச்சி கொரோனா வந்ததுனால அப்றம் ஒரு சில பிரச்சனையால நான் ஸ்கூலுக்கே போல ஸ்கூலுக்கு போயும் வந்து அங்கயும் லெவன்த்தும் ஜாலியா இருந்துச்சி லெவன்த்தும் நான் வந்து மறக்கவே மாட்டேன் லெவன்த்துக்கு அப்பறம் வந்து அப்பா
1033,டுவெலத் வந்துச்சு விமல் சார்ட்ட ஏங்கப்பா எவ்ளோ திட்டு விமல் சார் வந்து நான் பயங்கரமா என்ன திட்டிட்டே இருப்பாரு கெமிஸ்ட்ரி சாரு நீ வந்து மூன்று தேவிகள் மூதேவி
1034,நீலாம் எதுக்கு ஸ்கூலுக்கு வர டிசி வாங்கிட்டு ஓடிடு என்னென்னமோ திட்டுனாங்க அதெல்லாம் இப்ப நெனைக்கும் போது ரொம்ப சந்தோஷமா இருக்கு நான் ரொம்ப மிஸ் பண்றேன் ஏன் ஸ்கூல் லைஃப்ப திரும்பவும் கெடைக்காதா அப்டின்னு சொல்லிட்டு நெனைச்சிட்ருக்கேன்
1035,இன்னொரு ஒரு சாமி ஸ்கூல்ல படிச்சப்ப அது ரொம்ப ஜெயில் மாரி இருந்துச்சு அப்பறம் நான் ஸ்கூல்ல படிக்கும் போது ரொம்ப
1036,ஜாலியா இருந்துச்சு இன்னும் வந்து நான் அங்க சிக்ஸ்த்துலேந்து படிக்கக் கூடாதா அப்டின்ற ஒரு ஏக்கம் வந்து எனக்கு இருந்துட்டுதான் இருக்கு உண்மையாவே நான் ரொம்ப மிஸ் பண்றேன்
1037,ஸ்கூல் லைஃப் மாரி எந்த லைஃப்மே கெடையாது நான் இப்ப ஃபீல் பண்றேன் ஏன்டா இத்தன் நாள் லீவ் போட்டோம் டெய்லிக்கும் ஸ்கூல்க்கு போயிருக்கலாமேனு ஏன்னா முக்கியமான அந்த ஜாலியா இருக்கற நேரத்துல நான் எப்ப போலையோ அப்பதான் வந்து
1038,எல்லாமே சந்தோஷமா இருந்துருப்பாங்க அடுத்த நாள் இத கேக்கும்போது ரொம்ப கடுப்பா வரும் ரொம்ப மிஸ் பண்றேன் ஸ்கூல் லைஃப் மாரி எந்த லைஃப்மே இல்ல காலேஜ் லைஃப் கூட கெடையாது
