id,ref
1765,சுலபமா இருக்கும் நம்ம வாயில எந்த ஒரு கஷ்ட்டமும் இருக்காது எந்த ஒரு இதுவும் இருக்காது
1766,இப்போ நமக்கு இங்கிலீஷ் பேசுறது ரொம்ப கஷ்டமா இருக்கும் ஆனா நம்ம தமிழ்ல பேசினா
1767,எல்லாத்துக்குமே புரிஞ்சுரும்
1768,நம்ம தமிழ் பே தமிழே தெரியாதவங்க கிட்ட தமிழ் பேசுனா கூட அவுங்களால புரிஞ்சிக்க முடியும் திருப்பியும் மட்டும்தான் பேச முடியாது அப்டி இருக்கும் போது நம்ம மொழி அவ்ளோ ஒரு சிறப்பானது
1769,மொழிக்கு ஈடா எந்த மொழியுமே வர முடியாது
1770,தமிழ் ஒரு அவ்ளோ சிறப்புள்ள மொழி
1771,தம் தமிழ் தமிழ் பேசினா
1772,ரூட்ஸ் அண்ட் ஸ்டெம்ஸ் கிரீன் காபிக்கு பதிலாக எனக்கு கோத்தாஸ் பாதாம் பால் வந்துள்ளது
1773,நான் பாப்பா ஜான் கிட்ட இருந்து ஒரு பார்சல் ஆர்டர் பண்ணணும்
1774,நிறுத்து
1775,வீடு
1776,த்ரீ ஃபைவ் ஒன் ஒன் டூ ஃபைவ் செவன் த்ரீ த்ரீ ஃபைவ் டூ நைன் என்ற பிஆர்ஏஎன் எண் கொண்ட என்னோடைய ஏபிஒய் கணக்கில் தற்போது எவ்வளவு ஹோல்டிங் உள்ளது
1777,ஒன்பது ஜீரோ மூன்று அஞ்சி ஏழு ரெண்டு மூன்று ஒண்ணு ஏழு ஜீரோ மூன்று அட்டு டிஎஃப்சி பேங்க் அட்ரஸிலிருந்து எனக்கு நானூறு ரூபாய் வந்துள்ளதா
1778,கீழ்
1779,ஐந்து மாவட்டங்கள் பேரை சொல்லணுன்னு எடுத்துக்கிட்டோம்னா அங்க விழுப்புரம் அதுக்கப்பறமா திருச்சிராப்பள்ளி
1780,அதுக்கப்பறம் மதுரை மாவட்டோம் அதுக்கப்பறம் திருநெல்வேலி மாவட்டோம் அப்பறம் கன்னியாகுமரி மாவட்டோம் இந்த ஐந்து மாவட்டங்கள் கணக்காயிருச்சி
1781,பதினெட்டு அம்பத்தி நாலு முப்பத்தி அஞ்சு தொண்ணூத்தி அஞ்சு தொண்ணூத்தி மூணு பதினொன்னு என்ற யுஏஎன் எண் கொண்ட என்னுடைய சேமநிதி கணக்குக்கு இபிஎஃப்ஓ பாஸ்புக் பேலன்ஸை பார்க்க வேண்டும்
1782,அமெரிக்கா கால்பந்து ஒரு நடுவரைப் போலவே நாடகங்களைப் பற்றிய முடிவுகள் நடுவர்களால் எடுக்கப்படுகின்றன
1783,ஏன் என்னுடைய பேடீஎம் செயலில் என் பேங்க் பேலன்ஸை பார்க்க முடியவில்லை
1784,எனக்கு பிடித்த ஆன்மீக ஆசிரியர் வந்து முஃப்தி மங்க்குன்ட்டு சிம்பாப்வேவ்ல இருக்குற ஒரு இந்தியாவாழ் ஆன்மீக ஆசிரியர் தான் அவர் பேர் வந்து முஃப்தி மங்க்
1785,அவர பத்தி எப்படி தெரியும்னா எனக்கு சோஷியல் மீடியால தான் ஃபேஸ்புக் யூட்யூப் இன்ஸ்டாகிராம் அப்டி சோஷியல் மீடியால தான் அவர பத்தி தெரியும்
1786,நா வந்து முஸ்லீம் மதத்த பின்பற்றுறதுனால அவர் வந்து ஐந்து வேள தொழுகை நடத்துங்க அப்பறம் வந்து நிம்மதியான வாழ்க்கை எப்படி லீட் பண்றது மோட்டிவேஷன்னு தருவாரு
1787,ஹலோ
1788,ஹலோ மேம் நா உங்க காலேஜ் தான் மேம் செகண்ட் இயர் படிக்கிறேன் மேக்ஸ் டிபார்ட்மன்ட்
1789,ஏ காவியன் மேம்
1790,மேம் இந்த மேரி ஃப்ரெண்ட்ஸ் கூட வெள்ள போம்போது ஐடி கார்டு தொலஞ்டுச்சி மேம்
1791,மேம் மேம் எப்டியாது ரெடி பண்ணி குடுங்க மேம் மேம் ப்ளீஸ் மேம் எக்ஸாம் வேற கிட்ட வந்துருச்சு மேம்
1792,மேம் மேம் எக்ஸாம் வேற கிட்ட வந்துருச்சு மேம்
1793,மேம் மேம் ப்ளீஸ் மேம்
1794,எக்ஸாம் வேற கிட்ட வந்துருச்சி மேம் செமஸ்டர் வேற வந்துருச்சி மேம் ஐ ஐடி கார்டு இருந்தா தான் மேம் எழுதவே வுடுவாங்க
1795,மேம் மேம் ப்ளீஸ் மேம்
1796,மேம் மேம் ப்ளீஸ் மேம்
1797,எப்டியாது ரெடி பண்ணி குடுங்க மேம்
1798,மேம் மேம்
1799,மேம் மேம் ப்ளீஸ் மேம் ப்ளீஸ் மேம் மேம் மேம்
1800,செமஸ்டர் வேற கிட்ட வந்துருச்சி மேம் எக்ஸாம் வேற எழுதணும் மேம் ப்ளீஸ் மேம் ப்ளீஸ் மேம்
1801,மேம் மேம் மேம் அடுத்த செமஸ்டர்லாம் எழுத முடியாது மேம் பேப்பர் அதிகமா இருக்கும் மேம்
1802,வீட்ல வேற படிக்கவே வுட மாட்டாங்க மேம் ப்ளீஸ் மேம்
1803,மேம் மேம் ப்ளீஸ் மேம்
1804,மேம்
1805,சேரி மேம்
1806,ஆ ஓகே மேம்
1807,ஆ ஓகே மேம்
1808,ஓகே மேம்
1809,டேங்க் யூ மேம் இனிமே நா தொலைக்காம பாத்துக்குறேன் மேம் ரொம்ப நன்றி மேம்
1810,ஓகே மேம் பை மேம்
1811,ஆறு
1812,திருச்சி சென்னை சேலம் நாமக்கல் பெரம்பலூர்
1813,ஒன்று நான்கு ஆறு ஒன்பது ஒன்பது எட்டு எட்டு ஒன்று நாலு ஏழு இரண்டு ஐந்து என்ற பேன் எண்ணுக்கான அடல் பென்ஷன் யோஜனாவில் என்னுடைய பங்களிப்புத் தொகை எவ்வளவு என்று பார்த்துச் சொல்ல முடியுமா
1814,பூஜா மதுமித்தா ரேணுகா தேவி சபித்தா லாவண்யா
1815,சன்ப்யூர் ரீஃபைண்டு சூரியகாந்தி எண்ணெய் அனுப்புவதற்குப் பதிலாக டேரா கிரீன்ஸ் சிவப்பு மிளகாய் தூள் அனுப்பிவிட்டார்கள்
1816,கர்மா கெட்டில் டான் ப்ளாக் டீ டீபி க்ரீம் சோப் டிஸ்பென்சர் பியர்டோ ஹேர் சீரம் ஆகியவை அடங்கிய என் ஆர்டர் எந்த நிலையில் உள்ளது
1817,விவசாயம் முக்கியோம் விவசாயம்ன்றது அதான் நாட்டுக்கே தேவ விவசாயம் இல்லனா சாப்பாடு இல்ல
1818,சாப்பாட்டுக்கு உயிர்வாள முக்கியமா தேவ சாப்பாடு அந்த சாப்பாடுக்கு விவசாயம் தான் முக்கியோம்
1819,பண்றப்ப ஒவ்வொருத்தரும் வெளியில வேலக்கு போய்ட்டா விவசாயம் அழிஞ்சி போய்டும் அதனால விவசாயத்த பத்தி தெரிஞ்சவங்க விவசாயத்த பத்தி நல்லா இது பண்ணவங்க விவசாயத்த செய்யணும்
1820,குடும்பத்துல எல்லாருமே செய்யலாட்டியும் குடும்பத்துல ஒரு ரெண்டு பேருக்காச்சும் விவசாயத்த பத்தி தெரிஞ்சிக்கணும் அது மட்டும் இல்லாம விவசாய குடும்பத்துல இருக்க அடுத்தடுத்த தலைமுறைக்கு சொல்லி குடுக்க பாக்கணும் விவசாயத்த பத்தி இல்லாட்டி விவசாயமே அழிஞ்சி போய்டும்
1821,விவசாயத்த பத்தி தெரிஞ்சவுங்க அவங்களுக்குள்ளலயே வச்சிக்காம வீட்ல இருக்க எல்லாத்துக்கும் சொல்லி குடுத்து விவசாயத்துல இருக்க ஈடுப்பாட்ட உண்டாக்கணுமே தவிர வெளியில வேலை போய் செய்யணும் அப்டின்றத தவிர்த்து விவசாயத்துலயே பண்ணா அவுங்க குடும்பமும் நல்லாருக்கும் நாடும் நல்லாருக்கும் விவசாயம் ரொம்ப முக்கியம் விவசாயம் அழிய விடாம பாத்துக்க வேண்டியது நம்ம கடம ஆனா விவசாயம் தெரிஞ்சவுங்க
1822,விவசாயத்த தனக்கு மட்டும் தெரிஞ்சிக்காம வீட்ல இருக்க எல்லாருக்குமே சொல்லி குடுக்கணும் விவசாயத்த இன்னும் மேலும் மேலும் இதாகுறதுக்கு எல்லாருமே பண்ணனும் எல்லாருமே விவசாயம் வந்து கேவலமா நினைக்ககூடாது ஏன்னா விவசாயம் தான் வந்து ரொம்ப முக்கியமானது இந்த உலகத்துலயே அதனால அத பத்தி பண்ணாம
1823,விவசாயத்த வந்து உருவாக்கணும் அப்டின்றது தான் இது
1824,வெள்ளி கெழம பீச்ல நல்லா இருக்குமா
1825,உங்கள் வணிகத்தின் பெறுமதியை அதிகரிப்பதற்கான இன்னொரு வழி என்னவென்றால் பணம் சம்பாதிப்பதற்கான இதர வழிகளைத் தேடுவது
1826,பின்னோக்கி
1827,நாளைக்கு காலையில பில்லுக்கு பணம் கட்ட எனக்கு ஞாபகம்படுத்த மறந்துறாத
1828,டிசம்பர் இருபத்தி இரண்டு இரண்டாயிரம் ஜனவரி இருபத்தி இரண்டு ஆயிரத்து தொள்ளாயிரத்து அறுபத்து ஏலு நவம்பர் இருபத்தி ஆறு இரண்டாயிரத்து ஒன்று
1829,பிப்ரவரி நான்கு இரண்டாயிரத்து இருபத்து ஒன்று
1830,மார்ச் ஒன்பது இரண்டாயிரத்து இருபத்தி இரண்டு
1831,இப்ப திருமண பரிசுன் பாத்திங்கனா
1832,நம்ப அதுக்கு முன்னாடிலாம் கப் அண்ட் சாசர் அந்த நைட் லேம்பு இந்த மாரிலாம் குடுப்போம் ஆனா இப்ப அந்த மாரி எல்லாம் கெடையாது பணமா போடுறாங்க இல்லனா வெட்டிங் ரிங்கா வாங்கி வெச்சிறாங்க
1833,அதுனால நா அது மாரி தான் ஒரு கல்யாணத்து போயி சிஸ்டருக்கு ரிங்கு ரிங்கு போட்டேன்
1834,அவுங்களுக்கு ரொம்ப சந்தோஷோம் அண்ணா ரிங் போட்ருக்காங்க அழகா இருந்துச்சு அப்டின்னு
1835,நானிய பாத்திங்கனா இப்ப வரதட்சணைலாம் வேணாம்பாங்க சில பேர்லாம் ஆனா அவுங்க வீட்ல பண்றத
1836,சில நடமுறைலாம் இருந்துகிட்டு தான் இருக்கு
1837,வரதட்சண எல்லாம் கேக்கறாங்க ஒரு இருவது பெவுன் நக போட்ருங்க ஒரு பைக் வாங்கி குடுத்துருங்க இல்லனா ஒரு கார் வாங்கி குடுத்துருங்க அப்டிலாம் டிமேன்டு வெக்காமலாம் இப்ப இல்ல நு இப்ப நூத்துல ஒரு பத்து பேரு அந்த மாரி இருக்கலாமே தவிர பாக்கி எல்லா எடத்துலியுமே அந்த மாரி எல்லாம் இருக்கு கண்டிப்பா
1838,வரதட்சணலாம் வாங்கிட்டு தான் இருக்காங்க
1839,அப்ப நெறைய பேர் இப்ப படிச்சவுங்கலாம் ஓரளவு மாற்றாங்க ஆனா கிராமப்புறங்கள்ல
1840,அதலாம் இன்னும் மாறல கொஞ்சோம் அதலாம் எதிர்பாத்துட்டு தான் இருக்காங்க இப்ப
1841,நா வீட்லேந்து இங்கேந்து போற பொண்ணு வந்து சந்தோஷமா இருக்கணும்
1842,அப்டிங்கிறதுனால அவுங்களும்
1843,கொஞ்சோம் நக போட்டு பைக் கீக்கு வாங்கி தந்தர்றாங்க
1844,அதலாம் இப்ப வரதட்சணைலாம் நடந்துகிட்டு தான் இருக்கு இன்னும் பியூரா முடியல இல்லன் சொல்ல முடியாது ஆனா பண்ணிட்ருக்காங்க
1845,ஹலோ மேடம்
1846,ஹலோ மேடம் எப்டி இருக்கீங்க
1847,ம் நல்லாருக்கேன்
1848,எப்டி இந்த ரைன்னால ஃபிஃப்ட்டின் டேஸ் ஹாலிடேஸ் விட்டுட்டாங்க எப்டி உங்களுக்கு போனுச்சி
1849,ம் ஆமா அதுவேற இருக்கு
1850,ம் ம்
1851,நானுமே இன்னும் இன்னும் எயிட் லெசன்ஸ் பாக்கி இருக்கு ஃபோர் லெசன்ஸ்தான் முடிச்சிருக்கேன்
1852,பெண்டிங் இன்னோம் அவ்ளோ இருக்கு இன்னும் அவங்கள படிக்க வக்கணும் வேற ம் அதான் அதான் எப்டியாச்சும் முடிச்சாகணும் இந்த ரைன்னோட இந்த ரைன்னால இப்டி வந்துடுச்சி இப்டி ஆவும் போவும் ஃபாஸ்ட்டா போஷன்ஸ முடிக்கிற மாரி இருக்கும்
1853,ம் ஆமா
1854,ம் ஆமாங் மேம்
1855,ம் அதுவேற இருக்கு ஆமா
1856,ம் சேரி மேம்
1857,ம்
1858,ஆ சேரி மேம் கிளாஸ் போ கிளாஸ் போணும் சரி ஓகே அப்றம் பேசலாம்
1859,ஆ ஓகே மேம்
1860,ஹலோ
1861,ஹலோ
1862,ஆ சார் ரமேஷ்
1863,வணக்கம் வணக்கம் சார்
1864,ம்
1865,சொல்லுங்க
1866,ஆமா
1867,வேணுங்களா
1868,ஓஹோ
1869,ஆ
1870,இங்க எந்த பக் நம்ம ராயப்பேட்ட ரோடு கோர்ட்டுக்கு மேல ஆப்போக்கு மு மேல இருக்கறது ஐயங்கார் ஆவென்யூனு இருக்குது
1871,அங்க நெல்லா இருக்குது ஃப்ளாட்டெல்லாம் நல்லா இருக்குது நல்லா ரோடு வசதி நல்லா ப்ளாட்டுங்னு ஒரு நூறு ப்ளாட்டுக்கு மேல இருக்குது
1872,தண்ணி வசதி இருக்குது
1873,அங்க வந்து பாத்திங்கனா ப பஸ்ஸு ஃபெசிலிட்டி நல்லா இருக்குது உங்களுக்கு ஒரு பா அஞ்சி கிலோமீட்டர் தான் நம்ம சிட்டிலந்து அவுட்டோர்ல வரும் எமெர்ஜென்ஸிக்கு எது வேணாலும் பாத்துக்கலாம்
1874,ஒரு ஸ்கொயர் ஃபீட்டு பாத்திங்கனா தொளாயிருபா அந்த ரேஞ்சுல தான் இருக்குது
1875,அந்த மாரி இருக்குது
1876,ஸ்கொயர் ஃபீட்டு குறைவா இருக்க கெடைக்கிறதுனா உன்னும் கொஞ்சோம் உள்ளாரா போனோமுன்னா நம்மளுக்கு ஸ்கொயர் ஸ்கொயர் ஃபீட்டு கொஞ்சோம் கம்மி வெலையில கெடைக்கும் இந்த
1877,உள்ளாரனா அந்த பக்கம் தாளாப்பள்ளிக்கு மேல போவுணும்
1878,அங்க அறநூறுபா ஐநூத்தம்பது ஆற்நூறுவால இருக்குது ஸ்கொயர் ஃபீட்டு அங்க
1879,ரோடு ஸ்பெசிலிட்டி அங்க இருக்காது கொஞ்சோம் நம்ம வாக்காப்புல போனும் ஒரு ஒரு அர கிலோமீட்ரு ஒரு கிலோமீட்ரு உள்ள போவேண்டியதா இருக்கும்
1880,ஆமா இதுனா கூட பாத்து பேசிக்கலாம் தொள்ளாயிருபா ஸ்கொயர் ஃபீட் சொன்னதுலக் கூட எதோ ஒன்னு பண்ணி அவங்க இது ரிஜிஸ்ட்ரேஷன்லாம் ஃப்ரீயா பண்ணிக் குடுக்கறன்றாங்க
1881,ஆமா இதுல
1882,உங்களுக்கு லோன் வசதியும் செஞ்சி குடுக்கறாரு அதுல ஒன்னும் பிரச்சன இல்ல
1883,நீங்க ஒரு இன்ஷியல் அமௌன்ட் இன் இன்ஷியல்னு ஒரு அமௌன்ட்டு நீங்க கட்டிட்டிங்கனா அதுக்கப்பறம் வந்து நம்ம லோன் போட்டு அந்த இது மிச்ச அமௌன்ட்லாம் நீங்க கட்டிட்டு வந்துர்லாம்
1884,ம்
1885,அதுக்கு உங்களுக்கு சப்போர்ட் பண்றோம் அதெல்லாம் சப்போர்ட் பண்ணிக் குடுக்கறோம்
1886,டாக்குமெண்ட் சார்ஜோட சேத்து தான் இது வந்து எந்த விதமான ஒரு வில்லங்கமில்லாத ஒரு இது ஓ நெலோம் ஈஸி ஈஸியா ரிஜிஸ்ட்ரேஷன் பண்ணிக்கிலாம்
1887,அந்த மாரி எடம் வந் தண்ணி நல்ல தண்ணி இருக்குது ஸ்கூலு ஒரு பக்கம் இருக்குது ரெண்டு மூணு ப்ரைவேட்டு ஸ்கூல் கவர்மென்ட் ஸ்கூலாம் பக்கம் இருக்குது நல்லாருக்கும்
1888,ஆ செரி செரிங்க சார் பக்கம் தான் உங்களுக்கு புடிச்சிதுனா வாங்க நேர்ல பேசிக்கிலாம் ஆ ஓகே ம்
1889,நா வந்து எல்கேஜி யுகேஜி மட்டும் இங்கலீஷ் மீடியத்துல படிச்சேன் பாக்கி எல்லா கிளாஸும் தமிழ் மீடியத்துலதான் படிச்சேன் தமிழ் வந்து ரொம்ப அருமையான மொழி ஈஸியா படிக்கலாம் பேசலாம்
1890,எழுதலாம் இங்கலீஷ் விட தமிழ் ரொம்ப ஈஸிதான் படிக்கிறதுலையும் சேரி எழுதுறலையும் சேரி ஈஸியா மனப்பாடம் ஆகும்
1891,அதோட எனக்கு புடிச்ச சப்ஜெக்ட்னா அது தமிழ் மட்டுந்தான் எல்லா சப்ஜெக்டயும் விட தமிழல வந்து நா அதிகமா மார்க் எடுப்பேன்
