id,ref
3137,நீங்க ஸ்கூலுக்கு நேரா டரெக்ட்டா வந்துருங்க நாங்க பசங்கள அசம்பில் பண்ணிடுறோம் நீங்க மெஷர்மெண்ட் எடுத்துக்கிட்டு
3138,ஓகே மேம் சைஸ் எல்லாத்தையும் வாட்ஸ் ஆப் பண்ணிடுறேன் தேங் யு
3139,இந்த நாணயங்கள் தாமிரத்தில் மட்டுமே அறியப்படுகின்றன மேலும் அவை மிகவும் தேய்ந்து போயுள்ளன
3140,நான் விற்பனைப் பரிவர்த்தனைக்கு எஸ்ஐபி கோரிக்கை வைக்கலாமா
3141,கிரிக்கெட் எனக்குப் புடிக்கும் மேம் கண்டிப்பா இத பத்தி நான் விவரமா சொல்றேன் கிரிக்கெட் வந்து எங்க வி ஊர்ல எல்லாருமே ரெகுலரா கண்டிப்பா வாரா வாரம் வெளாடுவோம்
3142,கிரிக்கெட்டுக்காக ஒரு கூட்டமே இருக்குது கிரிக்கெட் இல்லீனா உயிரைவே விட்டுருவோம் அந்தளவுக்கு இருப்போம் கிரிக்கெட் ஞாயித்துக் கெழம
3143,கண்டிப்பா கம்பல்சரி கிரிக்கெட் வெளாண்டுருவோம் ஏ நான் வெளாட போலினாலும் என்ன வீட்டுக்கே வந்து கூட்டிட்டு போய்டுவாங்க பேட் எடுத்துட்டு பால் எடுத்துட்டு பால்லாம் சண்டப் போட்டுட்டு ஆளுக்கு கொஞ்ச கொஞ்சம் காச குடுத்து
3144,பால் வாங்கிட்டு ஒரு ரெண்டு டீமா பிரிஞ்சுகிட்டு பெட் கட்டி வெளையாடுவோம் அது வெளையாட்றது நமக்கு இன்னும் ஆர்வத்த அதிகமாத் தூண்டும்
3145,ஒ ஒவ் யார நாங்க பதினோரு பேரு அவிங்க மட்டுந்தான் எங்க அணில இருப்பாங்க அவிங்க பதினோரு பேரு ரெண்டு அணில இருக்கும் மாறிலாம் வெளையாட மாட்டோம் எங்களுக்குள்ள ஒப்பந்தம் என்னனா
3146,ஒன் அணில இருக்கும் ஒன் அணில வெளையாட்ணும் ஏன் அணில இருக்கறவன் ஏன் அணில மட்டுந்தான் வெளையாடணும் பதினோரு பேரு சரியா பதினோரு மணிக்கி ஆரம்பிப்போம்
3147,பதினோரு மணிக்கு ஓன் அணில எத்தன பேர் இருக்காங்களோ நாங்க டாஸ் போட்டு அவிங்க மட்டுந்தான் வெளாடுவாங்க பத்து பேரு இருந்தாலும் பத்து பேரு வச்சிதான் வெளையாடணும் ஓன் ஆ அணில பதினோறாவதா ஒருத்தன் வந்தா அவன சேத்திக்கலாம் இல்லீனா பத்து பேரு மட்டுந்தான் வெளையாடமுடியும்
3148,பதினொன்னாவதா ஒருத்தன இங்க எங்க அணில இருந்து அந்த அணிக்கு குடுக்க மாட்டோம் வெளாடவும் கூடாது அதே இல்ல எங்களுக்குள்ள உள்ள
3149,ஒரு விளையாட்டுத்தனமான விதிமுறையில அதுவும் ஒன்னு அப்பிடி அணி போறதுனால எல்லாருமே சாப்ட்டாங்க சாப்புடல அது எல்லாமே தாண்டி சரியா பதினோரு மணிக்கி வந்துருவாங்க பதினோரு மணிக்கி யாரு வரலயோ அவிங்களுக்கு தண்டனைங்கிற பேர்ல
3150,அர மண் நேரம் வெயில்லயே நிக்க வச்சிருவோம் எந்த ப வெளையாடவும் பேட் பண்ணவும் குடுக்கமாட்டோம் பந்து போடவும் குடுக்கமாட்டோம்
3151,அதனாலயே அது ரொம்ப நகைச்சுவையாவும் போகும் எங்களுக்கு அது ஒரு உடற்பயிற்சியாவும் இருக்கும் எத்தன வருஷம் ஆனாலும் எங்களோட
3152,மிகப்பெரிய உயிரா இருக்கிற வெளையாட்டு கிரிக்கெட்டு தான் அதனால அத நான் எங்களுக்காகவும் யாருக்காகவும் எதுக்காகவும் எப்பயுமே விட்டுக்குடுக்கமாட்டோம்
3153,கிரிக்கெட் வந்து எங்களுக்கு ஒரு வரப்பிரசாத மேரி அது வெளையாட தெரியும் தெரியாது ஜா நண்பர்களோட இணைஞ்சிருக்கிற வாரத்துல ஒரு நாள் அதனால அத நாங்க விட்டுக் குடுக்க மாட்டோம்
3154,அதுல ஜெ கம்மியாதான் பெட் கட்டுவோம் அத ஜெவிச்சி வந்தாலும் வரும் ஆனந்தம் அது கிடைச்சு நாங்க எல்லாருமே அந்த கலந்து புதுசா பேட் வாங்குறது பந்து வாங்குறது எல்லாமே நாங்க அ அத்தனப் பேரும் வெளையாண்டு வின் பண்ணுண
3155,பணத் தொகையிலருந்துதான் அதெல்லாம் வாங்குவோம் அதனால எங்களுக்கு அது ரொம்ப புடிச்ச கேம் அதுலருந்து நாங்க பின் வாங்கவும் மாட்டோம் எப்பயுமே பண்ண மாட்டோம் கடைசி வரைகிலும் திருமணமே ஆனாலும் எங்களுக்கு வெளையாடக்கூடியும் புடிச்ச கேம்ல கிரிக்கெட்டும் ஒன்னு
3156,ஹலோ ஹலோ வணக்கம் மேடம்
3157,மேடம் உங்க காலேஜ்ல நான் தேர்ட் இயர் ஸ்டூடண்ட் மேடம்
3158,நாங்க உங்க காலேஜ்ல தேர்ட் இயர் ஸ்டூடண்ட் ஏன் பெரு ராஜு
3159,ஹலோ கேக்குதுங்களா
3160,ஆ ஆமாங் மேடம் நான் வந்து தேர்ட் இயரு ஹாஸ்ட்டல் ஸ்டூடண்ட்டு எங்களுக்கு குடுக்குற போ புரவைட் பண்ற ஃபுட்டு சரியில்ல
3161,அதை நீங்க வந்து இன்வைஸ் பண்ணணும் இன்ஸ்பெக்ஷன் பண்ணணும் மேடம் எங்களுக்கு குடுக்குற காசு மட்டும் வசூல் பண்றாங்க சாப்பாடு மட்டும் சரியா குடுக்குறது இல்ல சரியா குடுக்குறது இல்ல இதை யாருக்கு சொல்றது யாருக்கு புரியிறது சொல்லுங்க
3162,ரெகுலரா நாங்க ரெகுலரா இருக்கோம் மேடம் இன்னிக்கின்றது இல்ல எப்பவுமே கொஞ்ச கொஞ்சமா ஒரு ஒரு டைம் குறஞ்சுட்டு
3163,அதனால நீங்க செக் பண்ணி எங்களுக்கு எதாவுது பண்ணணும் பண்ங்க
3164,வாடன் கிட்ட சொன்னோங்க மேடம்
3165,ஆ நாங்க பிரின்சிபலுக்கு சொல்றோங்குறாங்க
3166,ஆமாங்க
3167,ஆ
3168,ஆ
3169,சரிங்
3170,மேம் மறுபடியும் யார்டியாவுது கம்பிளைண்ட் பண்ணாம உங்களுக்கு ஆ சொல்லுங்க மேடம்
3171,ஓகேங் ஓகே
3172,ஓகே மேடம்
3173,ஓகே தேங்கியூ தேங்க்ஸ்
3174,ஹலோ
3175,சொல்லுங்க சார் ஆமாங்க சார்
3176,ஆமா சார் ஒர்க் ஷாப் தான் சார் சொல்லுங்க சார்
3177,எங்க சார் நிக்கிறீங்க கரெக்டா
3178,டோல் கேட் பக்கத்துல இருக்குறீங்களா
3179,ம் பாக்கலாம் சார் ஆ டயர் நல்லா இருக்குங்களா பஞ்சர் மட்டுந்தான் இருக்குதா இப்ப எந்த டயர் சார் பஞ்சர் ஆயிருக்கு
3180,ஃப்ரண்ட் சைட் லெஃப்ட் டயருங்களா டயர் நல்லா இருக்குங்களா
3181,இல்ல சார் நீங்க சொன்னீங்கன்னா இப்ப கடைலேர்ந்து ஒரு டயர் போட்டு அனுப்ச்சுடுவோம் அதுக்குதான் கேக்குறேன் அங்க வந்து பிறகு மறுபடியும் அங்கேர்ந்து வரணும் நாங்க திருப்பி வரணும் ஏன்னா கா
3182,டயருக்கு சார்ஜ்ஜி போடுவோம் சார் டயர் எப்டி சும்மா மாட்டிட்டு வர முடியும்
3183,நீங்க வண்டி பஞ்சர் ஆன பிறகு ஒடனே ஓரங்களா இல்ல ரன்னிங்ல பஞ்சர் ஆச்சா
3184,அப்ப கொஞ்ச தூரம் வண்டி ஓட்டிட்டீங்க
3185,அலாய்மெண்ட்டு பாக்க வேண்டியது இருக்கும் சார் ஏன்னா பஞ்சர் ஆனா டயர் ஓட்டிருந்துதுன்னா டயர் வெடிச்சிட்டுயிருக்கும் கண்டிப்பா டிஸ்க்கு
3186,டிஸ்க்கு பெண்டாயி இருந்தாலும் அது திருப்பி டயர் மாத்துனா கொஞ்சம் ஃப்ராப்ளம் தான் வரும் ஒரு வேலையா கலட்டி பா பாத்துட்லாம் சார் ரெடி பண்ணியே மாட்டிட்லாம்
3187,சார் நீங்க அலெய்மெண்ட்ல்லாம் டயம் ஆவாது சார் அது ஒரு ஹாஃப் ஆன் அவர்லையே ரெடி பண்ணிட்லாம் நீங்க என்னா டயர் உங்க வண்டில போட்ருக்கீங்கன்னு சொல்லுங்க நாங்க டயர் செட்டா எடுத்துட்டு வந்துட்றோம் டிஸ்க்கோட கூட எடுத்துட்டு வந்துட்றேன்
3188,எம்ஆர்எஃப்ல போட்ருக்கீங்களா
3189,ஓகே சார்
3190,சார் வண்டி என்னா வண்டின்னு சொல்லீங்களே வண்டி கார் என்னா கார்னு அத சொல்லுங்க
3191,ஹெட்டிகா ஆ ஓகே சார் ஓகே சார் நாங்க எடுத்துட்டு வந்துட்றோம் சார் டிஸ்க்கோட நாங்க எடுத்துட்டு வந்துட்றோம் நாங்க கிட்ட வந்து கால் பண்றோம் சார் கொஞ்சம் கை காமிங்க
3192,ஓகே சார் இன்னும் ஒரு பத்து நிம்ஷம் அங்க வண்டி வந்துரும் சார் மாத்திக்கலாம் சார் வெயிட் பண்ணுங்க
3193,இன்னும் பத்தே நிம்ஷம் சார் வந்துட்றேன் வெயிட் பண்ணுங்க
3194,ஆயிரத்து தொள்ளாயிரத்து அறுவத்தி நான்காம் ஆண்டில் அவர் சிம்லாவிலிருந்து கல்கத்தாவுக்கு ஜிஓசிஇன் சி கிழக்கு கமாண்டாக மாறினார் நவம்பர் பதினாறு அன்று அவரது நியமனத்தைப் பெற்றார்
3195,பரிந்துரைக்கப்படும் ஐஸ்கிரீம்கள் அனைத்தையும் மக்கள் விரும்ப வரிசைப்படி பட்டியலிட்டுக் காட்டவும்
3196,கெட் இன் மேம்
3197,ம் குட் மார்னிங் மேம்
3198,நம்ம காலேஜ் எயித் செமஸ்டர் நடக்குது மேம்
3199,கேம்பஸ் இன்டெர்வியூ அரேஞ் பண்ணிருக்கீங்களா மேம் ஏதாவது
3200,ஆமா மேம்
3201,ஓகே மேம்
3202,ஆமா மேம்
3203,ஆமா மேம்
3204,கரெக்ட் மேம் ஸ்டுடென்ட்ஸுக்கு பெனிபிட்டா இருக்குங்களா மேம் சேல்ரி இதெல்லாம்
3205,ஓகே மேம்
3206,ஆ கண்
3207,கண்டிப்பா கண்டிப்பா மேம்
3208,ம் குட் மேம் சூப்பர் மேம்
3209,என்ன மேம்
3210,மேம் எல்லாம் நீங்களே சொல்லிட்டீங்க நான் சொல்ல என்ன மேம் இருக்கு ஸ்டுடென்ட்ஸுலாம் நல்லாவே
3211,அதான் மேம் ஸ்டுடென்ட்ஸ் எல்லாம் நல்லாவே குவாலிட்டி நல்லா ட்ரைனிங் எடுத்துருக்காங்க இப்போ நம்ம காலேஜ் தான் பெஸ்ட்ல இருக்குன்னு நினைக்குறேன்
3212,டாப் லெவல்ல இருக்கு
3213,ஆம் மேம்
3214,ஆ ஆமா மேம்
3215,ஆ ஓகே ஓகே மேம்
3216,ஓகே ஓகே மேம்
3217,ஓகே தேங்க்கியூ மேம்
3218,ஏழு எட்டு ஒன்னு ஒன்பது ஏழு ஏழு ஒன்பது பூஜ்ஜியம் ஆறு ஒன்னு மூணு என்ற தொலைபேசி எண்ணுக்கு இரண்டாயிரத்தி பதினெட்டு பத்தொம்போது கல்வியாண்டில் என்எஸ்பியில் சமர்ப்பிக்கப்பட்ட புது உதவித்தொகை விண்ணப்பங்களின் முழுப்பட்டியலையும் தர முடியுமா
3219,ஹியூமன் வெல்ஃபேர் சேரிட்டபில் ட்ரஸ்ட் என்ஜிஓ பட்டியலில் உள்ளதா ஆம் என்றால் அதற்கு ரூ மூவாயிரம் நன்கொடை அனுப்பவும்
3220,ஹலோ யாருங்
3221,ஆ ஆமாங்கம்மா ஆமாங்கம்மா சொல்லுங்க என்ன
3222,அப்பிடிங்களா சேரி சேரி நீங்க வாங்க பாத்துக்கலாம்
3223,காசு வந்து ஒரு அறுவது ருவா ஆவும்
3224,ஆ ஆமா அறுவது ருவா ஆவும் நீங்க வரப்ப என்ன பண்றீங்கன்னா இது ஆதார் கார்ட் ஜெராக்ஸ் வெச்சிருக்கிறீங்களா தொலஞ்சி போன ஆதார் கார்டோட ஜெராக்ஸு
3225,அது இல்லிங்களா சேரி இந்த எந்த நம்பர்ல வந்து பதிவு பண்ணிங்க ஆதார் கார்டு
3226,இல்ல நீங்க ஃபோன் நம்பரு
3227,ஃபோன் நம்பரு குடுத்துருப்பீங்கள
3228,சேரி
3229,சேரி இந்த இந்த ஃபோன் நம்பர்ல பண்ணிருப்பீங்களா இல்ல இந்த நம்பர் தான குடுத்துருப்பீங்க
3230,சேரி அப்பன்னா ஒன்னும் பிரச்சன இல்லைங்மா நீங்க அந்த ஃபோன்ன எடுத்துட்டு வாங்க
3231,சேரி சேரிங் ஆ சேரி அது தேவப்படும் நீங்க ஃபோனு எடுத்துட்டு அப்பறோம் வந்து ரேஷன் கார்டு ஃபோட்டோவும் எடுத்துட்டு வந்துருங்கம்மா
3232,ஆ சேரி என்னைக்கு வரீங்க
3233,போதும் அவ்ளோ தான் அந்த மூணு மட்டும் எடுத்துட்டு வாங்க
3234,ஆ அத வெச்சே நம்ம பண்ணிக்கிலாங்
3235,சேரிங் ஆ எப் என்னிக்கி வரீங்க
3236,ஆ நீங்க நாளைக் கூட வாங்கம்மா பாத்துக்கலாம்
3237,இன்னிக்கி லேட் ஆயிருச்சி நீங்க நாளைக் காலையில ஒரு பத்தரைக்காட்டோம் வந்தீங்னா கூட்டோம் இருக்காது
3238,ஆ அப்பறோம் அப்போ கால்ல சீக்கிரமா பண்ணிக்கிலாங்
3239,ஆ சேரிங் நாளைக்கி வாங்கம்மா
3240,சேரி வந்து நீங் கொஞ்சோம் பத்தரைக்காட்டோம் சீக்கிரமா வந்தீங்னா நா பாத்து பண்ணிறங் கூட்டோம் இருக்காது அப்போ
3241,சேரிங் சேரிங்க
3242,நான் வந்து மீஷோல வந்து ஒரு பிங்க் கலர் சுடிதார் ஆர்ட்ரு போட்டுருந்தேன் அந்த சுடிதார்ல இருந்த டிசைன்ஸ்ல்லாம் நான் போன்ல பாத்த மாரியே அப்டியே எடுத்துன்னு வந்து குடுத்துருந்தாங்க எனக்கு ரொம்ப புடிச்சிருந்துச்சி அந்த பிங்க் கலர் சுடிதாரக்கூட
3243,ஒரு ஒயிட் கலர் ஷால் வாங்கிட்டு இருந்தேன் அந்த ஷால் அந்த ஷாலயும் அந்த பிங்க் கலர் சுடிதாரையும் என்னுடய காலேஜிக்கி போட்டு போயிருந்தேன்
3244,ஏன் ஃப்ரெண்ஸுங்கள்ல்லாம் இது எங்க பர்ச்சேஸ் பண்ணே அப்டின்னு சொல்ட்டு கேட்டாங்க நான் வந்து மீஷோல தான் வாங்குனேன் காசும் கொஞ்சம் கம்மியாவே இருந்துச்சி அப்டின்னு சொல்ட்டு நான் ஏன் ஃப்ரெண்ஸுங்கக்கிட்டலாம் சொன்னேன் அது கூட ஒரு லிஃப்டிக் ஒன்னு குடுத்துட்டு இருந்தாங்க லிஃப்டிக்
3245,கொஞ்சம் குவாலிட்டியா இல்லன்னாலும் நல்லா இருந்துச்சி போட்டுக்க பெஸ்ட்டா இருந்துச்சி
3246,அதுக்கப்பறம் ஏன் ஃப்ரெண்ஸுங்க எனக்கும் கொஞ்சம் பர்ச்சேஸ் பண்ணிக்குடுடி இல்ல எந்த ஆப்பு எப்டி வெப்சைட்டுக்குள்ளல்லாம் போனன்னு சொல்ட்டு கேட்டாளுங்க நானும் சொன்னேன்
3247,இதுல தான் போணும் அதுல தான் போணும் ஏய் நல்லா இருந்துச்சி நானும் வாங்கிட்டேன்டி அப்டின்லாம் ஃபோன் பண்ணி சொன்னாளுங்க ஓகேடி நீ போட்டுப்பாரு இன்னும் சூப்பரா இருக்கும் அப்டின்னு சொல்ட்டு நான் சொன்னேன் சரிடி நான் போட்டு உனக்கு திரும்ப ஃபோட்டோ எடுத்து அனுப்புறேன் ஹான் சரிடி அப்டின்னு சொல்ட்டு சொன்னாங்க
3248,வெயில் காலம் வந்துதுன்னா எங்களுக்கு ரொம்ப கஸ்டமா இருக்கும் வெயில் தாக்கம் அதிகமா இருக்கும் வெயில் காலம்
3249,மல வந்தா மலையின் தாக்கத்துல இது வெள்ளங்கள் மல ரொம்ப பெய்து
3250,ஒரு வருசத்துக்கு பெய்ற மல ஒரே நாளையில பெய்ற மாரி பெய்துட்டு பேயிருது இங்க வந்து வெள்ளம்
