id,ref
1,எனக்கு வரைய பிடிக்காத நாள்னு ஒன்னுமே இல்ல எதாவுது ஒரு படோம் வரையும் போது வந்து எதாவுது வீட்டுல எதாவுது வேலை சொன்னாங்கனா அப்ப எனக்கு கோவம் வரும் ஏன்னும் மோது நம்ம ஒரு படத்த வந்து இன்ட்ரெஸ்ட்டா வரையணும் வரையும் போது
2,அதுக்கேத்த மாரி வந்து ஒரு இந்த வேல செய்யி அந்த வேல செய்யின்னு சொல்லி சொல்லம் போது வந்து நம்ம அத வந்து ஃபுல்லாவே ஃபினிஷிங்கா பண்ண முடியாது
3,இதுனால வந்து கொஞ்சோம் அதிகமா கோவப்பட்ருக்கேன் ஆனா வந்து எங்க வீட்டுக்காரவங்க வந்து
4,நீ வந்து ஒனக்கு ஒ எதுல வந்து ஒனக்கு இன்ட்ரெஸ்ட்டா இருக்குதோ அத நீ பண்ணு அப்டினு சொல்லி அவுங்க ஃபுல் சப்போர்ட் வந்து பண்ணுவாங்க
5,அது அவுங்க சப்போர்ட் இருக்குறதுனால வந்து நா அத பெருசா எதையுமே கண்டுக்க மாட்டேன் நா இப்போதைக்கி வந்து நா நெறைய ட்ராயிங் வந்து வரைஞ்சி வச்சிருக்கேன் அத பாக்கும் போதுலாம் வந்து இது நம்ம வரைஞ்ச படோம் அப்டினு சொல்லி நா என் கொழந்தைங்க கிட்டையும் காமிச்சிட்டு நா ரொம்ப சந்தோஷப்படுவேன்
6,இதுனால வந்து எனக்கும் ஒரு வேலை மத்த எந்த வேலையா இருந்தாலும் நா அது ஃபர்ஸ்ட்டு வந்து ட்ராயிங் வந்து வரைஞ்சிட்டுதான் வந்து அதுக்கு ஏத்தா மாரி வந்து நா அந்த வேலைய வந்து செய்வேன் இதுனால வந்து யார் என்ன சொன்னாலும் பரவாயில்லன்ற மாரி அத அக்செப்ட் பண்ணிட்டு நா போயிட்டே இருப்பேன்
7,நா வந்து சின்ன கொழந்தையா இருக்கும் போதுலேந்தே சின்ன வயசுலேருந்தே வந்து நா வந்து கார்டனிங் வந்து தோட்டமிடுறதுக்கு வந்து ஆரமிச்சிட்டேன் ஏன்னா எனக்கு செடி வளக்குறது வந்து அப்பையிலேந்தே ரொம்ப புடிக்கும் அதேமாரி வந்து
8,சின்ன சின்ன செடி பூச்செடிகள் அந்தமாரிலாம் நா வளக்க ஆரமிச்சேன் அது மட்டும் இல்லாம தாவரங்கள் வந்து ரெண்டு தாவரங்கள் ஒன்னு ஒட்டு ஒட்டு விதை தாவரங்கள் அந்தமாரிலாம் வந்து சின்ன புள்ளையிலே வந்து பாத்து
9,நா யூட்யூப்லாம் பாப்பேன் அம்மாவோட மொபைல்ல அதுல பாத்து தான் இது வளக்க ஆரமிச்சேன் அதேமாரி மாடித்தோட்டம் வைக்கிறது வந்து எனக்கு ரொம்ப புடிக்கும் பக்கத்து வீட்டுல உள்ளவங்களலாம் பாத்து ஒரு மாரி இன்ஸ்பயராயிதான் நா அது வளக்க ஆரமிச்சேன் எனக்கு ரொம்ப புடிக்கும் மாடித்தோட்டம்லாம் அதேமாதிரி
10,மாடித்தோட்டத்துலே எப்டின்னா கொடியா வளரும்ல தாவரங்கள் பாகற்காய் பீர்கங்காய் புடலங்காய் அந்தமாதிரி அது மட்டும் இல்லாம குத்துச்செடி மல்லியப்பூ அந்தமாதிரி அப்பறம் தக்காளி
11,மிளகாய் அந்த செடி எல்லாமே வந்து சின்ன கொழந்தையாருக்கும் போதே வளக்க ஆரமிச்சிட்டேன் இப்பவும் லாக்டவுன் அந்த பீரியட்லலாமுமே வந்து நா தோட்டமிட ஆரமிச்சேன் எனக்கு வந்து எப்போதுமே தோட்டம் வந்து பக்கத்துல உள்ளவங்கள பாத்து பாத்து எனக்கு அத மாரி இருந்தா ரொம்ப புடிக்கும் அதுனால நா வந்து தோட்டமிடுறது வந்து ரொம்ப புடிக்கும் அதுனால வளக்க ஆரமிச்சிட்டேன்
12,குட் டயட் கருப்பு அரிசி விலை சந்தை விலைக்கு ஏற்றவாறு இல்லை
13,ஹலோ
14,ஆ ஆமா ப்ரோ
15,ஆ ஆமா ஆமா சொல்லுங்க என்னா விஷியம்
16,ஆ
17,ஆ நா ஈவினிங் போல வர்றேன் ப்ரோ இப்ப வேற ஒர்க்ல இருக்கேன்
18,ஆ அதான் ஈவினிங் போல வர்றேன்
19,ஆ சேரி ஓகே
20,ஆ புதுசா இப்ப கிராம்ப்டன்ல டுவென்டி ஃபோர் வாட்ஸ்ல வந்துருக்கு
21,கிராம்ப்டன்ல டுவென்டி ஃபோர் வாட்ஸ் வந்துருக்கு மெட்ரோ கம்பெனில வந்து ஒன்னு டுவென்டி டூ வாட்ஸ்ல ஒன்னு வந்துருக்கு நீங்க எது விருப்பப்பட்றீங்களோ அதே போட்லாம் கம்மி ரேன்ட்ல வேணுமா இல்ல உங்களுக்கு ஹை பட்ஜட்ல வேணுமா
22,ஆவரேஜே நீங்க மெட்ரோவே போட்டுக்கங்க மெட்ரோ நூத்தி தொண்ணூறுவாக்கிட்ட தான் வரும்
23,ஆ உங்களுக்கு எத்தன லைட்டு வேணும்
24,நானூறுவா அந்த எமெர்ஜென்சி லைட்டு சொல்றீங்களா
25,ஆ எனர்ஜி சேவிங் சரிங்க அதுல ஆர்பிட் கம்பெனிலையும் இருக்கு கிராம்ப்டன்லையும் இருக்கு உங்களுக்கு எதுமேரி வேணும்
26,ஆர்பிட்லையே குடுத்துடவா அது நானூறுவா வராது நானூத்தி எண்பதுரூவா கிட்ட வரும் அது
27,அதுன்னா நாலு மண் நேரம் நீங்க சார்ஜ் போட்டு வச்சிக்கிங்க சிக்ஸ் ஹவர்ஸ் பேக்கப் குடுக்கும்
28,ஆ அது நார்மலா நீங்க காப்பர் வச்சி கூட யூஸ் பண்ணிக்கலாம்
29,ஆ நீங்க சார்ஜ் போட்டு ஒரு நாலு மண் நேரம் சார்ஜ் போட்டு ஏத்தி வச்சிருந்தீங்கன்னா கரண்ட்டு பெயிட்டுன்னா அதுவா எரியும்
30,அதுக்கு லைட் ஆன்லையே இருக்கணும் அப்டின்னு அவசியம் இல்ல ஃபஸ்ட்டு நீங்க ஜார்ஜு போட்ற வரைக்கும் ஒரு நாலு மண் நேரம் ஜார்ஜு போட்ற வரைக்கும் லைட்டு எரிஞ்சா போதும் அதுக்கப்புறம் நீங்க ஆஃப் பண்ணிக்கிங்க கரண்ட் போனவொன்னே நீங்க ஆன் பண்ணா கூட லைட் எரியும்
31,அந்த சிஸ்டம் ஆ அது எரியும்
32,அதெல்லாம் நீங்க நா ஈவினிங் போல வர்றேன் இப்ப நா ஒரு ஒர்க்கா இருக்கேன் அத முடிச்சிட்டு நா ஈவினிங் போல வர்றேன் பாத்து குடுத்துறேன் நீங்க லொக்கேஷன் மட்டும் அனுப்பிவுடுங்க
33,ம் சேரி ஓகே
34,கலை ஆகட்டும் கைவினை பொருள்கள் ஆகட்டும் முதலில் எல்லாமே கைகளால வரஞ்சி
35,அது வந்து செஞ்சிகிட்டு இருந்தாங்க இப்பெல்லாம் உலகம் உலகளாவிய எல்லா உலகத்துலருக்குற எல்லாத்தையுமே பாத்துக்கிட்டு த்ரீ டி ஆர்ட் வந்துருச்சி த்ரீ டி மாதிரியே இப்போ நம்ம நெஜமாவே பாக்குற மாதிரியே எல்லாமே
36,செய்ய ஆரமிச்சிட்டாங்க அதே மாதிரியே மொதல்ல எல்லாம் குருகுலம் மாதிரி இன்னொருத்தவங்கட்ட போயி அவங்க வீட்லையே இருந்து அவங்களுக்கான பணிவிடைகள் செய்து தான் கலைகள கத்துக்கிட்டு இருந்தாங்க இப்பெல்லாம் அப்டி இல்ல
37,பள்ளி படிக்கிற மாதிரியே பாடம் படிக்கிற மாதிரி கலைகளுக்கான பள்ளிகளும் திறக்கப்பட்ருச்சி நெறையா எடத்துல இப்போ கலைகள் கத்துக்கிறதுக்காக
38,கல்லூரிகள் பள்ளிகள் கல்லூரிகள் எல்லாமே வந்துருச்சி அதுல போயி கத்துக்கிட்டு இப்ப
39,படிக்க முடியாதுன்னு நெனச்சவங்க கூட எல்லாமே கலைகளையே கத்துக்க ஆரமிச்சிட்டாங்க அதே மாரி கைவினை பொருட்களும் அப்டி தான் இப்ப டிஜிட்டல் ஆர்ட் வந்துருச்சி அதுல எல்லாமே
40,கைல வரைஞ்ச புக்க பாத்து தான் படிச்சிக்கிட்டு இருந்தாங்க இப்பெல்லாம் கணிப்பொறி மூலமா வந்து தெரியாதவங்க கூட கணிப்பொறி மூலமா கத்துக்கிட்டு அதே எல்லாமே செய்ய ஆரமிச்சிட்டாங்க
41,ஹலோ ஆ சொல்லுங்க ஜி புக்
42,போன வாரம் எப்ப சார் என்ன கெழமை
43,எங்க சார் சொல்றீங்க
44,ஆ எப்போ சார் குடுத்தீங்க போன வாரமா
45,போன வாரம் அந்த கோயில் ஃபங்க்ஷன்ல தான் சார் ஒரு பந்த போஸ்த்து போட்டு சாவடிச்சிட்டாங்க ஸ்டேஷன்ல எல்லாரையும் கம்ப்ளைண்டு
46,சரி சார் சரி நீங்க எங்க இருக்கீங்க
47,செரி ஒரு நாளான்னைக்கு இன்னைக்கி என்னா திங்கக்கெழமையா புதன் கெழமை போல நீங்க நேரடியா வந்து கம்ப்ளைன்ட் குடுக்குறீங்களா அந்த பாக்ஸ் எடுத்துட்டு வாங்க ஃபோன் வாங்குன பாக்ஸு
48,எந்த ஏரியால சார் தொலச்சிங்க
49,அந்த ஏரியால அந்த குணசேகரன்றவன் மட்டும் தான் ஃபோன் திருடுவான் நா வேணா அவன புடிச்சி விசாரிச்சி பாக்குறேன்
50,ஆ நீங்க
51,சார் நீங்க எடுத்துட்டு வாங்க ஆவூன்னா தொலச்சிட்டு கேர்லெஸ்ஸா இருக்கறது போலீஸ்காரன புடிச்சி லாஸ்ட்டா சாவடிக்கிறது பாக்ஸ் எடுத்துட்டு வாங்க சார் நாளைக்கு நாளான்னைக்கு எடுத்துட்டு வாங்க புதன் கெழமை
52,அது தான் புதன் கெழமை வர சொன்னேன் புதன் கெழம நா அங்க தான் இருப்பேன் நீங்க வந்து நேரடியா பாருங்க கண்டுபுடிச்சிடுவோம்
53,ஒரு பதினோரு மணி போல வாங்களேன் கரெட்டா
54,ஆ மறக்காம பாக்ஸ் எடுத்துட்டு வாங்க
55,பத்து மணி உங்களுக்கு வேல ஆயிடும் ஓ ஒரு ஆளே பாக்க முடியாது சார் என்ன என்னால குணசேகரன் போய் தேடணும் புடிக்கணும் அவன் ஒரு திருட்டு பையன் சார் அப்பறம் உங்களுக்கு அவன கூப்ட்டு வந்தாலே தெரிஞ்சிரும் ஃபோன் யாரு எடுத்துருப்பாங்கன்ட்டு
56,ஆ நீங்க நாளான்னைகு புதன் கெழமை ஒரு பதினோரு மணி போல வந்துருங்க அது என்னென்னு ட்ரேஸ் பண்ணிக்கலாம் ஃபோன பாக்ஸு மறக்காம எடுத்துட்டு வாங்க சார்
57,ஆ பாக்ஸ் மறந்துடாதீங்க
58,ம் சேரி சார் ம் வாங்க வாங்க
59,சார் சொல்லுங்க சார்
60,வர்ஷாவோட ஃபாதருங்களா சொல்லுங்க சார்
61,செரிங்க
62,சார் இப்ப வர்ஷா லெவன்த்து ஸ்டாண்டர்ட் வர்ஷாதானுங்க சார் அவுங்க ஃபாதர் தான பேசுறது
63,என்ன விஷியோங்க சார்
64,ரெண்டு நாள் லீவ் வேணுன்னு கேக்குறீங்களா சார்
65,சார் இப்ப உங்களுக்கே தெரியும் லெவன்த்து ஸ்டாண்டர்ட் படிக்கிறாங்க இப்ப போர்ஷன்ஸ் எல்லாம் டுவல்த் போர்ஷன்ஸே ஸ்டார்ட் பண்ணியாச்சுங்க சார் சார் இப்ப போய் ரெண்டு நாள் லீவ் வேணுன்னு கேக்குறது வந்து அவுங்களுக்கு தான் டிஃபிகல்ட்டா இருக்கும்
66,ரொம்போ முக்கியமான விஷியமா இருந்தா நீங்க
67,சொல்லுங்க சார்
68,அப்டிங்களா
69,செரி சார் வீட்ல ம்
70,செரி சார் பாப்பாவ வீட்ல தனியா விட்டுட்டு போறத்துக்கு உங்களுக்கு ப்ராப்ளமா இருக்குது அப்டின்னா நா இங்க ஹாஸ்டல்ல கூட கேட்டு உங்களுக்கு பர்மிஷன் வாங்கித்தரேன் நீங்க இங்க கூட விட்டுட்டு போலாமேங்க சார் அப்டி எதாவுது திங்க் பண்ணி பாருங்களேன்
71,செரி சார் இப்ப நீங்க நார்மல் கிளாஸ் ஹவர்ஸுன்னா நீங்க கேக்கறது ஞாயமா இருக்கும் சார் இப்ப ஏ சப்போஸ் எக்ஸாம்ஸ் நடந்துட்ருந்ததுனா என்ன பண்றதுங்க சார் எக்ஸாம்ஸ் அந்த டைம்ல நீங்க கேக்குற டைம்ல கிளாஸஸ் எதாவுது சொல்லிருக்காங்களா மத்த சப்ஜெக்ட் கிளாஸ்ஸே எனக்கு தெரியில
72,இப்ப நா வந்து கம்ப்யூட்டர் சயின்ஸ் எடுத்துட்ருக்கேன் இப்ப ஃபிசிக்ஸோ கெமிஸ்ட்ரியோ எக்ஸாம் எதாவுது சொல்லிருந்தாங்கன்னா அந்த டெஸ்ட் எப்டிங்க சார் எழுதுறது
73,சார் அது வந்து அந்த பர்ட்டிகுலர் சப்ஜெக்ட் ஸ்டாஃப் கிட்ட தான் சார் நம்ம கேக்க முடியும் அவுங்க என்ன சொல்லியிருக்காங்க எதாவுது அசைன்மெண்ட் குடுத்துருக்காங்களா இல்ல டெஸ்ட் எதாவுது வெக்கிறாங்களான்னு தெரியில
74,அது இல்லாம மார்க்ஸுலாம் பாத்திங்களாங் சார் இதுக்கு முன்னாடி நடந்த டெஸ்ட்டு மார்க்ஸுலாம் உங்களுக்கு வீட்டுக்கு வந்துருந்துதுங்களா
75,ஆமா எல்லா சப்ஜெக்ட்லையும் நல்ல மார்க்குங்களா
76,அட்டனென்ஸ் பர்சென்டேஜ் எவ்ளோ இருக்குங்க சார்
77,செரிங்க சார் செரி நீங்க இவ்ளோ கேக்கறதனால வேண்ணா இந்த ஒரு தடவ வேணா எக்ஸ்யூஸ் குடுக்குறோங்க சார் முடிஞ்ச வரைக்கும் ஒரு நாள்ல நீங்க ரிட்டர்ன் வந்துர்ற மாரி பாருங்க சார்
78,ம் ஓகேங்க சார்
79,ஓகே சார் தேங்க்யூ
80,அஞ்சி ஏழு ஜீரோ ரெண்டு ரெண்டு ஒன்னு எனும் பின்கோடு கொண்ட பகுதியில் ஏதேனும் கட்டண கோவோவேக்ஸ் தடுப்பூசி மையம் அருகில் இருக்கிறதா
81,புது நியூஸ் டெக்
82,அந்த காலங்கள்லேருந்து இந்த காலங்கள்ல ஒரு சில எடத்துல செய்ற விஷியோம் என்ன அப்டின்னா வாசல்ல மாட்டு சாணத்த வந்து கரைக்கறதுதான்
83,மாட்டு சாணத்துல வந்துட்டு கிருமி நாசினி இருக்கறதுனால எந்தவிதமான கிருமிகளையும் வீட்டுக்குள்ள அண்டவிடாது அப்டின்னு அறிவியல் பூர்வமா சொல்லிக்கிட்ருக்காங்க
84,ஆரம்பக் காலத்துலல்லாம் வந்து எல்லார் வீட்லயுமே வந்து இந்த மாட்டு சாணம் வந்து மொழுகுன வீடாதான் இருக்கும் ஏனா களிமண் வீடு அந்த வீடு எப்போ வேணாலும் தண்ணிப்பட்டு இதாகிருங்கிறதுனால வீடு ஃபுல்லா மாட்டு சாணத்த வச்சி மொழுவி வெச்சிருப்பாங்க
85,ஆனா நம்ப முன்னோர்கள் வந்து ரொம்ப அறிவாளிங்க அவுங்களுக்கு இதெல்லாம் தெரிஞ்சிருக்கு இது ஒரு கிருமி நாசினி இது இப்டி தான் பயன்படுத்தணும் அப்டின்லாம் யோசிச்சி வச்சிருக்காங்க
86,இன்னும் ஒரு ஏழாம் அறிவுன்னு ஒரு படத்துல கூட சொல்லுவாரு அந்த மூவி முடியப் போற அந்த லாஸ்ட்டு ஒரு அஞ்சி நிமிஷத்துக்கு முன்னாடி சூர்யா வந்து ஒரு இண்டர்வீயூல பேசுற மாதிரி காமிச்சிருப்பாங்க
87,மாட்டு சா எதுக்கு தண்ணி வந்து வாசல்ல மாட்டு சாணத்த தெளிச்சிட்டு கோலம் போடணுன்னா அதுவொரு கிருமி நாசினி அத விட்டுட்டு டிசைன் டிசைனா ஸ்டிக்கர வாங்கி ஒட்றாங்க அப்டின்லாம் சொல்லிருப்பாரு
88,அப்போ இப்ப இருக்குற பசங்கள்லேருந்து எல்லாரும் அய்யோ மாட்டா மாட்டு சாணமா ச்சீ இதெல்லாம் தொடமாட்டேன் அப்டிங்கிற ஒரு மனநிலையில இருக்காங்க
