id,ref
856,అమ్మాయిలకు సపోర్ట్ ఇస్తే వాళ్ళ కూడా ఒలంపిక్స్లోకెళ్ళి ఆడతారు కదా వాళ్ళు కూడా మంచిగా డిమాండ్ వస్తది గేమ్స్లో కూడా
857,ఇద్దరు ముగ్గురు అమ్మాయిలు వెళ్తే వాళ్ళతో పాటు ఇంకా ఇంకా కొంతమంది ఒలింపిక్స్లో ఎళ్ళాలని అనుకుంటారు కదా
858,దానివల్ల వాళ్ళు కూడా డిమాండ్ చేస్తున్నారు గేమ్స్ ఆడదాం అని వాళ్ళకి కూడా ఛాన్సెస్ ఇస్తే అయిపోతది దాని వల్ల ఎక్కువ గేమ్స్లో ఛాన్సెస్ వస్తాయి అమ్మాయిలకి కూడా
859,ఛాన్సెస్ వచ్చి తిరుమల సొసైటీ మారతది అమ్మాయిలకి కూడా ఎక్కువ గేమ్స్ వస్తాయి వాళ్ళు కూడా చాలా ఆడతామని అనుకుంటున్నారు
860,హలో వెంకటరత్నం రెస్టారెంటా అండి చికెన్ కర్రీ ఆర్డర్ చేసాము కాని చికెన్ బిర్యాని వచ్చింది కాబట్టి మీరు మాకు సరైన ఆర్డరు ఇవ్వాలనుకుంటున్నారా లేదా మా నగదు తిరిగిస్తారా
861,హలో
862,బాగున్నావా రజిమ్ బాగున్నావానే ఏం ఫోన్ లేదు ఏం లేదు ఇప్పుడు గుర్తుకొచ్చినా నీకు
863,ఏం లేదే కాలీగా ఉన్న ఇంట్లో కూర్సున్నా ఏడున్నావ్ నువ్
864,నువ్వు సిటీలో ఉంటే ఎంజాయ్ చేస్తాలేవాయే
865,ఏమైంది
866,సరే మా ఇంటికిరా బావుంటది మా ఇల్లు
867,ఏ నిజమే రాయే మా ఇంటికి మంచిగుంటది నువ్వు నీకు కంఫర్ట్గానే ఉంటది సపరేటు నీకు ఒక బెడ్ రూమ్ ఉంటది చేనుకుపోదాం అనుకుంటే చేనుకుపోదాం పల్లి కాయ ఉంటది శనక్కాయ ఉంటది బాయిలు ఉంటయి ఏ నీకు ఏది కావాలంటే అది
868,ఏం కాదులే మా ఇంటికిరా
869,మా ఇంటికిరా మా ఇంటికి వచ్చి నీవు మొహమాట పడొద్దు మా ఇంటికొచ్చి కూడా మంచిగా ఏం కావాలంటే అది ఫ్రెండ్లీగా మంచిగా ఉండాలే
870,ను నువ్వేది అడిగితే అది కాదనా ఏం తినాలనిపిస్తే అది
871,ఏడికి పోదామంటే ఆడికి పోదాం ఊరు తిరుగుదాం పోయి చేన్లు తిరుగుదాం చేలల్లా ఏం పంటలు ఉన్నయి ఏం కథ అవన్నీ చూత్తం
872,చింత చెట్ల మీద అవి ఉంటయ్ గుడ్లగూబలు
873,గుడ్లగూబల్ చూపిస్తారాయే నీకు రియల్గా
874,గుడ్లగూబలు
875,శింత శెట్టు పైన పెద్ద శింత శెట్టు ఉంటదన్నమాట ఇది యనకడ్ద్ది ముసలోల కాలంది అది యనకట్ కాలంది
876,ఫెస్టివల్ చేసుకుంటాము
877,ఫోన్ చెయ్ నాకు నువ్వు ఎట్లొస్తవ్ ఆడికేంచి పటాన్ చెరువు బస్ ఎక్కి సంగారెడ్డిలో దిగు సంగారెడ్డిలో ఆ పటాన్చెర్ల దిగి సంగారెడ్డి బస్ ఎక్కు
878,మరి అంతే సంగారెడ్డిలో దిగగానే నాకు కాల్ చేయు నేను వచ్చి తీసుకుపోతా నిన్ను మా ఇంటికి
879,సరేనా చెరువు గట్టు చెరువు గట్టకపోదాం షాపలు పడదాం షాపలు తిందాం
880,మంచిగుంటై
881,దాంట్లో ఏముందే పట్టాన్కి నేను పడతా కదా దా నేర్పిస్తా నీకు
882,సరేనా
883,సరే మరి
884,ఏం లే మా ఇంటికిరా మంచిగా ఉందాం తిందాం పందాం ఉందాం నువ్వు మళ్ళి రిటర్న్ అయ్యేటప్పుడు ఎల్లు
885,సరే మల్లా జాగ్రత్త బై
886,సమయం
887,సర్దుకోవడం కష్టమైన వ్యక్తితో పని చేయడం చాలా కష్టమైన అనుభవం కావొచ్చు
888,వారు శ్రాకోకులు కలిగించే వారు విమర్శనాస్పదంగా ఉండవచ్చు మరియు ఎల్లప్పుడూ సమస్యలకు కారణమవుతారు ఈ అనుభవము మీకోసము చాలా ఒత్తుడి కలిగిస్తుంది మరియు మీరు విసిగిపోవడం లేదా నిరాశ చెందడం సహజం
889,మీరు సర్దుకోవడం కష్టమైన వ్యక్తితో
890,చేస్తున్నట్లయితే సమస్య పరిష్కరించడానికి మీరు కొన్న
891,విషయాలు
892,చేయవచ్చు
893,సమస్యను గుర్తించండి అతడుతో సమస్య ఏమిటో గుర్తించడం వ్యక్తి ఏ విధంగా కష్టంగా ఉంటాడు వారు ఏం చేస్తున్నారు
894,సంభాషించండి వ్యక్తితో సంభాషించడం చాలా ముఖ్యం వారితో మీరు ఎలా సంబాషించగలరో మరియు వారు మీతో ఎలా సంబాషించగలరో చర్చించండి
895,సహజంగా ఉండండి
896,సర్దుకోవడం కష్టమైన వ్యక్తితో పనిచేయడం చాలా సహజం
897,అనవసరం వారికి మీలాంటి పనితీరు లేదని గుర్తించుకోండి
898,మీరు వారితో కమ్యూనికేట్ చేయడానికి ప్రయత్నిస్తుంటే మీరు ఓపుగా ఉండాలి మరియు చిరాకు చెందగూడదు
899,సహాయంకోసం అడగండి మీరు సర్దుకోవడం కష్టమైన వ్యక్తితో పని చేస్తున్నట్లయితే సహాయం కోసం అడగడం ముఖ్యం మీరు మీ యజమానిని సహోద్యోగులను లేదా
900,కౌన్సిలర్లను సంప్రదించవచ్చు వారు మీకు సలహా ఇవ్వగలరు మరియు మీరు సమస్యలను పరిష్కరించుకొనేలా మీకు
901,సహాయపడవచ్చు
902,నాకు చిన్నప్పనుంటి రకరకాలు వంటడం చేయడం చాలా ఇష్టం అందుకే నేను ఎన్నో రకరకాల వంటలు ట్రై చేస్తా ఉంటాను
903,నేను ఇప్పటి వరకు చాలా ట్రై చేసాను నేను చేసిన మొదటి రకం
904,అన్నం ఎలా వండాలో దాని తరువాత కొద్దికొద్దిగా ఎగ్ గుడ్డు కు గుడ్డు ఆమ్లె ఎగ్ ఆమ్లెట్ ఎట్ల చెయ్యాలో ఎగ్ రైస్ ఎలా చెయ్యాలో నేర్చుకున్నాను
905,వాటినే కాకుండా నేను తీపి పదార్ధాలు కూడా చేయడం నేర్చుకున్నాను ఎలా అంటే మొదటిగా నేను చేసింది సేమ్యా
906,వాటిని నేను అందరూ చేసే విధంగా కాకుండా డైరెక్ట్ కొంచెం వేరే పద్ధ వేరే విధంగా చేసాను మంచిగనే వచ్చింది కాకపోతే అంతగా రుచిగా రాలేదు మొదటిసారి అయ్యే సరికి
907,అవే కాకుండా ఏ వంటకం అంత సులువుగా చెయ్యలేము మొడటిసారి చేసేటప్పుడు మనకి ఎన్నో అనుమానాలు ఎంతెయ్యాలి అని అన్నీ వస్తాయి
908,కాకపోతే అదొక అనుభవం లాగా ఉంటుంది మనకి అది రెండోసారి తప్పు చెయ్యాకుండా ఉంటాము మొదటి సారి తప్పు ఏమన తప్పు చేస్తే
909,నేను చాలా రకాల వంటలు చేసాను ఇప్పటి వరకు నేను అన్ని వెజ్వే చేసాను అంటే అన్నికూరగాయలతోటే చేసాను ఎందుకంటే నేను నాన్ వెజ్ తినను కాబట్టి వెజ్ కూరలు అన్నీ తొందరగా కొన్ని తొందరగా అవుతాయి కొన్ని తొందరగా అవ్వవు
910,ఇవన్నీ నేను యూట్యూబ్లో చూసి చెయ్యటం నేర్చుకున్నాను ఇంకా మా
911,చుట్టాల్లో మాకు తెల్సిన వాళ్లు చెప్పడం ఈ వంటని ఇలా చెయ్యండి ఆ వంటని ఆలా చెయ్ చెప్పడంతో నాకు బాగా ఉస్తాహంతోటి నేను
912,వంటలు చెయ్యడం నేర్చుకున్నాను అదే కాకుండా రోజూ వండటం వల్ల మనకి ఇంకా బాగా
913,ఈజ్ తొందరగా మనకి వంటలు వస్తాయి ఇంకా రుచిగా వస్తాయి కానీ ఈ వంటల్లో ఏంటంటే ఒకసారి చేసిన
914,వచ్చే టేస్ట్ మళ్లి మనకి రెండో సరి రాదు ఎందుకంటే
915,ఒకసారి ఒకొక్క ఒక టేస్టే ఇంకోసారి ఇంకోటి ఎగస్ట్రా ఏసినా గానీ ఆ టెస్టు అస్సలు రాదు ఇంకా తీపి పదార్ధాలైతే ఒకసారి తియ్య తియ్యగా
916,బాగా సరిపోతుంది తీపి బాగా సరిపోతుంది కానీ ఇంకోసారి ఆ తీపి సరిపోదు ఇలాంటివి జరుగుతా ఉంటాయి కాకపోయినా గానీ నేను ఈ తీపి పదార్ధాలు
917,ఎక్కువ ఇంట్రెస్ట్ ఉండడం వల్ల వాటిని చేసేదాన్ని ఆలా ఒకసారి నేను బాదాంలడ్డు ట్రై చేసాను కాకపోతే అది అస్సలు సులభం కాదు
918,కానీ నేను ట్రై చేసాను ఆఖరికి అది మంచిగా రాలేదు అంటే మొత్తం మాడిపోయింది అదంతా వేస్ట్ అయ్యింది
919,ఆలా ఇట్లా వంటలు చేస్తూ నేను అనుభవం తెచ్చుకుంటున్నాను ఇంకా ఏ వంట ఫస్ట్ మొదటి సారిగా మనకి
920,అదే తొందరగా రాదు ఇంకా అంత రుచిగా రాదు కాని మనం ఆపకూడదు మనకి న వంట నచ్చితే
921,మనం వండుతా ఉంటే అదే మంచిగ ఎప్పటికో ఏ రోజుకో ఒక రోజుకు ఒక పూటకొస్తుంది
922,హలో
923,గుడ్ ఈవెనింగ్
924,జలుబు జ్వరం ఒకటి జలుబు దగ్గు ఒకటేనా
925,లైట్గా ఉందా
926,అయితే డోలో సిక్స్ఫిఫ్టీ ఇంకోటి యాంటిబయోటిక్ చుపిచ్చినా అది వచ్చి ఉంది కదా ఒకటి
927,ఆ రెండూ ఏసుకోండి రెండు పూటలు వాడండి
928,పొద్ద్ పొద్దున్న రాత్రి వేడి నీళ్లల్లో వాడండి మళ్ళా
929,అది అది ఏమౌ ఒకటి రాసిస్తాను మిగతాది తీసుకోండి
930,ఎక్కువ టీ తాగకండి ఎక్కువ టీ తాగకండి కాఫీ ఎం తాగకండి
931,అది అదేమా కోకోనిట్ వాటర్ తాగండి అట్లే
932,అది ఒక రెండురోజులు వాడండి మీకు దగ్గు రాసినా కదా దగ్గువి అవి ఒక రెండురోలు వాడండి మళ్ళా అవి గూడా
933,అదే మల్లా ఎక్కువ కూల్ వాటర్ తాగకండి
934,ఇంకేమన్ననున్నయా
935,వేడి నీళ్ళల్లోనే తాగాల
936,ఎక్కువ స్ట్రెస్ తీసుకోకండి ఏక్కువ ఆలోచించకండి సరేనా
937,అదే ముందులవి టాబ్లెట్ ఒకటి రాసినా టాబ్లెట్ ఒకటి ఏసుకోండి
938,తగ్గుతది రెండురోజులు వాడితే తగ్గుతది కంటిన్యూ వాడండి రెండు రోజులు వేడి నీళ్లల్లో
939,ఇంకేమున్నాయి
940,ఒకేనా
941,సరే సార్ నేను నేను ఇచ్చిన టాబ్లెట్స్ వాడండి సరేనా
942,సరే
943,చెప్పు మా
944,ఓకే అమ్మా నిన్నయితే బానే ఉన్నాడు నిన్న మధ్యాహ్నం దాకా మళ్ళీ మధ్యాహ్నం నుంచి డల్గా ఉన్నాడు మరి నిన్నంతా ఏం పెట్టినారమ్మా నిన్న సాయంత్రం మార్నింగ్ ఏం పెట్టి పంపించినారు స్కూల్కి టిఫిన్ పెట్టినారా లేకపోతే ఇంకేమన్నా పెట్టినారా
945,వేడినీళ్ళే ఇవ్వండమ్మా ఆకుకూరలు వేడినీళ్ళే ఇవ్వండి ఆకుకూరలు అవీ బాగా పెట్టండి రేపు హాస్పిటల్కి వెళ్ళి తీసుకుని మళ్ళీ రేపు వచ్చి స్కూల్లో వదిలేయాలమ్మా
946,ఇప్పుడు చానా చాలా రకాలుగా ఫీవర్లు అవి వస్తన్నాయి కాబట్టి బ్లెడ్టెస్ట్ అవి చేసుకుని కొంచెం జాగ్రత్తగా చూసుకోండమ్మా రేపు తగ్గిన వెంటనే నాకు మళ్ళీ తీసుకొచ్చి స్కూల్లో వదలాల
947,సరేమ్మా సరేమ్మా రేపు నాకు ఏదో రేపు నాకు ఏదోకటి కాల్చేసి చెప్పాలి లేకపోతే స్కూల్ కాడకి వచ్చయినా చెప్పాలి లేకపోతే
948,సరేమ్మా రేపు నేను చూసుకుంటాను గానీ అమ్మా ఈరోజు అయితే డల్గా అయితే లే యాక్టివ్గానే ఉన్నాడు బానే ఉన్నాడు
949,రేపు కావాలంటే హాస్పిటల్కెళ్ళి చూపిచ్చుకుని తరవాత రండి సరే
950,సరేమ్మా రండి తీసుకుని సరే
951,సరే మేడమ్ థ్యాంక్స్ మేడమ్
952,రెండు వేల పదిహేడు వరకు ఇంటర్నెట్ అనేది తక్కువగా ఉండేది చాలా స్లోగా ఉండేదండి పాతకాలంలో కీప్యాడ్ మొబైల్ ఎక్కువగా ఉండేది స్మార్ట్ ఫోన్ లేవండి అప్పుడు రిలయన్స్ సంస్థ కీప్యాడ్ మొబైల్ను ఎక్కువగా పరిచయం చేసింది కాలక్రమేన ఇప్పుడు స్మార్ట్ ఫోన్ లిస్టు ఎక్కువైంది
953,నాలుగు జి నెట్వర్క్ వచ్చింది ముందుగా ఇప్పుడు సెట్టింగ్స్ నెట్వర్క్ కూడా వచ్చిం వచ్చిందండి నెలకు మూడొందల రూపాయలు రీఛార్జ్ చేస్కొని రోజుకి రెండు జీబీని ఇంటర్నెట్ అన్లి అన్లిమిటెడ్ కాల్స్ ఆఫర్ ఉంది నేను జియో
954,నాలుగు జి సిమ్ వాడుతున్నాను రోజువారి రెండు జీబీ నెట్ అయిపోతే వన్ జీబీ నెట్వర్క్
955,పదిహేను రూపాయలకి మళ్ళీ డేటా వస్తుందండి రీఛార్జ్ చేస్కుంటే
956,వస్తుందండి ఇరవై రూపాయలు డేటా రీఛార్జ్ చేస్కుంటే వన్ పాయింట్ ఫైవ్ జీబీ డేటా వస్తుందండి అవునండి ఓకే అండి
957,చెప్పండి
958,బావున్నానండి మీరెలాగున్నారు బావున్నారా
959,అదే ఇంకొద్దిగా ఇవ్వాల్సిన వాళ్ళు డబ్బులు ఇవ్వట్లేదండి ఇచ్చాక కట్టేస్తానండి
960,అదే ఈ నెక్స్ట్ మ వచ్చే మంతు లేకపోతే వాళ్లివ్వగానే కట్టేస్తానండి
961,వడ్డీ ఏం లేదు లేండి కట్టేత్తాను
962,లేదండి లేదు కట్టేత్తానండి యాడ డబ్బులు రాగానే కట్టేత్తను
963,డబ్బులు ఇవ్వాల్సినొళ్ళు ఇవ్వట్లేదండీ ఇవ్వగానే కట్టేత్తనండి
964,అవునండి అదే ఇచ్చేస్తాను
965,చూస్తానండి ఒక రెండు నెలల్లో చూసి
966,లేదండి ఒక రెండు నెలల్లోపు కట్టేస్తాను
967,అవునులేండి ఒక రెండు నెలల్లో కట్టేస్తనండి
968,ఎల్తానండి రెండు రోజుల్లో ఎళ్లి శుభ్రం చేసుకొంటానండి
969,సరే అండి
970,మర్చిపోనండి చూసి ఇచ్చేస్తానండి
971,ఇచ్చేస్తానండి
972,సరే అండి ఇచ్చేస్తానండి ఓ రెండు నెలల్లో చూసి ఇచ్చేస్తాను ఒకవేళ ఇవ్వకపోతే అప్పుడు ఇచ్చేసుకుందురు లేండి
973,సరే
974,జారుఖండ్ డెభై తొమ్మిది లక్షల డెభై వేల హెక్టార్లు భౌగోళిక విస్తరణంలో ఉంది
975,వ్యవసాయం నుండి మేము పొందుతున్న ఈ రైతుబంధు రైతు బీమా మాత్రమే
976,ఇగ ఈ రైతుబంధు మాత్రమే కాకుండా
977,ప్రజలు పంటకు
978,విత్తనాలకు విత్తనాలు గాని పనిముట్లను గాని ప్ర ప్రభుత్వం అనేటువంటిది అందించ అందించడం అనేది జరుగుతే చాలా బాగుంటుందని అనుకుంటున్నాను అలాగే
979,ప్రభుత్వం యొక్క
980,పంట పంట అనేది నష్టపోయినప్పుడు పం ప్రభుత్వం అనేది పంట నష్టపరిహారం అనేది ఇస్తే బాగుంటుందిని నేను అనుకుంటున్నాను
981,అలా ఇవ్వడం వలన ప్రజలకు
982,వారు పెట్టుకున్నటువంటి పెట్టుబడులు అప్పులు
983,తీర్చడం సులువు అవుతుంది ఈ ప్రభుత్వం అనేటువంటిది ప్రజలకు రైతులకు
984,రుణాలు ఇచ్చి వాటిని మాఫీ చేయడం అనేది చేస్తే బాగుంటుంది అననుకుంటున్నాను
985,ప్రభుత్వం నుంచి రైతు బందే కాకుండా రైతులకు పనిముట్లు గాని వారి విత్తనాల గాని
986,ఉచితంగా సరఫరా చేస్తే రైతులకు చాలా సులభతరం అవుతుంది అనుకుంటున్నాను
987,అలాగే రైతులు పండించే పంటలకు మార్కెట్లో ధరలు కొంచెం ఎక్కువగా పెంచితే
988,బాగుంటుంది ప్రజలకు కూడా రైతులకు కూడా కొంచెం లాభదాయకంగా ఉంటుంది మరియు వాళ్ళు పెట్టిన పెట్టుబడులు వాళ్ళకు వెళ్ళే విధంగా ఉంటుందని
989,అనుకుంటున్నాను
990,అలాగే
991,ఒక ఎకరం ఉన్న రైతుకు తక్కువగా ఎక్కువగా
992,భూమున్న రైతులకు ఎక్కువగా డబ్బులు ఇవ్వడం జరుగుతుంది కానీ అందరికీ ఒకే విధంగా డబ్బులు ఇస్తే బాగుంటుందని నేను అనుకుంటున్నాను
