id,ref
1661,అదేవిధంగా మాకు నవరాత్రి కొలువులు ఎక్కువగా జరుగుతూ ఉంటాయి ఉగాది పండుగను చాలా అంగరంగ వైభవంగా జరుపుకుంటాము
1662,తూర్పుగోదావరి జిల్లా పశ్చిమ గోదావరి జిల్లా
1663,నరసాపురం జిల్లా కోనసీమ అంబేద్కర్ జిల్లా కర్నూల్ జిల్లా
1664,నాకు అన్నింటికంటే ఇష్టమైన ఆట కబడి
1665,కబడి ఎందుకు అంటే అది ఒక ఆంధ్ర స్థానిక కెల్వి
1666,ఎందుకంటే ఇది రైలీలు బాస్కెట్ బాల్ మరియు వాలీబాల్ వంటి కేల్వీలుగా ప్రసారం అవుతుంది ఈ కేల్వీలలో రెండు తండ్రిలు పందిరి అడిగి
1667,ఒకరికే ఇంటర్నేషనల్ టీంను ప్రతిష్టించారు కేల్వీలు ప్రాణాల కోసం పరుగుల ప్రధానం చేశారు
1668,కబడీ ఆట ప్రవాహాన్ని బ్యాక్ బోన్ లైన్ ప్రయత్నానాం
1669,లాబ్ డిఫెన్స్ మరియు రేడియంట్ లైన్ ప్రత్యామయం మొదలైన నిర్వాహనలుగా
1670,కార్యకల్పిస్తారు గేమ్ నియమాలను పాటిస్తుంటే కబడ్డి ఒక ఆకర్షణీయ మరియు ఉత్తేజిక కేల్వీగా
1671,గుర్తింపు పొందింది కబడీ ఆట ఒక హంసత్వం బలం
1672,తీవ్రత సమరాన్ని అందుకోవడం మరియు సహాయక తండ్రులు ఒకరితో మరియు ఉండుతో ఆడటంగా వివరించగలరు
1673,కేల్వీలో రెండు తండ్రులు పందిరి అడిగి ఆడాలనే ముఖ్య లక్షం ఉంటుంది ఇది రెండు సమయాలు ఉంటుంది
1674,ప్రతీసారి తండ్రులు వాటనికి భాగ్యపడిపోతారు ఒక తండ్రుని తన పాలనలో ఏర్పాటు చేసుకోవడం
1675,మరియు వాడిని ఎక్కువ సమయం ఆడ్డం కేల్వీలో ముఖ్యం ఈ కబడ్డి ఆట కేల్వీలో ఆడాలనే కోరికగా ఉంటుంది
1676,నేను ఇయర్ రింగ్స్ అనేవి ఆర్డర్ చేశాను ఆ ఇయర్ రింగ్స్ చూడ్డానికి చాలా అంటే చాలా బాగున్నాయి అవి కాస్ట్ కూడా చాలా తక్కువ ఆ స్టోన్ ఐటెం కూడా వైట్ వచ్చి వాటికి పింక్ కలర్ ఒకటి వచ్చింది గ్రీన్ ఒకటి వచ్చింది
1677,నా ఇయర్ రింగ్స్ నా హారంకి వాటికి బాగా సెట్ అయింది నేను ఫోన్లో చూసేటప్పుడు అంతగా ఏమీ నచ్చలేదు కానీ బట్ ఆర్డర్ చేసాను బయట ఎలా ఉంటాయి అనేది ఆ ఇయర్ రింగ్స్ చాలా బాగున్నాయి అవి కొంచెం పొడవు రావడం వల్ల బాగున్నది బుట్ట కింద బుట్ట వచ్చి చిన్నపైన స్టోన్ల వచ్చింది నాకైతే చాలా నచ్చింది
1678,అందుకనే నేను ఆర్డర్ చేసుకున్నాను కాస్ట్ కూడా రీజనబుల్గానే ఉంది ఎవరైనా ఆర్డర్ చేసుకోవచ్చు అలా అని ఐటం కూడా కొన్ని ఒక టు వీక్స్ త్రీ వీక్స్ యూస్ చేసే యూస్ చేయగానే పాడైపోతాయి కానీ ఈ ఐటెం అలా లేదు కలర్ కోటింగ్ అవన్నీ బానే ఉన్నాయి నాకైతే చాలా నచ్చింది
1679,నా వర్చువల్ పేమెంట్ అడ్రస్సు ఎనిమిది ఒకటి ఐదు ఆరు ఆరు ఐదు ఆరు ఎనిమిది ఏడు తొమ్మిది మూడు అట్దిరేట్అఫ్ వైబిఎల్ నుండి ఆరు మూడు రెండు తొమ్మిది మూడు ఎనిమిది ఎనిమిది ఒకటి ఒకటి ఎనిమిది ఐదు అట్దిరేట్అఫ్ ఎస్బిఐకి మార్చు
1680,పిల్లి
1681,మాస్కో న్యూయార్క్ రోమ్ సింగపూర్ ముంభై
1682,కోనసీక జిల్లాలో ప్రధానంగా సాంస్కృతికంగా జరుపుకునే పండుగలు ఏమిటంటే ఒకటి సంక్రాంతి అందరూ జరుపుకుంటారు
1683,సంక్రాంతి తర్వాత ఉగాది చేస్తారు ఉగాది తర్వాత దీపావళి వినాయక చవితి దసరా
1684,ఇవన్నీ కూడాను సాంప్రదాయంగా వచ్చిన పండుగలే మన పూర్వీకుల నుండి వస్తున్నాయి అలాగే ఇంకా
1685,ఇతర మతాల పత పండుగలు ఏమిటంటే క్రిస్మస్ అలాగే గుడ్ ఫ్రైడే ఈస్టర్
1686,ఇలాంటివన్నీ కూడా వారు జరుపుతారు ఇంకా ముస్లింస్ సోదరుల దగ్గరికి వస్తే ఈద్ అని బక్రీద్ అని ఇలాంటి పండుగలు కూడా వారు జరుపుకుంటారు మన కోనసీమ జిల్లాలో ప్రతి ఒక్కరు కూడా
1687,ఎటువంటి ఇబ్బందులు లేకుండా ఒకరినొకరు శుభాకాంక్షలు చెప్పుకుంటూ ప్రతి ఒక్కరి
1688,పండుగకు ఎవరైతే ఉంటారో అవతల వాళ్ళకి శుభాకాంక్షలు చెప్పుకుంటూ ఎటువంటి గొడవలు లేకుండా జరుపుకుంటాము
1689,ముందుగా మనము సంక్రాంతి గురించి మాట్లాడుకుంటే సంక్రాంతి మూడు రోజులు అంటే భోగితో మొదలవుతుంది భోగి సంక్రాంతి కనుమ మకర కనుమ ఇలా కొన్ని జరుగుతాయి అందులో ముందుగా స భోగి రోజు అందరూ
1690,పాత కట్టలు ఏవన్నా పాత వస్తువులు ఉంటే వాటిని కాల్చి దానిమీద
1691,నీళ్లు కాచుకుని తరువాత తలస్నానం చేస్తారు అలా తలస్నానం చేసిన తర్వాత వారి ఇంట్లో ఏదో ఒక
1692,కొంచము ఎప్పుడు వండలేని ఒక వంటలు వండుతారు కొంచెం అరుదైన వంటలు అంటే పిండి వంటలు కానీ లేకపోతే బిర్యానీ అని కానీ ఏదో ఒకటి వండుతారు
1693,అలా ఒక్కొక్క రోజు ఒక్కొక్క పదార్థాన్ని వాళ్లు వండుతూ ఉంటారు ఇలాంటప్పుడు వారు దేవుళ్ళకి కూడా పూజలు చేసి నైవేద్యాలు అనేవి కూడా పెడుతా ఉంటారు
1694,ఇక ఊరు ఉగాదికి వచ్చే సమయానికి వేప పచ్చడి ఉగాది పచ్చడి అనేది ప్రధానంగా చేస్తారు అది ప్రతి ఒక్కరు కూడా బాధ్యత తీసుకోవాల్సిన పండుగ ఎందుకంటే అది తెలుగు వారి పండుగ అని మనము
1695,చెప్తూ ఉంటారు తెలుగు క్యాలెండర్ అనేది ఉగాది రోజు నుంచే మొదలవుతుంది ఇంకా మనం చెప్పుకోవాల్సినవి దేవి నవరాత్రులు ఆ నవరాత్రులు రోజు
1696,ప్రతి ఒక్కరోజు ఒక్కొక్క అవతారంగా వారు అలంకరిస్తారు ఆ దేవిని
1697,అలాగే అయిన తర్వాత సభారాధనలు ఇలా జరుపుకుంటారు దీని తర్వాత
1698,క్రిస్మస్ ఉంటుంది అంటే క్రైస్తవులు క్రిస్మస్ జరుపుకుంటారు అది డిసెంబర్ ఇరవై ఐదున జరుపుకుంటారు
1699,ఈరోజు వాళ్ళు ఏం తిట్టారంటే వారు కూడా వారి ఇంట్లో ఒక ప్రముఖమైన
1700,ఆహారాన్ని అంటే ఎప్పుడు తరచుగా వండేది కాకుండా కొన్ని వెరైటీలు అనేవి వండుకుంటారు బిర్యానీ అని
1701,ఇలాగా కొట్టి అసాధారణ వంటకాలు వండి వారు ఆడదాని వ్యక్తపరుస్తూ అందరికి శుభాకాంక్షలు చెబుతూ ప్రతి ఒక్కరిని
1702,వెల్కమ్ చెప్తూ ఉంటారు అలాగే నూతన సంవత్సరం కూడా అందరూ జరుపుకుంటారు ఇంగ్లీషులో దాన్ని న్యూ ఇయర్ అంటారు
1703,ప్రతి ఒక్కరు కూడా న్యూ ఇయర్ని సెలబ్రేట్ చేసుకోవడం మనము చూస్తూనే ఉంటాం ఇలాగే దీపావళి రోజు కూడా అంతే దీపావళి అంటే నరకాసురుని వధించిన తర్వాత జరుపుకునే పండుగల కింద మనం పూర్వీకులు మనకి కథల ద్వారా తెలుస్తుంది
1704,ఆ రోజున పిల్లలందరూ బాంబులు వేసుకుంటారు పటాకులు కాలుస్తారు కాఖరిపోవొత్తులు ఇలాంటివన్నీ కాల్చి విజయాన్ని వారు ఇంటి ముందే జర వ్యక్తపరిచినట్లు ప్రతి ఒక్కరి ఇంటి దగ్గర ఏదో ఒక దీపం అనేది వెలుగుతూ ఉంటుంది ఆ రోజు
1705,కాకపోతే ఈ మధ్యకాలంలో ఆ దీపావళి రోజు కాలుష్యం అనేది మరింత పెరుగుతుంది రోజురోజుకీ కాలుష్యం అనేది పెరుగుదల ఉండడంతో మనం ఈ
1706,ఈ మధ్యకాలంలో దీపావళి జరుపుకోవడం అనేది తగ్గింది చిన్న చిన్నగా జరుపుకుంటున్నారు తప్ప ఎటువంటి బాంబులు పెద్దపెద్ద బాంబులు వేయడం అలాంటివేమి జరగట్లేదు
1707,సూర్యలక్షి వెంకటలక్ష్మి శ్రీదేవి నాగలక్ష్మి సునీత బేబీ
1708,ఇప్పుడు ముప్పై అట్టపెట్టెలు కాక్ స్పెషల్ ఆకుపచ్చ రంగు పొడి ఏ ధరకి వస్తుంది
1709,ఏడు సున్న తొమ్మిది ఎనిమిది ఆరు నాలుగు సున్న నాలుగు తొమ్మిది ఐదు ఐదు ఎట్ ది రేట్ వయ్ బి ఎల్ నుండి నాకు ఏడు వందల రూపాయలు వచ్చాయేమో చూసిచెప్పు
1710,నాకు పావ్ భాజీ వండే విధానం చెప్పు
1711,రండి మేడం
1712,అది మన ఇప్పుడు ప్రస్తుతానికి మన యూనివర్సిటీకి చాలా తక్కువలో ఉంది
1713,టాప్ టెన్కే మనకే చాలా తేడా ఉంటే ఎందుకా ఏంటీ ఏమవుతుందన్న విషయం మరి నాకైతే తెలీదు అక్కడుండి చూస్కోవాల్సి చెయ్యవలసింది మీరే
1714,కాబట్టి ఇప్పుడిదాకా ఏంజరిగిందన్నది మాకు అనవసరం ఇప్పుడేంటంటే ఈ యొక వెంకటేశ్వర యూనివర్సిటీ అనేది ఈ తిరుపతనేది బ్రాంచ్ అనేది రెండు వేల ఇరవై ఐదు కల్ల టాప్ టెన్లో ఉంటది దానిగురించి మీరేం చేస్తారనేది మాకు తెలీదు
1715,రెండు వేల ఇరవై ఐదు కల్ల ఈ వెంకటేశ్వర యూనివర్సిటీ అనేది టాప్ టెన్లోకి రావాలి దానిగురించి మీరేమన్నా మాట్లాడదామనుకుంటున్నారా
1716,అంటే మీకంటే ఏమన్నా ఏమన్నా చెబ్దామ్ ఏమన్నా కావాలి అవసరాలేమన్నా ఉన్నాయా నేను చేయవలసినవి ఏమన్నా
1717,టీచర్సు లెక్చరర్స్ అందరూ బానే చెప్తున్నారందరూ
1718,మీరు చేయించాలి కదండీ మేము ఎప్పటికప్పుడే మెయింటెనెన్స్ చార్జెస్ అని కట్టా వేస్తున్నాం మరి మీరేం చేస్తున్నారు మరి
1719,మేము ఎప్పటికప్పుడు అమౌంట్ పంపినప్పుడు మీరు అదంతా చూస్కోవాలి కదా అయినా ఎడ్యుకేషన్ అదీ సరిగ్గా లేదని టాక్ ఒచ్చింది మీరేమో బానే ఉందంటున్నారూ
1720,ఫస్ట్ ఆఫ్ ఆల్
1721,మాకెవరు చెప్పారు అండం కాదు మేడం మాకు తెల్సింది టాక్ ఒచ్చింది స్టూడెంట్స్ నుంచి ఒచ్చింది టాక్ అది ఏంటంటే
1722,మా ఒకసారి వినండి మేడం ఎందుకంటే టీచర్స్ లెక్చరర్స్ సరిగ్గా చెప్తేనే స్టూడెంట్స్ని మనం ఏదన్నా అడగడానికి ఉంటది ఎందుకంటే లెక్చరర్స్ సరిగ్గా చెప్తలేదన్న మాటొస్తే వాళ్ళ పేరెంట్స్ వాళ్ళు కంప్లైంట్ చేస్తారు మనమేమీ చెప్పడానికనేది ఉండదు
1723,వాళ్ళు సరిగ్గా చెప్పారంటే మీ అ మేము చెప్పాల్సింది చెప్పాము మీ అబ్బాయి అసలు నేర్చుకోలేదు అని అనడానికనేది ఉంటది
1724,సో ఏంటంటే ముందసలు
1725,బానే ఉందని మీ మీరనుకోడం కాదు మేడం స్టూడెంట్స్కి కావాలి ఎందుకంటే స్టూడెంట్స్ వల్లనే టాప్ టెన్ టాప్ ఫైవ్ లోకి వెళ్లాలా టాప్ టెన్ లోకెల్డానికి అది కాదు మేడం వినండీ టాప్ ట్వంటీ టెన్ లోకి రావాలంటే అది సాధ్యమవ్వాలంటే స్టూడెంట్స్తోనే అవుతది
1726,మీరు మేము కూర్చోని మీరూ మీరూ స్టాఫ్ కూర్చుంటే అవ్వదు ఓకే నా మీరు మీరు ఒకసారి మీరు మీ యొక్క స్టాఫ్స్కి వార్న్ చెయ్యండి మీరు మీటింగ్ పెట్టండి ఒకసారి మీరు వార్న్ చెయ్యండి లేదంటే మాత్రం మేమొచ్చినప్పుడు ఒకసారి చెప్తామ్ ఆ బెంచి రిక్వైర్మెంట్ అనేది మేము మార్లోకసారి ఒచ్చినప్పుడు చూస్తాం దానికి సంబంధించీ ఇంకేమన్నా ఉంటే అప్పుడు చెబ్ధురుగాని ఇప్పుడీ విషయం మాటికి చాలా సీరియస్ గా తీసుకోవాలి మీరు
1727,సరే మేడం మీరింక వెళ్ళచ్చు
1728,పేపాల్ లో చేయాల్సిన పేమెంట్లకు నోటిఫికేషన్ ఆన్ చేయి
1729,ఉదయం ఆరింటికి అలారం పెట్టానేమో సరిచూడు
1730,ఎన్హెచ్ పద్నాలుగుపై టార్గెట్ కి దారి చెప్పు
1731,రెండువేల ఏడులో ఆయన నాలుగు మలయాళ చిత్రాలను విడుదల చేశారు అవి కళాభవన్ మణితో పాటు ప్రధాన పాత్రల్లో నటించిన అబ్రహం అండ్ లింకన్ మరియు సన్మా
1732,నా సప్తగిరి గ్రామీణ బ్యాంక్ అకౌంటులో ఇంకా ఎంత డబ్బు మిగిలి ఉంది
1733,బయట పార్టీలు చేసుకోవడం క్లబ్లకు వెళ్ళి మద్యం సేవించడం గ్రామాలల్లో
1734,అసలు జరగని విషయం గ్రామలల్లో ఇలాంటివి సహజంగా ఎవరూ అంగీకరించరు గ్రామాలల్లో ఎవరైనా కానీ ఉ పండగలప్పుడు
1735,మద్యం సేవించి వాళ్ళ ఇంట్లోనే ఉంటారు
1736,అందరూ కలిసి ఆనందంగా
1737,కుటుంబంతో కలిసి మెలిసి ఉంటారు
1738,కానీ ఎవరూ మద్
1739,ఎవరూ ఇలా క్లబ్లకు వెళ్ళి ఈ సంస్కృతిని అలవాటు చేసుకోవాలని అనుకోరు దీన్ని ఒక చెడు సంస్కృతిగా
1740,తెలంగాణలో సూచిస్తారు పెద్దలు కూడా ఇలాంటివి అసలు అంగీకరించరు
1741,ఖచ్చితంగా ఇలాంటివి
1742,తగ్గితేనే సమాజం బావుంటుందని నేను కూడా భావిస్తున్నాను
1743,ఇలాంటివి చాలా తగ్గాలి యువత కొంచెం ముందుకొచ్చి సాంస్కృతిక క్రీడలపైన
1744,సాంస్కృతికంగా సంప్రదాయకంగా వేడుకలు చేసుకోవడానికి ముందుకు రావాలి
1745,లేని యెడల ఇది పాశ్చాత్య సంస్కృతి కిందికి వెళ్ళి దేశం తన
1746,పట్ సహజత్వాన్ని కోల్పోతుంది
1747,మన సహజత్వం ఎప్పుడూ మనం కోల్పోకూడదు
1748,మాస్కో మనీ మనీలా ఖయోరో బ్యాంకాక్ బీజింగ్
1749,పక్షి
1750,ఒక మనిషికి కుటుంబం సమస్యలు ఆర్థిక సమస్యలు ఒక
1751,మనిషి చేసిన నమ్మకద్రోహం వంటి కారణాలు వల్ల ఎక్కువగా మాన మానసికంగా
1752,స్థితి కోల్పోవడం వల్ల కొందరు పిచ్చివాళ్లు అయిపోతారు కొందరు మెంటల్ డిప్రెషన్కి వెళ్లిపోయినా మానసిక సితి కోల్పోతారు అదేవిధంగా ఇలాంటి మానసికలు సమస్యలు ఉన్నవారు ఈ సమస్యను బయటికి చెప్పుకోడానికి ఇబ్బందిగా పడతారు అంతేకాకండా కొన్ని
1753,ఆరోగ్య సమస్యలు కూడా తలకెక్కుతాయి వీటి నుండి న్యాయం చేయటానికి కొన్ని సైకాలజీ హాస్పిటల్ కొందరు సైకాలజిస్ట్ ఉన్నారు
1754,మానసిక సితి సరిగ్గా లేని వారితో మనం చాలా జాగ్రత్తగా ఉండాలి అయితే మానసిక సితిలి
1755,అనేది బాగోదు లేనప్పుడు కొంతమంది జనాలు దీనిని లైట్ తీసుకుంటారు కానీ మనకు అందరూ సీరియస్గా తీసుకుని దీన్ని ట్రీట్మెంట్ స్టార్ట్ చేస్తారు డాక్టర్సు
1756,ఉగాండా సైనికులకు ఎలాంటి ప్రాణనష్టం జరగలేదని సోమాలియా నియోగి రక్షణ మంత్రి సలార్డ్ అలీ ఎల్లే తెలిపారు
1757,తెలుగు వారు తగ తమ గుర్తింపును సొంతం అనే భావాన్ని వ్యక్తీకరించడానికి వారి భాషను అనేక మార్గాలుగా ఉపయోగిస్తారు
1758,వారి భాష వారి సంస్కృతి చరిత్ర మరియు వారసత్వాన్ని ప్రతిబింబిస్తుంది
