id,ref
2159,అంటే ఇప్పుడు మామూలుగా అందరేమో ఇప్పుడంటే స్విమ్మింగ్ పూల్ అవన్నీ వచ్చాయి గానీ మేం పల్లెటూర్లో అక్కడ ఇక్కడ ఉంటాం కాబట్టి మా ఊర్లో బావులు అనేటివి ఉంటుండే
2160,అక్కడ నాకు మా నాన్నగారు మా అన్నయ్య వాళ్ళందరూ కలిసి నాకు ఈత నేర్పించారు
2161,అలాగే నేను కూడా మా గల్లీలో ఉన్న అంటే మా గల్లీలో కొంతమంది పిల్లలుంటారు
2162,వాళ్లు కూడా నేను ఈత నేర్పించడంలో చాలా సహాయపడ్డను ఈత అంటే ఇప్పుడు ఈత రాని వాళ్ళు ఈత డైరెక్టుగా వెళ్లి నీళ్లలో దుంకారనుకో అనుకో వాళ్ళకి ఈత రాదు వాళ్ళు మునిగిపోతారు
2163,వాళ్ళు మునిగిపోతారు కాబట్టి వాళ్లకు ఈత నేర్పియ్యాలి అట్లా నేను మా గల్లీల మా గల్లీల పోర్లకిగాని చిన్న అంటే పిల్లలకి
2164,ఈత చాలాసార్లు చాలామందికి నేర్పించానండి ఈత నేర్పించడంలో గూడా
2165,చాలా కష్టంగా ఉంటుంది భయం వదిలితే చాలండి ఈత ఈజీగా నేర్చుకుంటారు ఎవరైనా సరే
2166,భయం ఉందనుకో ఈత నేర్వలేము నీళ్లను చూసి భయపడడం కానీ మునిగిపోతానేమో ఏమన్నా అవుతుందేమో నాకని చెప్పి భయపడితే ఈత నేర్వలేం
2167,భయం భయం వదిలేసి నేను పట్టుదలతోటి నేను నీతో నేర్చుకుంటాను నేను నేర్చుకొని ఇంకొకరికి నేర్పిస్తాను అని చెప్పి మనకు పట్టుదల ఉంటే
2168,ఈత నేర్చుకోవచ్చు నేర్పించచ్చు ఎవరికైనా సరే అట్లానే నేర్పించాలి చాలామందికి ఇగ ఇట్లా ఈత నేర్చుకున్న గాని నాకు ఈత నేర్ ఇలా అంటే ఇలాగే నేను కొన్ని సందర్భాలలో అయినా విషయమైందంటే నేనంటే ఒకతానా ఒక ప్రాంటానికి ఒక గుడి దగ్గర ఉన్న ప్రాంతానికి వెళ్ళాను
2169,అంటే గుడి దగ్గర అంటే స్విమ్మింగ్ పూల్ అంటే గుండం సంథింగ్ ఏదో అంటే గుండమనే అంటారు మ్యాగ్జిమం గుండంలో అంటే స్నానం చేస్తుంటే
2170,అంటే ఒకతను అంటే మునిగిపోతుండో అంటే ఒడ్డుకే ఉన్నాడతను కానీ మునిగిపోతుండో తేలుతుండో కానీ అయితే అంటే చేతులు పైకి తేలిపోయి పిలుస్తా ఉన్నాడు అరుస్తా ఉన్నాడు ఏంటి అబ్బా అని చూస్తే అతనికి ఈత రాదు ఈత రావట్లేదు మునిగిపోతుండు
2171,నాకు ఈత వచ్చు కాబట్టి నేను అప్పుడే నీళ్లలోకి గుండంలోకి దుంకేసి
2172,ఆయనను పైకి లాగే ఆయనను పైకెలా లాగానంటే నీళ్లలో మునిగిపోయే వారిని ఎట్లా పడితే అట్లా మనం అంటే తీసుకురాలేం బయటకి
2173,ఎట్లా అంటే ఇప్పుడు అతనివి చేతులు పట్టుకున్నమనుకోండి మనము ఈత కొట్టడానికి రాదప్పుడు మన చేతులు అయన చేతిలో ఉంటాయి కాబట్టి ఇద్దరం మునిగిపోతాం
2174,అందుకే ఈత మునిగి ఈతొచ్చినోళ్ళు మునిగిపోయినోళ్ళని ఎట్లా అంటే బయటకు తీసుకొస్తారంటే వాళ్ళ జుట్టు వెంట్రుకలు ఉంటాయి కదండీ జుట్టు పట్టుకుని
2175,పైకి లాగుతారు ఎక్కడ అంటే పల్లెటూర్లలో ఎక్కడైనా సరే ఎవరినైనా సరే ఎవరైనా మునిగిపోయే వాళ్ళుంటే
2176,వాళ్లకి అప్పట్లో చెప్తున్నాను అంటే జుట్టు పట్టుకుని ఇట్లా పైకి లాగుతారు ఇప్పట్లో వాటర్ అదేమంటారు ఎయిర్ ట్యూబ్స్ ఎయిర్ బాగ్స్ వన్నీ వచ్చాయి కానీ అప్పట్లో అలా ఉండేది ఇప్పుడు ఎయిర్ బ్యాగ్స్ అని వచ్చింది నేను కాపాడిన సమయంలో అతని దగ్గర ఎయిర్ బ్యాగ్స్ కానీ ఏ ట్యూబ్స్ లాంటివి ఏయి లేకుండే నేను అతని
2177,జుట్టు అంటే జుట్టు పట్టుకోవడం వల్ల ఏమవుతుంది అంటే అతనికి నొప్పి నొప్పి అప్పుడు తగ్గుతుంది మనల్ని బదులు జుట్టు పట్టుకుంటారు
2178,అప్పుడు అతన్ని ఈజీగా లాగచ్చు ఇప్పుడు మనం జుట్టు పెట్టుకోకుండా అతని చేతులుకాని కాళ్ళుకానీ పట్టుకున్నామనుకో
2179,అతన్ని మనం బయటకు తీయలేం ఎందుకంటే అతను మనల్ని పట్టుకుంటాడు భయంతోటి జుట్టు పట్టుకున్నామనుకో అతను నొప్పి తోటితన తలకాయ పట్టుకుంటాడు కాబట్టి
2180,అతన్ని మనము ఈజీగా బయటికి తీయొచ్చు అట్లా ఈత నేర్చుకోవడం వల్ల
2181,మనకు బాడీ ఫిట్గా మంచిగ ఉంటుంది ఎదుటి వాళ్ళకి సహాయం కూడా పడొచ్చు జీవితంలో చాలా నేను అంటే నేను మీకు చెప్పిన సందర్భం ఏందంటే
2182,ఈత అనేది ప్రతి ఒక్కరూ నేర్చుకోవాల్సిన ప్రక్రియ ది ఎందుకంటే ఈత నేర్చుకోవడం వల్ల అనేక లాభాలు మనం ఫిట్గా ఉంటాం
2183,అన్ని అన్ని మంచిగా ఉంటాయి ఈత వల్ల ఇంకో లాభమేందంటే హైట్ కూడా పెరుగుతారు ఎక్ససైజ్ హైట్కు సంబంధించిన ఎక్ససైజ్ అయితే అయితుంది ఈత కొట్టడం వల్ల అట్లా నేను
2184,చాలా మంది మా గల్లీలో పిల్లలకి ఈత నేర్పించే వాళ్ళను హైట్ హైట్ కూడా చేయించాను హైట్ చేయించాను నేను నేను రాత్రి చెప్పాను కదండీ ఒకటైన సందర్భం
2185,అతను మునిగిపోతుంటే అతన్ని పైకి లాగే సందర్భాలు కూడా ఉన్నాయి చాలా అట్లా సహాయం చేసినా కూడా
2186,అట్లా ఒకరికి సహాయం చేసిన అంటే ఇంకా చేశాను ఇంకా రెండు మూడు చోట్లల్లా అట్లా ఈత నేర్చుకోవడం వల్ల
2187,నేను కూడా వేరే వాళ్ళకి సహాయం చేయడం జరిగింది అది నేను అదృష్టంగా భావిస్తున్నాను ఎందుకంటే ఒకరిని కాపాడడం నా జీవితంలో చేస్తున్నానంటే అది ఎంత అదృష్టం అట్లా ఈత వల్ల నేను ఈత
2188,వల్ల కొంతమందికి నేర్పించాను కాపాడాను
2189,గ్రామీణ ప్రజలకు
2190,లీగల్ సిస్టం అనగా పోలీస్ శాఖ
2191,వైద్య శాఖ అయిన గాని వీటిల ద్వారా వచ్చే
2192,లాభాలు కన్నా కొద్ది డిస్టెన్స్ ఎక్కువ ఉంటది ఎలా అంటే వాళ్లని పోలీస్ శాఖ లీగల్ సిస్టమైన గాని
2193,హెల్ప్ చేసే విధంలో కొద్ది లేటే ఉంటది ఏ విధంగా అంటే అక్కడున్న సమస్తము అక్కడ ఉన్న పోలీస్ వాళ్లైనను అక్కడున్న రాజ్యాంగమైన సమస్యయైనను వాళ్ళని యూస్జెసే విధానంలో
2194,కొద్దిగా వె వెనక బడి ఉంటది
2195,ఏ తప్పయిన ఏమన్న ప్రాబ్లమ్ వచ్చిన ఎటువంటి ఏమయిన సమస్య వచ్చిన వెంటనే రూరల్ ఉన్న ప్రజలు పోలీసులకే అధికారులకే చెప్పగలుగుతారు కానీ అక్కడున్న స్టాప్ అక్కడున్న పోలీస్ పవర్ అక్కడ ఉన్న
2196,ఎస్ఐ గారు ఎవరైనా సరే గాని వీళ్ళ ఊరి ప్రజలని జ్ఞానం తక్కువ ఉందని ఒక మెంటాల్టితో వాళ్లని ట్రీట్ చేసే విధానంలో అంత త్వరగా కంప్లైంట్ తీసుకోవడం గాని ఎఫ్ఐఆర్ చేసే విధానం గాని వెనకబడి ఉంటారు సో ఇక్కడి నుంచి ప్రాసెస్ స్టార్ట్ ఆయ్యి ఎదయితుంటాదో
2197,పోలీస్ స్టేషన్ నుంచి లిగల్ సిస్టంకి వెళ్లే ప్రాసెస్ ఉంటాదో అది లేటే అయితుంటాది ఎందుకంటే కోర్టయిన కోర్టు సమస్యయినా కూడా పట్ణనం రావాల్సిందే
2198,గ్రామంలో పోలీస్ స్టేషను ఉండడం ఒకే గాని లా సంబంధించిన కోర్టు అవ్వన్నీ పట్టణంలో ఉంటాయి సో వాటి ప్రాబ్లమ్ కోసం ఏమయినప్పుడికును ఏమి చేయాలనుకున్నాను వారు పట్టణం రావాల్సిందే
2199,పట్నం వచ్చినాక పట్నం వాళ్ళ సిస్టమ్ ద్వారా లా సిస్టము ఎంత స్లో ఉంటదో వా అక్కడున్న సెక్షన్స్ అయినా గాని లాయర్స్ అయినా గాని దాని తీసుకున్న సిస్టమయినా గాని ఎంతో స్లో ఉంటాది సో దాని ప్రాసెస్లో ఈ ఎఫ్ఐఆర్ రాసే విషయంలో గాని ఈ విధానంలో సహాయమునకు లోనయి
2200,దీని ద్వారా ఈ సిస్టమ్ అనేడుది గ్రామ ప్రజలకి అంతా ఉపయోగం ఏర్పాటు విషయంలో అంతా స్వస్థత కాదు సో పంచాయితీ ద్వారా వాళ్ళకి ఈ సిస్టమ్ ఎట్టుందో వాళ్ళు పంచాయితీ వారు డీల్ చేస్తారు సో ఆ విధంగా న్యాయమయిన కూడా ఏమయిన కూడా
2201,గ్రామములోనే పంచాయితీ అనేది జల్దిన అయిపోతాది
2202,శరద్ పవర్ గురించి నాకు తాజా వార్తలు ఇవ్వు
2203,కుడి
2204,తూర్పుగోదావరి జిల్లా పశ్చిమగోదావరి జిల్లా కాకినాడ జిల్లా ఒంగోలు జిల్లా ప్రకాశం జిల్లా
2205,మనకి ఇప్పుడు వంటింట్లో ఉండే కరెంటుతో పని చేసే వస్తువులు ఏంటంటే అండి మనకి ఇప్పుడు స్టవ్ తీసుకోండి
2206,మనకి ఇండక్షన్ స్టవ్ అని ఇప్పుడు ఒకటి వచ్చింది అనమాట కొత్తగా కరెంటుతో పని చేసేది దాంట్లో కొన్ని స్టీల్ వస్తువులు పెడితేనే అది పని చేస్తుంది లేదంటే పగిలిపోతుందనమాట మనం వేరే ఏ స్టీ వస్తువులైనా ఇండక్షన్ స్టవ్ పైన పెట్టినప్పుడు
2207,సో మనకి ఇంతకు ముందు కరెంట్ పొయ్యి పైన వండుతుంటే ఆ టేస్ట్ ఎలా ఉండేదండి మనకి యాక్చువల్గా ఇప్పుడు మీరే కూడానీ
2208,ఒక గుండెలో హాఫ్ అర కేజీ చికెన్ ఒక స్టవ్ పైన వండండి అర కేజీ చికెన్ పొయ్యి పైన వండండి రెండిట్లో టేస్ట్ ఏది ఉందో మీరే చూస్కోండి ఎట్లా ఉంటాదనేసి
2209,సో మనకి ఆ కరెంట్ పొయ్యిపై కంటే మనకి కట్టెల పొయ్యి పై వండితేనే అదొక టేస్ట్ వస్తాదనమాట మనకి అదొక
2210,ఫ్లేవర్ అదొక స్మోకీ ఫ్లేవర్ మనకి మంచి టేస్ట్ ఉంటాదనమాట కట్టెల పొయ్యి పైన వండితేనే అదే బాగుంటుంది యాక్చువల్గా అండ్ ఇప్పుడు మళ్ళీ మిక్సర్
2211,మిక్సీ అనేది వచ్చేసిందనమాట ఇంతకు ముందు రోట్లో రుబ్బి రోట్లో ది దిన్నె పైన రుద్ది మనకి ఈ మన
2212,చట్నీలు ఊరగాయలు అవంతా చేసేవాళ్ళనమాట కానీ ఇప్పుడేమంటే అంతా సుళువై పోయింది
2213,చట్నీ కావాలా రెండు నిమిషాలు మిక్సీలో వేసి ఇచ్చేయడం చట్నీ ఇచ్చేయడమనమాట సో మనకి చానా ఇదే కష్టమైపోయిందనమాట మనకి
2214,ఈ కరెంట్ వస్తువులు వచ్చిన తర్వాత మనకి ఆ టేస్ట్ అనేది పోయేసింది మన పాత కాలంలో ఎంత బాగా రోట్లో మన పొయ్యి పైన వండుకుని తినుకుంటూ
2215,రోట్లో రుబ్బుకుని ఆ చట్నీ తింటూ ఎంత మంచిగా ఎంత హెల్తీగా స్ట్రాంగ్గా ఉన్నారంటే అంతగా ఉన్నారు
2216,ఇప్పుడు మనమేమంటే మనకి ఎలా అన్నీ కరెంటుతో వచ్చేసింది కాబట్టి మనం మిక్సీలలో ఇండక్షన్ స్టవ్ అవ్వంతా వాడుకుంటూ మనము
2217,దానిపైన మనము చాలా డిపెండెంట్ అయ్యి దానివల్ల మనకి సైడ్ ఎఫెక్ట్స్ చాలా వరకూ ఈ ఈజీ అంటే కష్టం లేకుండా సులువుగా అయిపోయేలాగా లేజీ అయిపోతున్నారనమాట మన వాళ్ళు
2218,అండ్ అదేవిధంగా గ్రైండర్ ఇంతకు ముందు మనం ఇడ్లీ పిండి దోశ పిండి రుబ్బుకోవాలంటే మనము రోట్లో రుబ్బుకునే వాళ్ళము సాఫ్ట్గా ఇడ్లీ సాఫ్ట్గా వచ్చేది దోశ సాఫ్ట్గా వచ్చేది
2219,మంచిగా పువ్వులాగా ఉండేది అవన్నీ కానీ ఇప్పుడు గ్రైండర్లో వేస్తున్నారు అది మెదుకుతుందో మెదగదో కొంచెం మెత్తబడిందంటే భిన్నే ఎత్తేస్తున్నారు మనకు ఇడ్లీలు చాలా గట్టిగా
2220,లేకపోతే రవ్వ రవ్వగా అదొకలాగా ఉంటుంది ఒకరోజు రెండు రోజులు అయిందంటే అది చెడిపోతుంది మనకి పిండి పాసిపోతుంది
2221,అదే రోట్లో రుబ్బుకుంటే ప్రశాంతంగా చేత్తో రుబ్బుకొని స తినే సంతృప్తే అది వేరేలాగా ఉంటుందనమాట అదేవిధంగా మనకి ఇప్పుడు ఓవెన్స్ అనేది ఒకటి వచ్చేసిందనమాట ఇప్పుడు లేటెస్ట్గా
2222,ఇంతకుముందు మనము ఈ కూర చేస్తే ఇది ఇంత సేపే ఉంటుంది దాని లోపల మనము దీన్ని పూర్తి చేసి తినేసేయాలి వృధా చేయకూడదు దీన్ని అనేలాగా అనుకుంటూ ఉంటాము దాన్ని అంత లోపలే తినేశాము కానీ ఇప్పుడు ఏమంటే ఓవెన్స్ వచ్చింది కాబట్టి
2223,మనము ఫ్రిడ్జ్లో పెట్టుకుంటాము కావాల్సినప్పుడు దాన్ని ఎత్తుకుని ఓవెన్లో పెట్టి వేడి చేసుకొని తినేస్తాం
2224,అది బాగుందా పాసిపోయిందా పాసిపోతుంది కదా ఆ కర్రీ లేదు ఫ్రిడ్జ్లో పెట్టాము ఓవెన్లో పెడితే వేడి చేస్తే బాగుంటుంది
2225,అని చేసుకొని తినేవాళ్లు కూడా చాలామంది ఉన్నారు సో ఓవెన్లు వచ్చినాక అందరూ ఇట్లా పాసిపోయిన తిండ్లు తింటూ వాళ్ళ హెల్త్ని చాలా స్
2226,పరిస్థితం చేసుకుంటున్నారనమాట సో ఓవెన్లు వచ్చిన తర్వాత ఇంకా ఇదిలాగా చాలా ఇది అయిపోయింది
2227,మాకూ దాదాపు కలెంట్ అనేది ఒక ట్వంటీ ఫోర్ అవర్స్ అనేది ఉంటుంది కాని విద్యుత్ కోత అనేది ఒక వర్షాకాలంలో మాత్రం
2228,చాలా ఇబ్బందిగా ఉంటుంది వర్షాలు పడటం ద్వారా చెట్లు ఇరిగిపడటం ద్వారా మాకు ఆ సీజన్లో మాత్రం కలెంటనేది చాలా తక్కువగా ఉంటుంది
2229,చాలా తక్కువ గంటలు ఉంటుంది నైటు నైట్ టైమ్లో కూడా కరెంట్ పోవడం జరుగుతుంది అసలు ఎప్పుడు పోతుందో ఎప్పుడు వస్తుందో కూడా తెలియకుండా మేము ఇబ్బంది పడటం జరుగుతుంది
2230,ఒక ఒక వర్షాకాలం తప్ప మిగతా అన్ని సీజన్లలో కూడా మాకు కొంచం కరెంట్ కోత అనేది బాగానే ఉంది
2231,కరెంట్ కోత లేకుండా బాగానే ఉంది ఒక వర్షాకాలంలో మాత్రం ఈ గాలీలు తుపానులు పిడుగుల ద్వారా
2232,మాకు కొంచం విద్యుత్ కోత అనేది చాలా మా జీవితాన్ని ప్రభావితం చేస్తుంది అంటే కరెంట్ లేక వంట చేసుకోలేక
2233,చదువుకోలేక పిల్లలు చాలా ఇబ్బందికి గురవుతున్నారు
2234,సులేమాన్ ఖాతాలు అతిశయోక్తి నివేదికలపై ఆధారపడి ఉన్నట్లు అనిపిస్తుంది ఇబ్న్ ఖల్దున్ ఏనుగుల సంఖ్యను ఐదు వేలుగా పేర్కొన్నాడు
2235,మా తోటలో నేను సంపంగి తోటలు సంపంగి తోటలో చేస్తా ఉండా ఆ సంపంగి తోట అనేది ఒక గడ్డ రూపంగా వస్తుంది అది ఒక గడ్డలు గడ్డలు తీసుకొని దాని శుభ్రంగా వలుచుకొని అది కొన్ని రోజులు కొన్ని రోజుల తర్వాత మల్ల దుక్కిని బాగా శుభ్రంగా దుక్కి చేసుకుని ఆ దుక్కిలో మామూలుగా దానికి కావాల్సిన సత్తువలు అంతా ఆ మట్టిలో కావాల్సింది ఏదో బీరువులు
